Job Title,Company,Location,Salary($),Job-Type,Job-Description,Raw_Link
Artificial Intelligence in Breeding Research Scientist,Corteva,"Hybrid work in Johnston, IA 50131",Not Provided,Not Provided,Become a part of Corteva Agriscience and help shape the future of agriculture with cutting-edge artificial intelligence research.,https://www.indeed.com/rc/clk?jk=fa9252c0b022f061&bb=Q_155EDFyB6FAI2VFB_LW9Vve1igsKjWyxlLkMClMjDh5NWgkf1bcnluZKa-uJOD_n_Bx1vB6nZ9X_QshGTWqYwQS2Qb-qDEqBaSB06F-lJyi0wHj6TB5h0RSRmaYdbR&xkcb=SoDT67M3-senIR6pGh0LbzkdCdPP&fccid=d2536e400fa1f147&vjs=3
Usability Researcher,Steyer,"Remote in Redmond, WA",Not Provided,Not Provided,"Steyer Content is a full-service content agency that uses world-class writing, video, code, and design to create transformative experiences that build trust and…",https://www.indeed.com/rc/clk?jk=64068751bb6bdf65&bb=Q_155EDFyB6FAI2VFB_LWyRuTbmb3i5RB96GCOW_FuMozJSSkp0t7rtn15ALO85SzMR69XQEtxwqgqa-30FrdHBDf4Ut6z3DLwudPZFGSvEHdiMZ5KCF7FySMsFCXloC&xkcb=SoBn67M3-senIR6pGh0KbzkdCdPP&fccid=ac5b54c450d29b96&vjs=3
Co-Op: Research Science,Rakuten,"Seattle, WA",$50 - $60 an hour,Part-time,"Our Technology Services Division (TSD) is at the forefront of Rakutens AI and Data initiatives, playing a pivotal role in enhancing the user experience and…",https://www.indeed.com/rc/clk?jk=42f9c70e614977cd&bb=Q_155EDFyB6FAI2VFB_LW-3GCdq-U44TBux1r8BKMOKS2b6CKi4ZSHuApXtJI9xsN5qRXE_6F0LDvNbb5zAY3vA5VbxlvS6BaLMP1REJ_1bW7V4bddRYfItKehtkmQtb&xkcb=SoD667M3-senIR6pGh0JbzkdCdPP&fccid=5e50810dc475b1eb&vjs=3
Administrative Specialist,Johns Hopkins University,"Hybrid work in Baltimore, MD 21218","$53,800 - $94,400 a year",Full-time,This includes the supervision of 3-4 administrative coordinator/Senior Administrative Coordinator positions and a Senior Events Coordinator position.,https://www.indeed.com/rc/clk?jk=8ea2bb4714d28fe8&bb=Q_155EDFyB6FAI2VFB_LW9JlmW6_OUl6MMKSEFYIpeynbnuVugwLa7xH9IVZXGbMwSQeM1K_rOIcaHthFxkswRPH1daPiSOQ7-9Mnt2AV7h01ngUumRS6w%3D%3D&xkcb=SoBO67M3-senIR6pGh0IbzkdCdPP&fccid=f34acbd24dd4fcb0&vjs=3
Program Manager III,Thermo Fisher Scientific,Remote,Not Provided,Not Provided,"In this role, you will facilitate productive use case-driven meetings, run data visualization tools like SharpCloud and PowerBI, and provide training to team…",https://www.indeed.com/rc/clk?jk=bf6a598394a4872a&bb=Q_155EDFyB6FAI2VFB_LW5a69Xpncjwb1ymJMOPyABVAljpx8vQjIVHCM-feShWv2BRRoGrmnGk0Hzd9upvukLeMT3c1yBaaXUzRKTCRoJm5EQyfzzp2Zg%3D%3D&xkcb=SoDA67M3-senIR6pGh0PbzkdCdPP&fccid=126e3afd205caa95&vjs=3
Co-Op: AI Application Engineer,Rakuten,"Seattle, WA",Not Provided,Not Provided,"Our Technology Services Division (TSD) is at the forefront of Rakutens AI and Data initiatives, playing a pivotal role in enhancing the user experience and…",https://www.indeed.com/rc/clk?jk=aa5c15da533b4633&bb=Q_155EDFyB6FAI2VFB_LWyGcLsJbDmTVi_3s445kLeGq3gVLWWn0W2Eq4oCAK2lDRPKtIdp75mVxUR5HzJkbHSsgEkeT5qHsV5TcFPAGpM107i4sByBgW1tDg5l80L59&xkcb=SoB067M3-senIR6pGh0ObzkdCdPP&fccid=5e50810dc475b1eb&vjs=3
Software Engineer - Solutions and Delivery,Genesys,Remote in Indiana,Not Provided,Not Provided,"Join the team and create the future of customer experience together.
As a Professional Services team, we integrate, extend, and expand Genesys products to match…",https://www.indeed.com/rc/clk?jk=597a6daa1b21f131&bb=Q_155EDFyB6FAI2VFB_LW7VX7UBdHy5tBDUDIKzVesBLGe95DUB_5eoedywo04hbnwUC7Z7oVHUfnaA3VWj5N9_gGVNCDdp_hbIP-CnjtJiIQKFktuX9zno75daOP4vo&xkcb=SoDp67M3-senIR6pGh0NbzkdCdPP&fccid=78ba8c9950e5297a&vjs=3
Marketing Analyst,Amped Fitness,"Saint Petersburg, FL 33710 (Jungle Terrace area)",Not Provided,Not Provided,"We are seeking a Marketing Analyst with a strong focus on leveraging automated systems, AI technologies, and advanced analytics to drive our marketing…",https://www.indeed.com/rc/clk?jk=6b899961e1e16265&bb=Q_155EDFyB6FAI2VFB_LWy9zEqhneRAcAPJ86z2SNL68frfwz6FZxhSYlfXbLO3BSrKiJRAl-ncymyVFnWyh7Jk8vRz19fYo_hRB6WE4_feATpIf2-DXPDwePyIWeqMp&xkcb=SoBd67M3-senIR6pGh0MbzkdCdPP&fccid=a761f9b3a89b7417&vjs=3
Security Engineer - Cloud Threat Modeling,Right Balance,Remote,Not Provided,Not Provided,"Our client is a global technology consultancy focused on designing and implementing secure, observable cloud architectures embracing everything as Code (EAC)…",https://www.indeed.com/rc/clk?jk=96a6e09589a64a02&bb=Q_155EDFyB6FAI2VFB_LW2NOO2fhlpwcuB8BhUWJ1WjV0OekkqI6YqtFLuC4BthS0hKa8Pk_pFEt5WI3eCdpk4YCfbcorBKOstpINSE63-jUaHZwThXfUNYVUbuFlGRf&xkcb=SoC067M3-senIR6pGh0DbzkdCdPP&fccid=12db11af404ca26b&cmp=Right-Balance&ti=Security+Engineer&vjs=3
eMarketing Coordinator,Williams Sonoma,"Hybrid work in San Francisco, CA 94111",Not Provided,Not Provided,This person will report to the Sr. Marketing Manager and support two Associate Email Marketers in developing and executing email marketing campaigns to increase…,https://www.indeed.com/rc/clk?jk=63544e711db01b2d&bb=Q_155EDFyB6FAI2VFB_LW9KWCbLNXtO-nWrxwIyx3rpNHdNe80e5TgXwFnJlzoJfcQk5iQ309SbXrmjM1xBclTf4eX7HtuqikogmP0ydi0VyBZX3Kphbiw%3D%3D&xkcb=SoAA67M3-senIR6pGh0CbzkdCdPP&fccid=cdd85c4d445cce0f&vjs=3
Sr Software Engineer,BlackLine,Remote,"$137,500 - $183,700 a year",Not Provided,"Adapts machine learning to areas such as virtual reality, augmented reality, artificial intelligence, robotics and other products that allow users to have an…",https://www.indeed.com/rc/clk?jk=77c24355bc78b6a6&bb=Q_155EDFyB6FAI2VFB_LWwsCJXY8dZtjI5W5vps86HLE5Uk8xY7Wq5pY5-yBVsjAKLbNK-wpQoOBY4AuJhva6tWA_t7pyH033AK9nUGc_Zd13x-P8vjLzJ5R1uMT7lV3&xkcb=SoCd67M3-senIR6pGh0BbzkdCdPP&fccid=59c7b888afaec443&vjs=3
Temp - Resident Accounts Manager,PeakMade,Remote in Georgia,Not Provided,Full-time,The Resident Accounts Manager will be responsible for day-to-day operations and financial functions of a portfolio of properties.,https://www.indeed.com/rc/clk?jk=662b6cfbc8699f78&bb=Q_155EDFyB6FAI2VFB_LWyPWl5l7py84yvSAg8eIf38Wamry86QDTlPyAP2kxvulb5qLwiWsZy66ETcMafTeraURVBA6YCYKFHDsIwjoXvdm9QfuFkUpHPW921a1j_uT&xkcb=SoAp67M3-senIR6pGh0AbzkdCdPP&fccid=46c79ad9c24bb29c&vjs=3
"AI Engineer, Healthcare Revenue Cycle",McKesson,Remote in Massachusetts,"$120,200 - $200,300 a year",Not Provided,"In this role, you will play a key role in designing and delivering cutting-edge AI solutions to optimize revenue cycle management for our clients.",https://www.indeed.com/rc/clk?jk=247d59a3883dc703&bb=Q_155EDFyB6FAI2VFB_LW-HZ8jC4roAwDkLOc78fYBRuRbVy19rHTkQsIi4D_A0tYGGL0Txf7TbiKaEmLMgJYh3gaDYNCUbtWop3mC5RHCDGwO894P7B3Q%3D%3D&xkcb=SoCn67M3-senIR6pGh0HbzkdCdPP&fccid=a7c5036618407010&vjs=3
Data Center Logistics Associate L1,"Milestone Technologies, Inc.","Temple, TX",Not Provided,Not Provided,"Milestone Logistics Specialists are responsible for safely moving all of the parts into, out of, and around the client Data Centers using a variety of…",https://www.indeed.com/rc/clk?jk=4e0ade883c802114&bb=Q_155EDFyB6FAI2VFB_LWxPHksvSdX0tAy-izcBEZDoQd9iMsh9tLKsPndCTcyo4zyMXe5yFPGazHMAe274ESS8Esa-WNGZfZQuPRs-c51zT6T3GM1icntyKVA7h1R3f&xkcb=SoAT67M3-senIR6pGh0GbzkdCdPP&fccid=2a4e80613bf74af0&vjs=3
Assistant Professor,Oregon Tech,"Wilsonville, OR 97070","$75,000 - $85,000 a year",Full-time,"This individual would be expected to cover classes from some of the following areas, but not limited to: design patterns, software engineering methodologies,…",https://www.indeed.com/rc/clk?jk=7143611756b2fad8&bb=Q_155EDFyB6FAI2VFB_LW1Mp957TGWHEJzJGFXA0x7Iv9wxrkRED5QA5edhZ3fmi7aDBA2njgeSrITWeOq8imDs6qdPpppxebyaiuUf1wRRqICIugR0O-dpSpjkbNJUp&xkcb=SoCO67M3-senIR6pGh0FbzkdCdPP&fccid=aca419b6b09f9e3c&vjs=3
