Job Title,Company,Location,Salary($),Job-Type,Job-Description,Raw_Link
Power Platform Developer,Workforce Opportunity Services,"Charlotte, NC",$56 an hour,Full-time,"The Microsoft Power Platform Developer will be responsible for designing, developing, and implementing high-quality applications using Microsoft Power Platform.",https://www.indeed.com/rc/clk?jk=b5e38e325252ed08&bb=ZBFGAsoSxHjl3iKTDt1OXsESeUM2w_BmOPa_wVGKohWCM1vfBVLP41tyhRYDapnAgXdqVHHfLC0Ca4ciHalYxqnkTGvb4QFKR1GnGkA0rZLsNnvCe7MpColi-eLolLjM&xkcb=SoBg67M3-segTQyU9Z0LbzkdCdPP&fccid=a1b85e534042e7c0&vjs=3
IT Helpdesk Engineer,Athelas,"Mountain View, CA 94041",Not Provided,Not Provided,And technological advancements — from electronic health record systems to dictation software — have failed to live up to their promise of making the lives of…,https://www.indeed.com/rc/clk?jk=db647359d9206665&bb=ZBFGAsoSxHjl3iKTDt1OXmpR7Vp64e9v1WHTcqO6Bk9gUSa6PV7YGDIBm9JSAdD0JFAihd1BkTtWWmkaBEihtuffnvEXbkQZnfU_qJZ-oSCeJGqua__0Ynf9XrDM56ze&xkcb=SoDU67M3-segTQyU9Z0KbzkdCdPP&fccid=35d650c9e54bdf3c&vjs=3
"Senior Public Policy Lead, Payments & Technology",Wells Fargo,"Hybrid work in Washington, DC 20006",Not Provided,Not Provided,"Reporting to the head of Public Policy Engagement, this position will develop advocacy strategies in support of public policy positions for Artificial…",https://www.indeed.com/rc/clk?jk=bd3269624ca884cf&bb=ZBFGAsoSxHjl3iKTDt1OXoQomzYB9_F1s0PbLdDLRzs2OrMxSnvVMHTMs1Fwf0zRmzSianqPbUPiUXgY5-DuOwbUNedCAEbQ_VKyLCcfDNSDvDrYeVylKw%3D%3D&xkcb=SoBJ67M3-segTQyU9Z0JbzkdCdPP&fccid=78bbcd26e39621f5&vjs=3
"Manager, Data Science - NLP",Capital One,"Hybrid work in McLean, VA",Not Provided,Full-time,"We partner with product, tech and design teams to deliver app features that delight customers with dynamic and personalized experiences, enable them to chat…",https://www.indeed.com/rc/clk?jk=12372dc27b524fff&bb=ZBFGAsoSxHjl3iKTDt1OXmbfW6RVgQjbve1nt-TahsYBzYQUkx8LTT1Kbfijt0pDzatvLkBJixJUK3ns99vYQTNksHt5pFc7CFjM8ItouIzjpWj66cflOg%3D%3D&xkcb=SoD967M3-segTQyU9Z0IbzkdCdPP&fccid=b85c5070c3d3d8c8&vjs=3
Artificial Intelligence (AI) Technology Sales Manager- US,ttg Talent Solutions,Remote,Not Provided,Not Provided,"Our client has the mission to contribute to a better society by providing their clients with the highest quality training data, helping them develop and test…",https://www.indeed.com/rc/clk?jk=339887e078264216&bb=ZBFGAsoSxHjl3iKTDt1OXjOTez44LIzJF58LENqcN62DA5OTd9gu5maHJSI56qWZ9HC7JeCk3R6mpAImtu-lb2T7WPN4Q9rhIBO4okLO4rjFcnuzCkXbZRx3OBLEjbWx&xkcb=SoBz67M3-segTQyU9Z0PbzkdCdPP&fccid=25dd03093e6b6cbb&vjs=3
Sourcing Specialist,LyondellBasell Industries,"Hybrid work in Houston, TX 77010",Not Provided,Not Provided,"The LYB Sourcing Specialist plays a crucial role in driving the success of a specific goods or services category within the company.
Serving as a change agent.",https://www.indeed.com/rc/clk?jk=65d61bc7dad571dc&bb=ZBFGAsoSxHjl3iKTDt1OXkxwGUFT2jFfppsAf1tz--w1ZRWxIrUy26kXC4Jb88-Vj05PdezLhQ6PlWzEF7ukbgjYuehEfmRQmKsRgwNYLzH3b-WOLezXlw%3D%3D&xkcb=SoDH67M3-segTQyU9Z0ObzkdCdPP&fccid=5938580c9c7de4d3&vjs=3
Data Science Lead,Infosys,"Hartford, CT",Not Provided,Not Provided,Infosys is seeking a Data Science Lead with strong background in designing and building machine learning models / algorithms to implement predictive &…,https://www.indeed.com/rc/clk?jk=9e866b6f51faa748&bb=ZBFGAsoSxHjl3iKTDt1OXkA2dX4kTmjxCfXCeaAqXLUT2ybAQ19UAk1kaIoyI-pAv6jizgn67jgjqUKkg3zw3NibqH2SFkPNy-qxpgip1acJ19bDdvuTO-wkAvFUJYqA&xkcb=SoBa67M3-segTQyU9Z0NbzkdCdPP&fccid=c67533a523c83a4c&vjs=3
AWS-PySpark Engineer,Accenture,"Remote in Dallas, TX",Not Provided,Not Provided,"ACCENTURE CONTRACTOR EXCHANGE Solves clients’ toughest challenges by providing unmatched services in strategy, consulting, digital, technology, operations and…",https://www.indeed.com/rc/clk?jk=5250dd7188227f63&bb=ZBFGAsoSxHjl3iKTDt1OXqVN6vmu5fsbboDxK-KPXpYeq0EujugreEVudoBA5vk629Lqu6CjyBVIIwFjSqou88nT5nnvmrJV6k1WUb0ESpSqMYYQhKoJow%3D%3D&xkcb=SoDu67M3-segTQyU9Z0MbzkdCdPP&fccid=a4e4e2eaf26690c9&vjs=3
"Senior Product Manager, Artificial Intelligence/Machine Learning (AI/ML)",Workiva,Remote,Not Provided,Not Provided,"As the Senior Product Manager for Artificial Intelligence/Machine Learning (AI/ML), you will be responsible for identifying the most impactful problems and…",https://www.indeed.com/rc/clk?jk=016ded9924be6dfa&bb=ZBFGAsoSxHjl3iKTDt1OXsCTsHecktU9_y5pfHtyXDVWVNv0rEXZCs-oKwkDmjoid78YS7HN0vseW17FNqQtHe8HjPCb6XdvabomvyReZ9d5vYg_oDa5WO45PQNeGCZn&xkcb=SoAH67M3-segTQyU9Z0DbzkdCdPP&fccid=c74820549fd8456b&vjs=3
Sr. Machine Learning Performance Engineer,"Advanced Micro Devices, Inc","Remote in San Jose, CA 95124",Not Provided,Not Provided,"We seek a Sr. Machine Learning Performance Engineer to focus on ML Performance modeling, projection, and optimization for various ML workloads, and participate…",https://www.indeed.com/rc/clk?jk=d3e9587fe3fb2c1d&bb=ZBFGAsoSxHjl3iKTDt1OXmzs4xix4ndYD1bE5nfx6GNxt6D-SDwvwQlIhVm8mXSmbICqyW7G3qG1Nw5JVpGH8IqikLvjfDFxDtvEgKWPAWlItFJXxZ811SqQZmjbs8lY&xkcb=SoCz67M3-segTQyU9Z0CbzkdCdPP&fccid=b45c4b5a9c9a7448&vjs=3
IT Auditor II,"Bio-Rad Laboratories, Inc.",California,"$130,200 - $179,100 a year",Not Provided,"In this role, you will build relationships with Bio-Rad IT and business stakeholders; stay informed about emerging IT risk areas to include cybersecurity,…",https://www.indeed.com/rc/clk?jk=f1086416ffe59d5b&bb=ZBFGAsoSxHjl3iKTDt1OXk11HBuHUKBgpxF8_fqO4cnOW6xPe3_edURM4Mao6S3mlEx2wxciZ8YN8TdJ9P3p2SP3QweRelfFq2FiE5QgDcgfuhNy5OfsIjHWXuHuAn49&xkcb=SoAu67M3-segTQyU9Z0BbzkdCdPP&fccid=f5d3dc952a96809f&vjs=3
Privacy Specialist,Twilio,"Remote in Denver, CO 80202","$112,320 - $140,400 a year",Not Provided,This position is needed to support the Privacy Governance Team and report to the Director of Privacy Governance within the Legal organization.,https://www.indeed.com/rc/clk?jk=24ad32825419bab7&bb=ZBFGAsoSxHjl3iKTDt1OXkTH6bU6lZDe2XiCUM_DZjirhmTK72hyCnnrQ4RT5gSL0XEKhaA6rrNgbVcmlO2BFXSm8LXnbDiDymzgYXpUERB666GaTfuRsZO4eoKpXqoB&xkcb=SoCa67M3-segTQyU9Z0AbzkdCdPP&fccid=2cd10564780b27e2&vjs=3
Data Science/Machine Learning Engineer (EK),"DataFielder Inc, LLC","Atlanta, GA",Not Provided,Not Provided,"The ideal candidate will possess strong analytical skills and proficiency in Posit and RStudio, leveraging Azure technologies to drive substantial business…",https://www.indeed.com/rc/clk?jk=9180faa629afc539&bb=ZBFGAsoSxHjl3iKTDt1OXosp59CcvXz3p_QBDxUmlW9gzQz7nYMgu-3XLZ-nwK0GW09ktHy4CF-785nw2hIssmnL2y1DE1omxot4Tt-dVVisVfwqHElIFgyN3QhS7nyZ&xkcb=SoAU67M3-segTQyU9Z0HbzkdCdPP&fccid=084a74569ece5ea7&cmp=DataFielder-Inc%2C-LLC&ti=Machine+Learning+Engineer&vjs=3
Sr. Process Lead (Program/RPA and AI),Intone Networks,Remote,Not Provided,Contract,"CVS AI and RPA experience is a requirement Healthcare Experience Senior resource required (very strong experience) 8 + years - Need to be able to dive in, with…",https://www.indeed.com/rc/clk?jk=a65cc385a31a7f99&bb=ZBFGAsoSxHjl3iKTDt1OXnk1xYHTfagmsGFPdFLkSbCCPmC2Fovcjs5L967ekE5DC9P4h-CUs7_4umeC0uKejOFAyOXQlDmiwdOpfStfiBFC-QZeoMUbBON5-bYjykOd&xkcb=SoCg67M3-segTQyU9Z0GbzkdCdPP&fccid=3ed0572c448b2368&vjs=3
Business Development Representative,Transcarent,Remote,Not Provided,Not Provided,"Are laser focused on delivering results for Members, and proactively problem solving to get there.
A successful Business Development Representative candidate…",https://www.indeed.com/rc/clk?jk=6b3313ea418cd28d&bb=ZBFGAsoSxHjl3iKTDt1OXkwrm3BbMKq_IwXoSNFdN78wBiHd_OImkl1HQ64lZaobW3DHLu9lGMCDlK33p3o2dfLqQdX8qShlmXjokfii6IphnzyQQGLXDAMq7h5Gm0dw&xkcb=SoA967M3-segTQyU9Z0FbzkdCdPP&fccid=b17c6e790bf3ef08&vjs=3
