Job Title,Company,Location,Salary($),Job-Type,Job-Description,Raw_Link
"Senior Director, Design",Cohere Health,"Remote in Boston, MA","$180,000 - $215,000 a year",Not Provided,"View all Cohere Health jobs in Boston, MA - Boston jobs - Senior Designer jobs in Boston, MASalary Search: Senior Director, Design salaries in Boston, MASee popular questions & answers about Cohere Health",https://www.indeed.com/rc/clk?jk=3621e3a3ee4eefc8&bb=34um5RJSTIaOQtCSyeUQJJldDLpXRH46LvkxMfPINuI_Uk_OIWh2l9rRvcxQKHnvTVKK3FORmU9njcK5sxKrXfovdr5rW1yuyP_BCK5Q4lw0jf__RyQ-WKBnmDUgdyN3&xkcb=SoAe67M3-umoHegXcz0JbzkdCdPP&fccid=2ce3a21e0a968aec&vjs=3
Software Sales,"Vantagepoint ai, LLC","Westchase, FL 33626","$100,000 a year",Full-time,"View all Vantagepoint ai, LLC jobs in Westchase, FL - Westchase jobs - Sales jobs in Westchase, FLSalary Search: Software Sales salaries in Westchase, FLSee popular questions & answers about Vantagepoint ai, LLC",https://www.indeed.com/rc/clk?jk=28e4fc6a657bbe52&bb=34um5RJSTIaOQtCSyeUQJPWjv9csvgQ7vUoIHuqlO0SmfUBZb0mRagnJ_sFBvtxpneJVsX1PuDjfFEzKrnVFjv1lokZhvyEsAugsA5ywvuKLT7liXcFY9nysiO9YtJxK&xkcb=SoCq67M3-umoHegXcz0IbzkdCdPP&fccid=3c14a778776ef983&vjs=3
Post Doctoral Fellow - Artificial Intelligence and Machine Learning,Emory University,"Atlanta, GA 30322",Not Provided,Full-time,"View all Emory University jobs in Atlanta, GA - Atlanta jobs - Post-doctoral Fellow jobs in Atlanta, GASalary Search: Post Doctoral Fellow - Artificial Intelligence and Machine Learning salaries in Atlanta, GASee popular questions & answers about Emory University",https://www.indeed.com/rc/clk?jk=5f92a2433e9004a3&bb=34um5RJSTIaOQtCSyeUQJCpwrhn0HhPMNJRnodqu1SZKuO13QT-vcyaQ59PK7frF-9usrWLi28UMAcYALp9HFxW-RNOoOpWaQG6zr2aVF7QRTYJxcDBFBQ%3D%3D&xkcb=SoAk67M3-umoHegXcz0PbzkdCdPP&fccid=efe5e2d22a1d29e5&vjs=3
Associate II,"John Snow, Inc","Hybrid work in Boston, MA 02210","$72,246 - $105,837 a year",Full-time,"View all John Snow, Inc jobs in Boston, MA - Boston jobs - Retail Sales Associate II jobs in Boston, MASalary Search: Associate II salaries in Boston, MA",https://www.indeed.com/rc/clk?jk=45144626687579be&bb=34um5RJSTIaOQtCSyeUQJGaGVz2EnOkU42JXT4IZZQpuaZjS2dT9JaXhSa_H-fmWs4RB_yxSvkCnsYrBUWZWJmOz9qNfvwXHBzLHa_lv971SKssWLnVFg4oOO2C12VlT&xkcb=SoCQ67M3-umoHegXcz0ObzkdCdPP&fccid=52f9a4dde3bc5fe5&cmp=JSI-%2526-World-Education&ti=Retail+Sales+Associate+II&vjs=3
Senior AI Engineer - Remote,The Cigna Group,Remote,Not Provided,Not Provided,View all The Cigna Group jobs in Remote - Remote jobs - Senior Engineer jobs in RemoteSalary Search: Senior AI Engineer - Remote salaries in RemoteSee popular questions & answers about The Cigna Group,https://www.indeed.com/rc/clk?jk=87eed957fcd15be9&bb=34um5RJSTIaOQtCSyeUQJKu_8PJVZObWqA7LiIKqNEAj1kxrtic44MSj2zpRf4foawUtUhqNKLqoqrJDmlBPwc2xWoVaBGyxFttNIhyZln26E4-lau8BKw%3D%3D&xkcb=SoAN67M3-umoHegXcz0NbzkdCdPP&fccid=afbf8c270610a38a&vjs=3
Senior Content Designer/UX Writer - Artificial Intelligence,Wells Fargo,"New York, NY","$100,800 - $179,200 a year",Full-time,"View all Wells Fargo jobs in New York, NY - New York jobs - Senior Content Writer jobs in New York, NYSalary Search: Senior Content Designer/UX Writer - Artificial Intelligence salaries in New York, NYSee popular questions & answers about Wells Fargo",https://www.indeed.com/rc/clk?jk=d97968dcbea6bd79&bb=34um5RJSTIaOQtCSyeUQJGZbr4j8Wo-ffeEDrlsXf8wUyk-cWvQZ2ImSeeAKnyqTi5kkZj_e8o89eNIgAUEMT1MzofuE18uB-BgYWn8mTdvNfoF_xSotkQ%3D%3D&xkcb=SoC567M3-umoHegXcz0MbzkdCdPP&fccid=78bbcd26e39621f5&vjs=3
Trades Technician - Grounds,Germanna Community College,"Spotsylvania, VA","$36,139 - $44,886 a year",Full-time,"View all Germanna Community College jobs in Spotsylvania, VA - Spotsylvania jobs - Technician jobs in Spotsylvania, VASalary Search: Trades Technician - Grounds salaries in Spotsylvania, VASee popular questions & answers about Germanna Community College",https://www.indeed.com/rc/clk?jk=32754ae253ce59d3&bb=34um5RJSTIaOQtCSyeUQJH720u7inwtG3uOz5A7PT-bIDoyj1jA4t12PhvhVP9J2XaadFXY14KODwV6mtIbrqQYtRjOYqZ4kxL0MfuqlCCWO4lGY4elTpVP6KUtlrP_-&xkcb=SoBQ67M3-umoHegXcz0DbzkdCdPP&fccid=1b01e4b7b6764d7e&vjs=3
Area Vice President-AI Sales,Innovaccer,Remote,Not Provided,Not Provided,View all Innovaccer jobs in Remote - Remote jobs - Vice President of Sales jobs in RemoteSalary Search: Area Vice President-AI Sales salaries in RemoteSee popular questions & answers about Innovaccer,https://www.indeed.com/rc/clk?jk=0e50cd9ac9dbfcc3&bb=34um5RJSTIaOQtCSyeUQJJu3H7QRLyAmGWpIwSNZ65xByeHjv17h7ZqgOO7XegaLasVipOdCOf00T-2AYzUY_WvKwxRulLn6MlvMUfjqVIiHKlIxQfuruT20j1hiHZDU&xkcb=SoDk67M3-umoHegXcz0CbzkdCdPP&fccid=f6e1ee07ee227498&vjs=3
AI Engineer,Cornerstone Defense,"Bethesda, MD",Not Provided,Not Provided,"View all Cornerstone Defense jobs in Bethesda, MD - Bethesda jobs - Engineer jobs in Bethesda, MDSalary Search: AI Engineer salaries in Bethesda, MDSee popular questions & answers about Cornerstone Defense",https://www.indeed.com/rc/clk?jk=61b528624c24ea78&bb=34um5RJSTIaOQtCSyeUQJOHDApSJhc5zonJV0hOwFynVezxDuOoSfgbwxNP61dSTy02JFm0NyptaRbPEEJpPjJ9TLInSYlv2cCkzAY84YCcJbrMIuPlRd8Gy0_c7_ll4&xkcb=SoB567M3-umoHegXcz0BbzkdCdPP&fccid=c4dad3c95358e466&vjs=3
Chatbot Developer,ADP,"Roseland, NJ 07068",Not Provided,Full-time,"View all ADP jobs in Roseland, NJ - Roseland jobs - Developer jobs in Roseland, NJSalary Search: Chatbot Developer salaries in Roseland, NJSee popular questions & answers about ADP",https://www.indeed.com/rc/clk?jk=d67bcf4a4edb0da6&bb=34um5RJSTIaOQtCSyeUQJIOX5Nn1gvkaYOP4RMn-D1U5-pkFk8Sfly9gPcphqN0Zk5p3bOl_RG7q59oOhuIv6cpFXgdw5q-hbE3OMeOfAQ91ZBRGuUJ0NQ%3D%3D&xkcb=SoDN67M3-umoHegXcz0AbzkdCdPP&fccid=e996c2d6855fe778&vjs=3
Competitive Intelligence Lead,"Grammarly, Inc.",Hybrid work in United States,Not Provided,Not Provided,"View all Grammarly, Inc. jobs in United States - United States jobsSalary Search: Competitive Intelligence Lead salariesSee popular questions & answers about Grammarly, Inc.",https://www.indeed.com/rc/clk?jk=416f3bf573d88116&bb=34um5RJSTIaOQtCSyeUQJGjAJxuYNZHrCwqe1t4WIrSQ165B9qSYPwnDR8DdAJp98t4rlHA2A6X7ILA0jkqwzdKI8qIoSwM_2tcqiZ6vBQHHC02IBJR1bQA4xtZDMOJM&xkcb=SoBD67M3-umoHegXcz0HbzkdCdPP&fccid=0555014e7bce64c3&vjs=3
"Senior Writer and Editor, AI at Work",Microsoft,United States,"$103,800 - $219,200 a year",Full-time,"View all Microsoft jobs in United States - United States jobs - Senior Writer/Editor jobs in United StatesSalary Search: Senior Writer and Editor, AI at Work salaries in United StatesSee popular questions & answers about Microsoft",https://www.indeed.com/rc/clk?jk=a753f4b4e94242de&bb=34um5RJSTIaOQtCSyeUQJPlardeSXq4W5vrPD2utRKKHSF_sl_qhXO5wuDPHvHKb5Ps8MiiMTPQjPyrGTAqULjwexLKUxeqn7Ia4-sfvGJjYzCUbcFFZEw%3D%3D&xkcb=SoD367M3-umoHegXcz0GbzkdCdPP&fccid=734cb5a01ee60f80&vjs=3
AI Data Annotator,Vistatec,United States,Not Provided,Not Provided,View all Vistatec jobs in United States - United States jobsSalary Search: AI Data Annotator salariesSee popular questions & answers about Vistatec,https://www.indeed.com/rc/clk?jk=644269f566114edb&bb=34um5RJSTIaOQtCSyeUQJP8nYvDDymiJLvnlZ5lNgsnGkw7EnQf-O3AffedrpjZClCL3JPlZA-e0w3AG2irk4Ad990iTmga1PbvvVRpKdbEc416Lva5LzA%3D%3D&xkcb=SoBq67M3-umoHegXcz0FbzkdCdPP&fccid=33fede40a40fcf6f&vjs=3
Sustainability Go-to-Market Activation Lead,Microsoft,United States,"$129,200 - $268,900 a year",Full-time,View all Microsoft jobs in United States - United States jobsSalary Search: Sustainability Go-to-Market Activation Lead salariesSee popular questions & answers about Microsoft,https://www.indeed.com/rc/clk?jk=da0e0b51bf349b2b&bb=34um5RJSTIaOQtCSyeUQJK3tsHP5Ue044PStvqyPlTkn4Ccqr-WAQoa2UCdg85NV5mQ0qVA_H-lVCFaCcpQAb7Wudu64aJqqgLNXrOZdyjsOrzHOcxTcrg%3D%3D&xkcb=SoDe67M3-umoHegXcz0EbzkdCdPP&fccid=734cb5a01ee60f80&vjs=3
Partner Technology Strategy AI Services,Microsoft,United States,"$103,800 - $219,200 a year",Full-time,View all Microsoft jobs in United States - United States jobs - Partner jobs in United StatesSalary Search: Partner Technology Strategy AI Services salaries in United StatesSee popular questions & answers about Microsoft,https://www.indeed.com/rc/clk?jk=2f0cd40c3bb39431&bb=34um5RJSTIaOQtCSyeUQJMi_zPscdcnxAFMJS6f1ua3YR-1GJ1Zva3RzizX0Nz2pMfeFjxat3vnUnl8-VHwruF_F2PtOQf0_7YRw-5_Pb4Tp3VFUTEFHGw%3D%3D&xkcb=SoD567M3-umoHegXcz0bbzkdCdPP&fccid=734cb5a01ee60f80&vjs=3
