Job Title,Company,Location,Salary($),Job-Type,Job-Description,Raw_Link
Associate II,JSI,"Boston, MA 02210 (South Boston area)","$72,246 - $105,837 a year",Not Provided,"Utilizes emotional intelligence to deeply analyze and understand problems, synthesizing information from multiple sources.",https://www.indeed.com/rc/clk?jk=155657918145705f&bb=6cQ11Oimz1pOQUUKroh5caMRJw9tnhxGKMAKJpPb5MKdJhH8dzrU4Wtu5pLtKgzebQRCxNh4qdeUTJkWyZQpZIpky_MsyGSJFZKaUaqVVaneQ2PkwfpfG0YO1oJkTNxM&xkcb=SoD467M3-uj2NgWadB0LbzkdCdPP&fccid=fe36c8f8c4a817e4&vjs=3
Business Intelligence Engineer II,Chewy,"Bellevue, WA","$115,500 - $183,500 a year",Full-time,"The Outbound Science and Tech team with Chewy Operations org is looking for a Business Intelligence Engineer II at our hub in Bellevue, WA to own the design,…",https://www.indeed.com/rc/clk?jk=a0372a79a8c1e7c0&bb=6cQ11Oimz1pOQUUKroh5cQEeuOO82tMedDU6F3sekWdkqlmex8bZRArMLE7i97FHGOJuzK7DkKEWE3GzW9EY6Ry8DO0kXz-daBRBd-VM3FiWj7fYh-HlhkjvHBWIdZcV&xkcb=SoBM67M3-uj2NgWadB0KbzkdCdPP&fccid=b6add0e6a71f1008&vjs=3
Senior AI Engineer - Remote,The Cigna Group,Remote,Not Provided,Not Provided,"Utilizing Large Language Models (LLMs), Open Source, Machine Learning, and numerical programming frameworks, to build transformative solutions.",https://www.indeed.com/rc/clk?jk=87eed957fcd15be9&bb=6cQ11Oimz1pOQUUKroh5ceHa3mw-kte15jiSvgoTWmtXcntFaihJEXP5FpZSHUUdUxJsaZe9kd34ZsP5phj3U92_gUrpZey6IlTvuzecAyCZHQ37QMpqWQ%3D%3D&xkcb=SoDR67M3-uj2NgWadB0JbzkdCdPP&fccid=afbf8c270610a38a&vjs=3
Tech Writer - Contract,Kognitos,"San Jose, CA",Not Provided,Contract,Kognitos is a cutting-edge automation platform that combines the power of Generative AI and Natural Language Processing (NLP) to provide a conversational and…,https://www.indeed.com/rc/clk?jk=1ce863c0f17acfe5&bb=6cQ11Oimz1pOQUUKroh5ceHa3mw-kte1NmPzeaujxCwe5wJZkGNeoDyYOJX7Advy-G_SBWJZkUSEHVk_gCvq8zg1LUtjUKgt-54QkzECuDg-gYqAS8Dxw-5DCkt4V6Ji&xkcb=SoBl67M3-uj2NgWadB0IbzkdCdPP&fccid=f8c39f07feebe587&vjs=3
"Senior Product Manager, Artificial Intelligence/Machine Learning (AI/ML)",Workiva,Remote,Not Provided,Not Provided,"As the Senior Product Manager for Artificial Intelligence/Machine Learning (AI/ML), you will be responsible for identifying the most impactful problems and…",https://www.indeed.com/rc/clk?jk=016ded9924be6dfa&bb=6cQ11Oimz1pOQUUKroh5cTRdHf_sXjK-4zkdKRvzbIV49fUkpF_w6Jnatn0-6piCK-G1qAvXjBAtmE4WqCha8t8hHa3sT3ccM9_GSrUyJU0CyD9m4wVfeLWx0IiRajG5&xkcb=SoDr67M3-uj2NgWadB0PbzkdCdPP&fccid=c74820549fd8456b&vjs=3
Machine Learning Engineer,Ford Motor Company,"Hybrid work in Dearborn, MI 48124",Not Provided,Not Provided,"Our projects span various domains, including Connected Vehicle, Smart Mobility, Operations, Manufacturing, Supply Chain, Logistics, and Warranty Analytics.",https://www.indeed.com/rc/clk?jk=47ec961128e13836&bb=6cQ11Oimz1pOQUUKroh5cVevFqq9z2KiSVGkgGQlKAhWj8zYasCsacp5g0RMURiDwXdBzSo5vhV1BMDr19gCfLpB3KozL0ElgEzFGHmn9Ll3suIyoDA5kA%3D%3D&xkcb=SoBf67M3-uj2NgWadB0ObzkdCdPP&fccid=761c44c17d636bfe&vjs=3
"VP of Partnerships, Cloud & Generative AI",Invisible Technologies,Remote,Not Provided,Not Provided,Your primary goal will be to establish joint go-to-market strategies with our top partners to meet revenue targets and drive AI adoption through Invisibles…,https://www.indeed.com/rc/clk?jk=08283049c167de9d&bb=6cQ11Oimz1pOQUUKroh5cf8Yff8nSCcJTz3iSm4DqSf0y_gKssf46bHqg1nOR2hz63WbwE3Iig2pcM7O7Eln6rUJWQP6OnQi51x9xOJEH2JRscBiauCtZV5IEQcadWTd&xkcb=SoDC67M3-uj2NgWadB0NbzkdCdPP&fccid=c34504270a486ed1&vjs=3
"Senior Technical Writer, Cash Commerce",Afterpay,"San Francisco, CA","$126,400 - $223,100 a year",Full-time,"Initially built to take the pain out of peer-to-peer payments, Cash App has gone from a simple product with a single purpose to a dynamic ecosystem, developing…",https://www.indeed.com/rc/clk?jk=095aafc39ee4c15f&bb=6cQ11Oimz1pOQUUKroh5cQpLkZy14etYJGI78WY07La0A8fZB7G2oPQhDFDQYJqF-RyN4lJHi2ch-69QeEcw015P0HnjclnVMXn3cgnIA3Pye8xa-jw7di7v2GWklQ_N&xkcb=SoB267M3-uj2NgWadB0MbzkdCdPP&fccid=49023dc4dc722a14&vjs=3
AI Engineer,Cornerstone Defense,"Bethesda, MD",Not Provided,Not Provided,"View all Cornerstone Defense jobs in Bethesda, MD - Bethesda jobs - Engineer jobs in Bethesda, MDSalary Search: AI Engineer salaries in Bethesda, MDSee popular questions & answers about Cornerstone Defense",https://www.indeed.com/rc/clk?jk=61b528624c24ea78&bb=6cQ11Oimz1pOQUUKroh5ccHsQvZZQJOOkK5eInB3ekeJB1z4n9Di9H5rDt_ekeYnvD5SXOh7KnmIpzba-W-crj8EPb-IRhmNRQ5T9PU-2d1RR6Wvzh4XyVhwZ4EPt_zp&xkcb=SoCf67M3-uj2NgWadB0DbzkdCdPP&fccid=c4dad3c95358e466&vjs=3
Chatbot Developer,ADP,"Roseland, NJ 07068",Not Provided,Full-time,You will help us reinvent how associates connect with HR using technology and how we provide support by merging automation with user experience.,https://www.indeed.com/rc/clk?jk=d67bcf4a4edb0da6&bb=6cQ11Oimz1pOQUUKroh5cfXZeBC0QBFi0SoBTTNQlR9ibOpME6vuX8NqKoAe4dZ8hoIQYsWIfKxMpinuBL5ZiXn0tNR09l_iTsZnvYIauUB32V1m66Ug1A%3D%3D&xkcb=SoC267M3-uj2NgWadB0BbzkdCdPP&fccid=e996c2d6855fe778&vjs=3
AI Data Annotator,Vistatec,United States,Not Provided,Not Provided,"Data Annotators carry out their work in an engineering development environment.
Annotate English data accurately and consistently, and in accordance with…",https://www.indeed.com/rc/clk?jk=644269f566114edb&bb=6cQ11Oimz1pOQUUKroh5cbin7F4sg6PznBlqXhdShMaAqlHMJCj42-LKm5E4AzXq2D1Oo5MkyJ-Lal1lyfa5NYIE0vRkfnrH83lCGT9tGN3YomsvlQpBgw%3D%3D&xkcb=SoAC67M3-uj2NgWadB0AbzkdCdPP&fccid=33fede40a40fcf6f&vjs=3
"Senior Writer and Editor, AI at Work",Microsoft,United States,"$103,800 - $219,200 a year",Full-time,"The writer and editor will also contribute regularly to WorkLab digital publication, newsletter, and podcast; Microsoft’s thought leadership publication on the…",https://www.indeed.com/rc/clk?jk=a753f4b4e94242de&bb=6cQ11Oimz1pOQUUKroh5cVevFqq9z2Ki_JWDn17onxHwUppFTvttSGD8I-tFZxHAUvuv_0uPdnC43KIfk0o9Efexhsf-upUsMTCmmcmairW_e2hTPMqtew%3D%3D&xkcb=SoCM67M3-uj2NgWadB0HbzkdCdPP&fccid=734cb5a01ee60f80&vjs=3
Competitive Intelligence Lead,"Grammarly, Inc.",Hybrid work in United States,Not Provided,Not Provided,"Has experience working at a senior level in competitive intelligence within the tech industry.
Develop and maintain detailed assets to provide our sales team…",https://www.indeed.com/rc/clk?jk=416f3bf573d88116&bb=6cQ11Oimz1pOQUUKroh5cf8Yff8nSCcJFDvMLnzXtlmPGEqxHTP_ZpI62CbDyr0m-l9FyKWUGZTKs-jCKHsOLPl7lmFZJ-a4R-rx6i8lfu-tBfIynFG171MPEjMnWYee&xkcb=SoA467M3-uj2NgWadB0GbzkdCdPP&fccid=0555014e7bce64c3&vjs=3
Intelligence Watchlist Analyst,Deloitte,United States,Not Provided,Extended hours,"2+ year(s) of open-source / all-source intelligence experience.
Providing intelligence analysis and operational support, you will be responsible for receiving,…",https://www.indeed.com/rc/clk?jk=0189c2b31a0791e6&bb=6cQ11Oimz1pOQUUKroh5cfZmtNBBrNl4Dms223IeRYm7hGG_C2HpEtfPk-N7LWUVBisLWcBY_s1tMGQmL_FdK-T1zK_TjjdG-AhJvW1LyX8_JdjmoaXrwg%3D%3D&xkcb=SoCl67M3-uj2NgWadB0FbzkdCdPP&fccid=9e215d88a6b33622&vjs=3
Finance Insights Consultant,Deloitte,United States,"$88,800 - $148,000 a year",Not Provided,"We work as trusted advisors to CFO’s, COO’s, CIO’s and other key executives to advise, implement, and deliver as-a service solutions, improving finance, shared…",https://www.indeed.com/rc/clk?jk=0b54a7c8a5788ee8&bb=6cQ11Oimz1pOQUUKroh5cZf3VOCDqNLfENDInzZkIsPi2DWZn-pc0V8J9eYM6f3F6qmPPt79MJlkTd6ajZCwvxplONvdQr2weqwSS5ipub9Ix7NvGN0FqQ%3D%3D&xkcb=SoAR67M3-uj2NgWadB0EbzkdCdPP&fccid=9e215d88a6b33622&vjs=3
