Job Title,Company,Location,Salary($),Job-Type,Job-Description,Raw_Link
"ENGINEER - RESEARCH ENGINEER - AI Computer Engineering - Warner Robins, Georgia",Southwest Research Institute,"Warner Robins, GA 31088",Not Provided,Not Provided,"Ongoing threats to national security require timely intelligence data, including signal intelligence obtained through electronic surveillance.",https://www.indeed.com/rc/clk?jk=35ee2b04b04136a7&bb=o4tRh7QTj8xhb2TzKqcB7Gqv4_g_bJRw0d2hQlj0xeZ8IbfIDHQNipf36MwXTVfrhjEVuCRIfgfn0KQcs5JswvrAzuhiclfwWWtRtjFr_9kwkxrrj5A2uw%3D%3D&xkcb=SoB567M3-umsbvWaYR0LbzkdCdPP&fccid=0d9a7400c0a8fdec&vjs=3
"Senior Director, Design",Cohere Health,"Remote in Boston, MA","$180,000 - $215,000 a year",Not Provided,"Our Senior Director, Design will look after our entire product scope, ensuring each of our products is well-informed by user needs and of the highest quality…",https://www.indeed.com/rc/clk?jk=3621e3a3ee4eefc8&bb=o4tRh7QTj8xhb2TzKqcB7NaESpYk3NZlp5DzFyNpgd08G4QCIOQdtcna6W5Ju_tEaUXJW2x2FUdF6kX3OYOocPpX5bnQ_m6n4XfOZ62Z5umNb5ymrHLHGGawLWPERAP-&xkcb=SoDN67M3-umsbvWaYR0KbzkdCdPP&fccid=2ce3a21e0a968aec&vjs=3
Software Sales,"Vantagepoint ai, LLC","Westchase, FL 33626","$100,000 a year",Full-time,"Vantagepoint ai holds two US patents on the technology and continues to develop innovative, highly accurate predictive artificial intelligence software that…",https://www.indeed.com/rc/clk?jk=28e4fc6a657bbe52&bb=o4tRh7QTj8xhb2TzKqcB7PHTBF8TZe26oKDT-uPbLrvV91JjM_5kzbaR4rd9TC4HpwPFYjLo41CdelmLO1bxv42TGxNU0hj6qIieULqey7c-Q7bUWoXe8VFZpwnrTm3D&xkcb=SoBQ67M3-umsbvWaYR0JbzkdCdPP&fccid=3c14a778776ef983&vjs=3
Post Doctoral Fellow - Artificial Intelligence and Machine Learning,Emory University,"Atlanta, GA 30322",Not Provided,Full-time,The specific area of research in which the trainee is mentored is determined by the department and laboratory of the Postdoc.,https://www.indeed.com/rc/clk?jk=5f92a2433e9004a3&bb=o4tRh7QTj8xhb2TzKqcB7Abrvh-Xg06R029mIsy9H5xwFyMHvvgnKVeADmufQRmfOIJ-OmJTS5Dh_zZPKNKTqOX5smwvOTNSpNS7pFzStQ6Y24shW3wmrQ%3D%3D&xkcb=SoDk67M3-umsbvWaYR0IbzkdCdPP&fccid=efe5e2d22a1d29e5&vjs=3
Associate II,"John Snow, Inc","Hybrid work in Boston, MA 02210","$72,246 - $105,837 a year",Full-time,"Utilizes emotional intelligence to deeply analyze and understand problems, synthesizing information from multiple sources.",https://www.indeed.com/rc/clk?jk=45144626687579be&bb=o4tRh7QTj8xhb2TzKqcB7C_zQSRRO-WYDeZ29bKd6WP6vhUMX7V4_287KXFKbrigZu6cxn1Fvw9z2IODmVxt4lXb02r7HpMqtuKv_Zw_f_BJljFRBqehrAYbTAPzSLKQ&xkcb=SoBq67M3-umsbvWaYR0PbzkdCdPP&fccid=52f9a4dde3bc5fe5&cmp=JSI-%2526-World-Education&ti=Retail+Sales+Associate+II&vjs=3
Senior AI Engineer - Remote,The Cigna Group,Remote,Not Provided,Not Provided,"Utilizing Large Language Models (LLMs), Open Source, Machine Learning, and numerical programming frameworks, to build transformative solutions.",https://www.indeed.com/rc/clk?jk=87eed957fcd15be9&bb=o4tRh7QTj8xhb2TzKqcB7KxyZ257y3GLccy7K497rsmvG6HLcctygRJQw1gDhzzND-fM60zrKbVa_wzlI9FGXcT7qeaCL-q2MpuFN9TAQcLyNxwjKOzn5g%3D%3D&xkcb=SoDe67M3-umsbvWaYR0ObzkdCdPP&fccid=afbf8c270610a38a&vjs=3
Senior Content Designer/UX Writer - Artificial Intelligence,Wells Fargo,"New York, NY","$100,800 - $179,200 a year",Full-time,"This role demands a healthy balance of flawless writing, strategic UX thinking, and passion for detail.
Write useful and friendly conversational responses for a…",https://www.indeed.com/rc/clk?jk=d97968dcbea6bd79&bb=o4tRh7QTj8xhb2TzKqcB7Cexv8g5e8nC3oGOfD4sac3cvuIl7p8r5IequZYaoKYYg-0I3mnlbB_ZW9Z0sm-TW8G3n5ZC9bbnkN88DgxwaJz9XID3L1Wy3Q%3D%3D&xkcb=SoBD67M3-umsbvWaYR0NbzkdCdPP&fccid=78bbcd26e39621f5&vjs=3
Trades Technician - Grounds,Germanna Community College,"Spotsylvania, VA","$36,139 - $44,886 a year",Full-time,"Experience with or willingness to learn artificial intelligence tools.
Hiring Range: $36,139- $44,886; plus full state benefits.",https://www.indeed.com/rc/clk?jk=32754ae253ce59d3&bb=o4tRh7QTj8xhb2TzKqcB7Cyv21YSxFPjc0xVxYXDmATLq79vHJ9urWF-YcyD4Ue2RZa-07jOarWhdId9QF6xigIQpVwj4m6R4At30EYgHv41DpoWDjlWjfcMfxZdRdur&xkcb=SoD367M3-umsbvWaYR0MbzkdCdPP&fccid=1b01e4b7b6764d7e&vjs=3
AI Engineer,Cornerstone Defense,"Bethesda, MD",Not Provided,Not Provided,"View all Cornerstone Defense jobs in Bethesda, MD - Bethesda jobs - Engineer jobs in Bethesda, MDSalary Search: AI Engineer salaries in Bethesda, MDSee popular questions & answers about Cornerstone Defense",https://www.indeed.com/rc/clk?jk=61b528624c24ea78&bb=o4tRh7QTj8xhb2TzKqcB7AH387zYVWa1jjdda5MQ08vKAvRQwjh-NsVk2dkd4PKr-9SGGsdq0EmVIZNDKAiNhXcBzqNnNggoQkzDtj5lFzgMZPMl5b8v-oqiH1WJLhog&xkcb=SoAe67M3-umsbvWaYR0DbzkdCdPP&fccid=c4dad3c95358e466&vjs=3
Chatbot Developer,ADP,"Roseland, NJ 07068",Not Provided,Full-time,You will help us reinvent how associates connect with HR using technology and how we provide support by merging automation with user experience.,https://www.indeed.com/rc/clk?jk=d67bcf4a4edb0da6&bb=o4tRh7QTj8xhb2TzKqcB7FVrjN0o1-wnlzupeRMinsUEGTo57u9UXGWhzv0yDEHbPZOqvRyYfMZMBPo5HPI2KmE5_DYyATcfUy6cC6UzsMmSqCbUCHW4jQ%3D%3D&xkcb=SoCq67M3-umsbvWaYR0CbzkdCdPP&fccid=e996c2d6855fe778&vjs=3
Competitive Intelligence Lead,"Grammarly, Inc.",Hybrid work in United States,Not Provided,Not Provided,"Has experience working at a senior level in competitive intelligence within the tech industry.
Develop and maintain detailed assets to provide our sales team…",https://www.indeed.com/rc/clk?jk=416f3bf573d88116&bb=o4tRh7QTj8xhb2TzKqcB7EB8Zyt02ZXGfFrM9turcvOsFxfkFyN5hOntbxf8jJdsiWBF29oABd1sJMysvJAqiad8k9AWkS_tq6925IYz6VJV7tQlWhjQz5xkVujwV0hJ&xkcb=SoA367M3-umsbvWaYR0BbzkdCdPP&fccid=0555014e7bce64c3&vjs=3
"Senior Writer and Editor, AI at Work",Microsoft,United States,"$103,800 - $219,200 a year",Full-time,"The writer and editor will also contribute regularly to WorkLab digital publication, newsletter, and podcast; Microsoft’s thought leadership publication on the…",https://www.indeed.com/rc/clk?jk=a753f4b4e94242de&bb=o4tRh7QTj8xhb2TzKqcB7PEVO0QmIwRsLdbEJR8IM772muuWmg1spsFP7fLPDk6GpbISEjzdUik1bXP7pR-SETtFjXZqiPy5TttSd7s1GtIgyZzu38oPcw%3D%3D&xkcb=SoCD67M3-umsbvWaYR0AbzkdCdPP&fccid=734cb5a01ee60f80&vjs=3
AI Data Annotator,Vistatec,United States,Not Provided,Not Provided,"Data Annotators carry out their work in an engineering development environment.
Annotate English data accurately and consistently, and in accordance with…",https://www.indeed.com/rc/clk?jk=644269f566114edb&bb=o4tRh7QTj8xhb2TzKqcB7CfL5m6q9CF6imD4IAyp2tYQTaA1pOU5DtNPLLpeek2XDWHtx7MDQtbKp4hdakn1hPC5C-M83V6K63UT3et9THn8hJ6uM6vGvg%3D%3D&xkcb=SoAN67M3-umsbvWaYR0HbzkdCdPP&fccid=33fede40a40fcf6f&vjs=3
Sustainability Go-to-Market Activation Lead,Microsoft,United States,"$129,200 - $268,900 a year",Full-time,"Sitting in the Cross Solutions Sales Activation team, you will be a dotted-line business partner to the Sustainability GTM team and partner closely with…",https://www.indeed.com/rc/clk?jk=da0e0b51bf349b2b&bb=o4tRh7QTj8xhb2TzKqcB7JG6MYT1V31umla2kJlbnEQrhiDrRKKKxJL_bfW5oshG7P8v6Ldg3k3XhRX94ockTdeLgOGc9SCTYMzjQXhCZTo3uyUQ5dzhvA%3D%3D&xkcb=SoC567M3-umsbvWaYR0GbzkdCdPP&fccid=734cb5a01ee60f80&vjs=3
Partner Technology Strategy AI Services,Microsoft,United States,"$103,800 - $219,200 a year",Full-time,"As a Partner Technology Strategist, you will develop deep relationships with partners and internal teams to define and build new AI cloud services and solutions…",https://www.indeed.com/rc/clk?jk=2f0cd40c3bb39431&bb=o4tRh7QTj8xhb2TzKqcB7LBm90bTWHFDEW8iDK9Tt77oDnWcNV4ltdLCBc5gKEyHWVKBLZ0hRg3wB-6l6EUCjOlfWXvvfMQtab5Y4Sd4yOe6SG3eKzTN8g%3D%3D&xkcb=SoAk67M3-umsbvWaYR0FbzkdCdPP&fccid=734cb5a01ee60f80&vjs=3
