Job Title,Company,Location,Salary($),Job-Type,Job-Description,Raw_Link
Senior AI Weather Scientist,Spire,"Boulder, CO","$150,000 - $200,000 a year",Not Provided,"In addition to its constellation, Spires data infrastructure includes a global ground station network and 24/7 operations that provide real-time global…",https://www.indeed.com/rc/clk?jk=d34f7d686beb3602&bb=1yKeFBwUjMJJagLZ1tqXN9Hf85rgqbhtGcrBLkwNDOBW-ozocwvCw-kiyxYR-sxDU-P8lYNc_aKSf4mBRyzfhbgICrjEJQmwKm9yJTMAGY048gQMjR5I9YDvkMJabbLK&xkcb=SoDF67M3-umJTnx5l50LbzkdCdPP&fccid=d095eb8d761d57e9&vjs=3
Senior Associate Textile Designer,REVOLVE,"Los Angeles, CA 90021","$70,000 - $80,000 a year",Full-time,This is a full-time role for a candidate who will support the Director of Textile & Art and utilize his or her creativity to manipulate and design prints for…,https://www.indeed.com/rc/clk?jk=14be841f5d8b6ad6&bb=1yKeFBwUjMJJagLZ1tqXN3Z419dvPw-DGwcZxznqaujTLR5pHglZrdbt0VNwl9KEwrRBe7F4FHYHUOZ4_ZzRVVZCKiva8JAuA4Ko69ovUVtcPdx8f7iMslgyfPSrVCTJ&xkcb=SoBx67M3-umJTnx5l50KbzkdCdPP&fccid=7ff17b3690e6290e&vjs=3
Program Manager,Oracle,"Seattle, WA",Not Provided,Full-time,Manage the development and implementation process of a specific company product involving departmental or cross-functional teams focused on the delivery of new…,https://www.indeed.com/rc/clk?jk=a3d9471ec529344d&bb=1yKeFBwUjMJJagLZ1tqXN3jf3H7IfzdAly_eHGr0KpNx0YvKGrAISVNeTjsA3AoIhRyWg8lktQqipXMT0Xz4_ktpSi2whJ8H8RwsxZ5iBd0K4H-RSobBoA%3D%3D&xkcb=SoDs67M3-umJTnx5l50JbzkdCdPP&fccid=cd22d01053af7669&vjs=3
Open Source Strategist,Samsung Research America,"Mountain View, CA 94043","$200,000 - $300,050 a year",Not Provided,The open source strategist will spend her/his time to search for new opportunities of open source and open standard that are aligned with Samsungs strategy and…,https://www.indeed.com/rc/clk?jk=a71ba26a239382d6&bb=1yKeFBwUjMJJagLZ1tqXN_NLKYTvDRwLKahqg2kO1Ye90QHwb5LQUygl1PS_v1AoCzrrVqdMDAognk_BhUBPdak9hEwio26tPLWx9WNvnwN7ZCBd3QSbb5WEmI7FFICQ&xkcb=SoBY67M3-umJTnx5l50IbzkdCdPP&fccid=f98eb70205204fcf&vjs=3
Software Developer,Oracle,"Seattle, WA",Not Provided,Not Provided,"Our team is responsible for designing and developing fundamental architectural changes for GPU delivery, health monitoring, triage automation, and diagnostic…",https://www.indeed.com/rc/clk?jk=325ade8b54d5a47f&bb=1yKeFBwUjMJJagLZ1tqXNyJ3aa9OSK6kMXFwYL4BlwuakSN4Opa-cKrOT40fiAogh0yqIqjIyQSKOv3Y-PORES96oqlsYbbFVTleRmXpKax1TyfQxZY_Qw%3D%3D&xkcb=SoDW67M3-umJTnx5l50PbzkdCdPP&fccid=cd22d01053af7669&vjs=3
Evaluation & Response Senior Specialist,Apple,"Austin, TX",Not Provided,Not Provided,"You are creative and have a passion for detail with proven expertise in English language analysis.
As an Evaluation and Response Senior Specialist, you’ll…",https://www.indeed.com/rc/clk?jk=c72383b59c1ab64a&bb=1yKeFBwUjMJJagLZ1tqXN-zkYZnNgIyPM2C30MG4PS1vBPb8Zxzf3l7Y0B5MX7GbK32hWGIyyJ8Eh9yDQxD-_SuFkpDeJN8aOxTe7tIcIEmg3SjUprVzuw%3D%3D&xkcb=SoBi67M3-umJTnx5l50ObzkdCdPP&fccid=c1099851e9794854&vjs=3
Postdoctoral Appointee – Scalable Simulation and AI/ML Workflows,Argonne National Laboratory,"Lemont, IL 60439",Not Provided,Full-time,The Argonne Leadership Computing Facility (ALCF) is seeking a Postdoctoral Appointee to perform research and development of scalable workflow tools for coupling…,https://www.indeed.com/rc/clk?jk=cef749d48ab25c24&bb=1yKeFBwUjMJJagLZ1tqXN6w7K8KobI6ejNywASGC_HqoTc01NI7ue6dexOuReyNdSw2Yv5ZZeahxkHRhCzrCA2z6r8a0ofsX0XuAgls0c0dJqq3uMDwyAA%3D%3D&xkcb=SoD_67M3-umJTnx5l50NbzkdCdPP&fccid=5d1506a5df73a48e&vjs=3
Game Rant | Sports Video Game Features Article Writer,GameRant,Remote,Not Provided,Not Provided,"Game Rant is looking for a candidate with extensive familiarity and knowledge about all things Sports Games.
The ideal candidate should both play and follow the…",https://www.indeed.com/rc/clk?jk=fff72a3803f79860&bb=1yKeFBwUjMJJagLZ1tqXN3iWA5FBVwS6tOGBb-SH-opl2SpQyr5GBQdqPRdHexydB0ZtarXqT8vISgcTfeMNhm-uL0yWIYHG7Lghhg6zZD4NNnkBRpqrV4C4hemAD0Dg&xkcb=SoBL67M3-umJTnx5l50MbzkdCdPP&fccid=e3c41c4f7666c1c5&vjs=3
AI Engineer,Cornerstone Defense,"Bethesda, MD",Not Provided,Not Provided,"View all Cornerstone Defense jobs in Bethesda, MD - Bethesda jobs - Engineer jobs in Bethesda, MDSalary Search: AI Engineer salaries in Bethesda, MDSee popular questions & answers about Cornerstone Defense",https://www.indeed.com/rc/clk?jk=61b528624c24ea78&bb=1yKeFBwUjMJJagLZ1tqXN3KC9CDx_GyPnKGGxuOehd06FPagKUO4zr5PcTk-WfnTstTY_a_Sc1w5YgkrJ3U6Bfm5z-9atklyKLBny9XLnNMnuSUrd5nFyG467M69927c&xkcb=SoCi67M3-umJTnx5l50DbzkdCdPP&fccid=c4dad3c95358e466&vjs=3
Chatbot Developer,ADP,"Roseland, NJ 07068",Not Provided,Full-time,You will help us reinvent how associates connect with HR using technology and how we provide support by merging automation with user experience.,https://www.indeed.com/rc/clk?jk=d67bcf4a4edb0da6&bb=1yKeFBwUjMJJagLZ1tqXN2Axt6rsxILKx_WuwHfmlxcolwkUWIpV46IB1c-2h5HPn59PlwvwD0_Kpq2-pXWeLC9spvXKkAGkDFamxzOeKYYHOTOfF5QPZA%3D%3D&xkcb=SoAW67M3-umJTnx5l50CbzkdCdPP&fccid=e996c2d6855fe778&vjs=3
Competitive Intelligence Lead,"Grammarly, Inc.",Hybrid work in United States,Not Provided,Not Provided,"Has experience working at a senior level in competitive intelligence within the tech industry.
Develop and maintain detailed assets to provide our sales team…",https://www.indeed.com/rc/clk?jk=416f3bf573d88116&bb=1yKeFBwUjMJJagLZ1tqXN9dKgsOjfzHfGMH1syUcuKV_PD4Wxlpmq6y-omw7lAvC0Ul1Sj18qG_rclWrxYFJUlHplv38LvtBThiNil-Jwv2Pw2dlZqGZP4uA-4yAdTRV&xkcb=SoCL67M3-umJTnx5l50BbzkdCdPP&fccid=0555014e7bce64c3&vjs=3
"Senior Writer and Editor, AI at Work",Microsoft,United States,"$103,800 - $219,200 a year",Full-time,"The writer and editor will also contribute regularly to WorkLab digital publication, newsletter, and podcast; Microsoft’s thought leadership publication on the…",https://www.indeed.com/rc/clk?jk=a753f4b4e94242de&bb=1yKeFBwUjMJJagLZ1tqXN0Z-51FC2MA_sMbwiyZrQdZL6sx-Am4AtyuXAXoQq5_sSt_Z2UCJSo4nXeRR-xGYxlvdBfJxkptCAgBSKjPb-s9YowGiSiF6YQ%3D%3D&xkcb=SoA_67M3-umJTnx5l50AbzkdCdPP&fccid=734cb5a01ee60f80&vjs=3
AI Data Annotator,Vistatec,United States,Not Provided,Not Provided,"Data Annotators carry out their work in an engineering development environment.
Annotate English data accurately and consistently, and in accordance with…",https://www.indeed.com/rc/clk?jk=644269f566114edb&bb=1yKeFBwUjMJJagLZ1tqXNzGx9Qn3AmoVmdPUOkLGHJ6YjdKW3pOXRu4vv-gGE3w7OX56nfyCrtP4Z-Z1ECvAmLEZbGofg5q3R3w2Oi7BrCClDiPLp-204g%3D%3D&xkcb=SoCx67M3-umJTnx5l50HbzkdCdPP&fccid=33fede40a40fcf6f&vjs=3
Intelligence Watchlist Analyst,Deloitte,United States,Not Provided,Extended hours,"2+ year(s) of open-source / all-source intelligence experience.
Providing intelligence analysis and operational support, you will be responsible for receiving,…",https://www.indeed.com/rc/clk?jk=0189c2b31a0791e6&bb=1yKeFBwUjMJJagLZ1tqXN1EgVqprsEyi1dIx_CwnFtNEZQqTd3hJc53eRx41wAmE27JMaY0YsSQuiBAy90E-q7aIVf-Lac042atLB9I_-DGlIjvYqI4J1Q%3D%3D&xkcb=SoAF67M3-umJTnx5l50GbzkdCdPP&fccid=9e215d88a6b33622&vjs=3
Sustainability Go-to-Market Activation Lead,Microsoft,United States,"$129,200 - $268,900 a year",Full-time,"Sitting in the Cross Solutions Sales Activation team, you will be a dotted-line business partner to the Sustainability GTM team and partner closely with…",https://www.indeed.com/rc/clk?jk=da0e0b51bf349b2b&bb=1yKeFBwUjMJJagLZ1tqXNycdUwHp7wpb7C0rgkSTpBW9GrlaR6BSlPZH1TPeM1oQgRmbV47vjWVvlFugNJf9duNw42by7gdvhKN9DIuiBE3OsrkCwtHtLA%3D%3D&xkcb=SoCY67M3-umJTnx5l50FbzkdCdPP&fccid=734cb5a01ee60f80&vjs=3
