Job Title,Company,Location,Salary($),Job-Type,Job-Description,Raw_Link
Professional Learning and Innovations Assistant,Washington Association of School Administrators,"Hybrid work in Tumwater, WA 98512",From $32.50 an hour,Full-time,"Supports WASA and WASA affiliates with full cycle event preparation, including venue contracts, banquet event orders, budgets, correspondence, and reporting.",https://www.indeed.com/rc/clk?jk=4f72f6f708b32338&bb=Hds11OP-Zo_nFmAatBgONpoP0m4XLDJDuWD4faR3pcdxRweyef6RflrghsKgbilpwkTV5twZcGFfWZrboluxiDAn1PaxIOok6e7eZqXTepP1f7BgKyOD7mXVSxDV_mCir_W6ricRIrw%3D&xkcb=SoBv67M3-uiy5YgXcz0LbzkdCdPP&fccid=0839c8d891ee390f&cmp=Washington-Association-of-School-Administrators&ti=Innovation+Associate&vjs=3
FP&A North America Analyst,Alltech Inc,"Nicholasville, KY 40356",Not Provided,Full-time,"The North American FP&A Analyst will support implementing, developing, and providing financial analysis on KPIs to give data driven insights that will aid…",https://www.indeed.com/rc/clk?jk=7e6a2f14bc1769e9&bb=Hds11OP-Zo_nFmAatBgONlWpeJglfTnXrKSCP1pXqqeF7LOSD0Rm_ca4ZJ9p2LgxrQ34sAbtYFL-3trPSXDi9DkuQm2NWvBa6lxyHOQTXb8_xObCDp0_jpzHZMgOMlhK&xkcb=SoDb67M3-uiy5YgXcz0KbzkdCdPP&fccid=7493d0498a48729e&vjs=3
Data AI Architect,Boston Technology,"Berlin, NJ 08009",$76.22 - $90.00 an hour,Full-time,"The ideal candidate will be responsible for designing and implementing innovative and efficient solutions for our clients.
Strong in Azure ML and DataBricks.",https://www.indeed.com/rc/clk?jk=14cc4953e2b73ff6&bb=Hds11OP-Zo_nFmAatBgONnxGeHOVwX3C9p_ckyrusKqiGi0gJR38eqtQX-A_C0C3z03z3dn3ScbbBo8GEMC7HN1kj_0Mfr5HT9tVOcoiU4tro7hj0DojE5x0-p6prXa1&xkcb=SoBG67M3-uiy5YgXcz0JbzkdCdPP&fccid=4944c1d0a4b3ab8a&cmp=Boston-Technology&ti=Architect&vjs=3
Junior All-Source Intelligence Analyst,ALQIMI,"Arlington, VA",Not Provided,Not Provided,"Minimum three years of US DoD/IC analyst experience, including experience as an all-source analyst in an US government classified environment producing finished…",https://www.indeed.com/rc/clk?jk=20adbd7982a3ebfc&bb=Hds11OP-Zo_nFmAatBgONsMwGnjxE35NyK8bapnK-1jezEr1iU4I1Q2tv2xx9s9TXr1lmhn7Z3D2jPv6PAFX8XPNomjaEttULD77kiUDLqMYFwbn6rLnJLOC1O9X4Q6l&xkcb=SoDy67M3-uiy5YgXcz0IbzkdCdPP&fccid=1f2dd3379c20468f&vjs=3
Asset Protection Specialist,The RealReal,"Perth Amboy, NJ 08861",$18.50 - $19.00 an hour,Full-time,"As an Asset Protection Specialist you will be responsible for assisting with all aspects of Loss prevention, investigations, physical security, and safety…",https://www.indeed.com/rc/clk?jk=8771b764a69dadb1&bb=Hds11OP-Zo_nFmAatBgONt010O-YSsx5pscHtwKvwp3FQuvlABZ3SUOvOz3Rc2V1lh_sCIIWNzHYk85rEZXm9n7E373-9s4oM2eA24F-NPawOqEMX_D8iGoACKSqXJWT&xkcb=SoB867M3-uiy5YgXcz0PbzkdCdPP&fccid=1b0692814cc13474&vjs=3
Data Scientist,BMO US,"Chicago, IL 60606 (West Loop Gate area)",Not Provided,Not Provided,"You will consult with Business, Risk and Tech Stakeholders to research, build, and implement scalable artificial intelligence systems capable of learning and…",https://www.indeed.com/rc/clk?jk=ae7d9e92e6c25d1d&bb=Hds11OP-Zo_nFmAatBgONot_Nd3HarjJD5KzO2ciCSXKGEJ8RGQiwMlLA6-sZipz-P_CPz2q6yLKRwecAFqqKJnbcDZyKxy1Idcef8DbxjmzTMKKQdQ4WMP82TXyqYNG&xkcb=SoDI67M3-uiy5YgXcz0ObzkdCdPP&fccid=c9b51b880e5f15f6&vjs=3
Head of Creative & Marketing,Majority,"Miami, FL",Not Provided,Not Provided,Were looking for a strategic thinker with a strong understanding of creative production and digital marketing to lead our creative team.,https://www.indeed.com/rc/clk?jk=95513bd9a43e6852&bb=Hds11OP-Zo_nFmAatBgONuWWfRVRsdJNpDlsAUWuVwX56iFXsJNXQi1LE6jaQ7uCeC_tCJcQ50-uZ5Rjo60cwqNh0DGSmArshf1PjIts9alIMfiGAL5qHo6KsrAVByW7&xkcb=SoBV67M3-uiy5YgXcz0NbzkdCdPP&fccid=82f55b4b57928c0c&vjs=3
Director of Digital,Carmichael Lynch,"Minneapolis, MN 55403 (Downtown West area)",Not Provided,Full-time,"Professional Development (performance reviews 2x annually, training opportunities related to your field of development, one-on-ones with managers, etc.).",https://www.indeed.com/rc/clk?jk=7a31249582d5f8ca&bb=Hds11OP-Zo_nFmAatBgONkl0DddJrBxlQ0c8jQnhHp-GnrUkSEL7DJd_xyL1rZU06gaYzleJAkKeOogq2msgNuDAJ_SplgmpptTGcSWp08C5JqDjGT2Ryw%3D%3D&xkcb=SoDh67M3-uiy5YgXcz0MbzkdCdPP&fccid=a56ce1740d83d6d9&vjs=3
AI Engineer,Cornerstone Defense,"Bethesda, MD",Not Provided,Not Provided,"View all Cornerstone Defense jobs in Bethesda, MD - Bethesda jobs - Engineer jobs in Bethesda, MDSalary Search: AI Engineer salaries in Bethesda, MDSee popular questions & answers about Cornerstone Defense",https://www.indeed.com/rc/clk?jk=61b528624c24ea78&bb=Hds11OP-Zo_nFmAatBgONjlg3z0Ljnaf3e5PK_sMWhtktYvUPybF3sh2Wc0NRlXZCQuJ7flimVV0yhgTYC1U-IQH151tC0uN23UnayeFwFo7zMMwnmmFPjQbs9p3MfQB&xkcb=SoAI67M3-uiy5YgXcz0DbzkdCdPP&fccid=c4dad3c95358e466&vjs=3
Chatbot Developer,ADP,"Roseland, NJ 07068",Not Provided,Full-time,You will help us reinvent how associates connect with HR using technology and how we provide support by merging automation with user experience.,https://www.indeed.com/rc/clk?jk=d67bcf4a4edb0da6&bb=Hds11OP-Zo_nFmAatBgONlMCflkOEEAtfJG4reMzqBYvECvlms-6ZXVjviL-rC5wjHjzmXT9wClXf0Z4oVfEG_bcm5TqJpVMxs6GiPJo0C2qhqElpIv3mw%3D%3D&xkcb=SoC867M3-uiy5YgXcz0CbzkdCdPP&fccid=e996c2d6855fe778&vjs=3
AI Data Annotator,Vistatec,United States,Not Provided,Not Provided,"Data Annotators carry out their work in an engineering development environment.
Annotate English data accurately and consistently, and in accordance with…",https://www.indeed.com/rc/clk?jk=644269f566114edb&bb=Hds11OP-Zo_nFmAatBgONjM5T9ecaUBMufxFMU--4Km6jwrO4Be_e9SswQHuVJpJkxdoPTTsH2XvK9aGLOOvlZS7vN561HH2wQIy4M78wE4o8ymn4YFCAQ%3D%3D&xkcb=SoAh67M3-uiy5YgXcz0BbzkdCdPP&fccid=33fede40a40fcf6f&vjs=3
"Senior Writer and Editor, AI at Work",Microsoft,United States,"$103,800 - $219,200 a year",Full-time,"The writer and editor will also contribute regularly to WorkLab digital publication, newsletter, and podcast; Microsoft’s thought leadership publication on the…",https://www.indeed.com/rc/clk?jk=a753f4b4e94242de&bb=Hds11OP-Zo_nFmAatBgONhwbGG6DL_KKUorqOtKUQiYxbY52ZonPg8OjHxlS0XETQxzt8uCYKnj2qJgOsof4Q6dtOFMczcqOWjAIE4lR7xgF7QCzKnvWEg%3D%3D&xkcb=SoCV67M3-uiy5YgXcz0AbzkdCdPP&fccid=734cb5a01ee60f80&vjs=3
Competitive Intelligence Lead,"Grammarly, Inc.",Hybrid work in United States,Not Provided,Not Provided,"Has experience working at a senior level in competitive intelligence within the tech industry.
Develop and maintain detailed assets to provide our sales team…",https://www.indeed.com/rc/clk?jk=416f3bf573d88116&bb=Hds11OP-Zo_nFmAatBgONjwv0hixGPS5YTdDqG8z3kVWX1EMHGOGOyJ0rPdqddklUAnqG4ZfACxINz9uxbriJbRmonO2HfAewwkzRbT6FJH_mM4F2RLNqWWXvHe1lPCl&xkcb=SoAb67M3-uiy5YgXcz0HbzkdCdPP&fccid=0555014e7bce64c3&vjs=3
Intelligence Watchlist Analyst,Deloitte,United States,Not Provided,Extended hours,"2+ year(s) of open-source / all-source intelligence experience.
Providing intelligence analysis and operational support, you will be responsible for receiving,…",https://www.indeed.com/rc/clk?jk=0189c2b31a0791e6&bb=Hds11OP-Zo_nFmAatBgONjdg2Y7h3O4y8ELtFcylSE2cXt0yNOMe2jeiswlYxF1V5xVNZUy0JlmfVZVz6zn-ZPIdnfCoTaTq67d34Y3qO_JVJAafSD_sTA%3D%3D&xkcb=SoCv67M3-uiy5YgXcz0GbzkdCdPP&fccid=9e215d88a6b33622&vjs=3
Finance Insights Consultant,Deloitte,United States,"$88,800 - $148,000 a year",Not Provided,"We work as trusted advisors to CFO’s, COO’s, CIO’s and other key executives to advise, implement, and deliver as-a service solutions, improving finance, shared…",https://www.indeed.com/rc/clk?jk=0b54a7c8a5788ee8&bb=Hds11OP-Zo_nFmAatBgONvkpv_BL5kq6STxrepCEXp81PJfFnM7e5TEndT4yYMJKGZggfMsaMJoqG8lR9NtZ3zWRO7YE-wrDVH1b_S5p-SLm_wFsNq3SKA%3D%3D&xkcb=SoAy67M3-uiy5YgXcz0FbzkdCdPP&fccid=9e215d88a6b33622&vjs=3
