Job Title,Company,Location,Salary($),Job-Type,Job-Description,Raw_Link
Account Executive,PR Volt,Remote,Not Provided,Not Provided,PR Volt is a platform that empowers PR Professionals to deliver game-changing press coverage for fast-growing small businesses.,https://www.indeed.com/rc/clk?jk=6bcf2f5ffcfab618&bb=lVwHwCQF9wnigkrKcwpTyOJ5qMY-JU-jYTAsjqzkCl-q0bnWwEZPriL1LCmluoatOJSp-kT3MgJltrh53ISq5KyY5DW1IO0HkkK99jtxNIle429lWLg_46GvNxPmZUnZ&xkcb=SoDO67M3-uviRJapFB0LbzkdCdPP&fccid=2904ce4ae6c446df&vjs=3
Data Scientist,Reed Smith LLP,"Pittsburgh, PA 15222 (Central Business District area)",Not Provided,Not Provided,"Reed Smith is a global relationship law firm with more than 1,700 lawyers in 30 offices throughout the United States, Europe, Asia and the Middle East.",https://www.indeed.com/rc/clk?jk=e60792b34aaff9d5&bb=lVwHwCQF9wnigkrKcwpTyFxxQX6GwXqABMtgzCp-my5243RBCtS83er8Ztn0PmryjUsVKwmeDKjAMK6_zzlbzoaS5GtfvZ3Tujnr8dabCr_UPxo8iQlnOJzkfOLwt8kS&xkcb=SoB667M3-uviRJapFB0KbzkdCdPP&fccid=3311bd64d1adad82&vjs=3
Scientist I - Computational Biologist / AI/ML Researcher,Allen Institute,"Hybrid work in Seattle, WA 98109","$82,600 - $110,200 a year",Full-time,"Scientist I - Computational Biologist/ AI/ML Researcher - OCTO.
The mission of the Allen Institute is to unlock the complexities of bioscience and advance our…",https://www.indeed.com/rc/clk?jk=f628cdddb101d373&bb=lVwHwCQF9wnigkrKcwpTyMM0EURgOUM8AzG2stvGp7XO13sVydVLgr5W3IQ3rkUNNv4-3Uv_-FvnJwdF0JQNRXOeqX4HM5WZPo3ehABpRx6vqhA9jnGXQzYLEk__dORL&xkcb=SoDn67M3-uviRJapFB0JbzkdCdPP&fccid=6b1f64ade51f4574&vjs=3
Learning Design Specialist,The RealReal,"Hybrid work in Perth Amboy, NJ 08861","$60,000 - $80,000 a year",Full-time,The RealReal is seeking a Learning Design Specialist to support the Head of Experience and Education in infusing a culture of learning and transforming the…,https://www.indeed.com/rc/clk?jk=1c59254fd5a5df88&bb=lVwHwCQF9wnigkrKcwpTyMG5C60nHgLY00XdxnuEjFYUMUS5atY-kW2UAPdRFesAP6XBnPZd6v2thwHN0t_Ipyf_Yc3TSAPxzJ5kNlssL6-vYNF1KpqHzrYUOPqCjbG2&xkcb=SoBT67M3-uviRJapFB0IbzkdCdPP&fccid=1b0692814cc13474&vjs=3
Software & AIML Products Counsel - AI Products and Policy,Apple,"Cupertino, CA","$193,000 - $290,100 a year",Full-time,"Imagine what you could do here.
At Apple, new ideas have a way of becoming great products, services, and customer experiences very quickly.",https://www.indeed.com/rc/clk?jk=70c42e40e947bd59&bb=lVwHwCQF9wnigkrKcwpTyNfyhR0gWiDZNRR8Ff_zzZE_wJbCeWGmfJRcNv_QvldturQx3LW3knzO97_NrwF60eSd4aVVgR940IftKukscOkV5HFyLP9nqg%3D%3D&xkcb=SoDd67M3-uviRJapFB0PbzkdCdPP&fccid=c1099851e9794854&vjs=3
Copywriter,OLIVER Agency,"Wilmington, DE","$65,000 - $75,000 a year",Not Provided,"As a part of The Brandtech Group, were at the forefront of leveraging cutting-edge AI technology to revolutionise how we create and deliver work.",https://www.indeed.com/rc/clk?jk=a67700ad5b83fae5&bb=lVwHwCQF9wnigkrKcwpTyMG5C60nHgLYTJJYgekaO9qoUoQ-lcHXZqoPR7uxfY93g_Uq_PjXhEJzd-6jwZ8RqEH1Pr2VGeLm_0pjFa6rEXIWY2FcYnvsaphoUfXKP4SG&xkcb=SoBp67M3-uviRJapFB0ObzkdCdPP&fccid=e682b069b0923edc&vjs=3
Wi-Fi Research Engineer,SpanIdea Systems,Remote,$65 - $90 an hour,Contract,"Research and Develop: Explore Wi-Fi 8 features, contribute to standardization efforts, and innovate wireless solutions.
Pay: $65.00 - $90.00 per hour.",https://www.indeed.com/rc/clk?jk=01b356c76b9ab560&bb=lVwHwCQF9wnigkrKcwpTyPheracmR1Z6jc0hEWCAvjRUsa80e3WzvT_hUvkyyUxloQcNItStMIuooeiYSjRjdfq16xGOWLdSu-46tIFGULLVMV7KPcu20Z9pwjachIFp&xkcb=SoD067M3-uviRJapFB0NbzkdCdPP&fccid=0d33eb8110cc8c07&cmp=Spanidea-Systems&ti=Research+Engineer&vjs=3
"Lead/Principal IT Architect, Public Sector Industry Leader (Defense & Security, Civil Sector) - Platinion",Boston Consulting Group,"Washington, DC",Not Provided,Full-time,"Locations: Washington | New York | Atlanta | Pittsburgh | Philadelphia | Boston.
Boston Consulting Group partners with leaders in business and society to tackle…",https://www.indeed.com/pagead/clk?mo=r&ad=-6NYlbfkN0Ad1FFWZOsBBwBZDGouyCcICeLSd3pQct3wJ1q5dPO7JA73NfCuXMquj2Tg4sX590vnpoFHZaF4sgeKxRS5hHR5SuQnNcN1vB-nPx2VsbWnsvSlDw7CHZXQn2OW_7HWZwOnXfuBHaId2LM1G9vJryYTNArXsmOt0Kgaa8f6c0yCqioGrGKl_Zylmg0lhqUKUi83jsG5vk-fExHbIX84TC2wNReSK462QdjXyhBiFn0t6zDQ2OtMfouqAHPok0EReN7lnajgm4tzmwfPm7yDPQuCnEEijfLbss2cAbFqTseO3qZtwLygcpVdLA07k8NYttM7AiWREW6XsxEK8-g7ID7dkP9bbatIemuY_lQ4bO1bk77uJBxT3WsF07QrxOoHRJAkNd8HNIAuw9FjePDuCM9HdCrogrwQGG9OraJDfenrDkdA8mu75bd0Up1LRRMxtrjs91Ow2Bxvt1WRDS1lgS1WwVY7fVYRCgK7xNmy0m8Qi5M7Tcnf0PYNS2hpta4B21R9wgY-Bfz7LZM_E62rVNLPhLsnGf8g6R_-WMj9FUeGibi72MYVLRyLvva3HbYw8kRsp79wk30snlAWdSu0M9impiKgithiVzvZtZZvJ98W9CqBq8TyknRhkPDE2DsSuHHRhbpm0r0G7How1jt8_B3IBgm4YeJxGuCbXS0u6CXWMixqMnMAryxL0DPqcu-r04vx6VQ_aUlJgP0KXTMaejAJ1-Dml_G7NVzbRqQ3vhPrrqWWntAWJifpcmaeHP4Ol2mr4QL5q9cX2JIonNpgY7xUnSuB8hK9zk_FJP_7XkPszpSJjDK1UeDELeKrPJtOY3pLebdBlXu9jSp4UyI4PvyA97bJ6uVcAN5qA9V2IhW5GtTamfjf1xnqQetFnjb5ErNjUB5U81INelzBBYycTz0Jz-3o1YOZrUHZE11fQk49Whqvft0i4izMZ6hRGFnyHJg3v-LuYNyaXVK4MbGfwCtGtJYsZg4Wm3FqJtUFbF835zkHJHYzysJklWfYhPjXSRDFXbKziDSUzZiXuYwQWZ7VUolyBNhI-hnf_oeuD_D4_VvAaaWQRCrAmq2nCacoPMVGopm12EqPFtIgswVuOWk_-lEzLUKBKA2RDWnmLa6endGbR18lRNFxL3ZmJmmJm0pWR6DJNQGq_3IPGSK3-kYRRX-hlq0oaFLt1QihAe8hg3APXUM85qf41hW5-ziFg6NdPUdV-o22YLyoopqTt48TAXCcWYpG6RSseL1ADYTAida3VOi6vNQxl2bmtjc8zxAOfCZDPyXTaRtga2G13x5iO2U-W65lBkssZZRetMACU0l0itGIRsaYqIyTuafTpapqlwdOmVpe2t9B2tbOzsx8ciI5AhO7r1EwynOiPDaVV9kAcJSdyK2xltD6WF3h-U9urCpSBUv-UhAkjF8lgQHY66ammREnUIBRW7RyTpV1LHygx_SJ_PSp&xkcb=SoC06_M3-uviRJapFB0MbzkdCdPP&camk=nUmJqO2E8rgYY6ZEg7fMWw==&p=7&fvj=0&vjs=3
AI Engineer,Cornerstone Defense,"Bethesda, MD",Not Provided,Not Provided,"View all Cornerstone Defense jobs in Bethesda, MD - Bethesda jobs - Engineer jobs in Bethesda, MDSalary Search: AI Engineer salaries in Bethesda, MDSee popular questions & answers about Cornerstone Defense",https://www.indeed.com/rc/clk?jk=61b528624c24ea78&bb=lVwHwCQF9wnigkrKcwpTyM3rF6pDhgSaSyyrWSj-16xtg5EmvF_uXVz7lJBTSSWsYA8CazjUnzJuuRgGhGWhn6yLieXxsJARCPy-Ql7GKNffSWWJ6yoo0kLem9lWqaLB&xkcb=SoCp67M3-uviRJapFB0DbzkdCdPP&fccid=c4dad3c95358e466&vjs=3
Chatbot Developer,ADP,"Roseland, NJ 07068",Not Provided,Full-time,"The HR Technology team is responsible for transforming Human Resources with science, technology and human intelligence.",https://www.indeed.com/rc/clk?jk=d67bcf4a4edb0da6&bb=lVwHwCQF9wnigkrKcwpTyLXax-BoekffMWw_NfnZbRyZd8nq0skhEhfh3ob_TppPRZenZs8PdabQJx42Gw7OiMgFJjcc2_Th2cM1HyPCG_NCiC-vfu2dOA%3D%3D&xkcb=SoAd67M3-uviRJapFB0CbzkdCdPP&fccid=e996c2d6855fe778&vjs=3
AI Data Annotator,Vistatec,United States,Not Provided,Not Provided,"We are seeking Data Annotators to perform annotation tasks on a multitude of English datasets.
These datasets are primarily text-based, but can also include…",https://www.indeed.com/rc/clk?jk=644269f566114edb&bb=lVwHwCQF9wnigkrKcwpTyIxv0mqVJuoK3YhjryGuWehXXZIMPMOh-mQ1qzeQZ2sewnjLOK0coGl0SpE1pr20pGrpKbiSR8hKMX6f_NxtJD_eUsqls3C-ZQ%3D%3D&xkcb=SoCA67M3-uviRJapFB0BbzkdCdPP&fccid=33fede40a40fcf6f&vjs=3
Intelligence Watchlist Analyst,Deloitte,United States,Not Provided,Extended hours,"Additional experience demonstrating an understanding of intelligence challenges, preferably terrorist threats.
Strong Writing and briefing skills.",https://www.indeed.com/rc/clk?jk=0189c2b31a0791e6&bb=lVwHwCQF9wnigkrKcwpTyPGwvDhuLb-Vpnv3zr1HBBEEyf_FIy9vdpjoLn2m2TN3feLncVLZGBWUPocPl7yVeJ1z0zZJ5Pbcf-gJhOt20N6pauWc3-Kwyg%3D%3D&xkcb=SoA067M3-uviRJapFB0AbzkdCdPP&fccid=9e215d88a6b33622&vjs=3
"Deloitte Consulting, Government & Public Services - Applied AI Analyst",Deloitte,United States,Not Provided,Not Provided,"When organizations undergo significant changes, face difficult roadblocks, seek process efficiency or identify technological opportunities, they need a trusted…",https://www.indeed.com/rc/clk?jk=fd0f0d64ca6be454&bb=lVwHwCQF9wnigkrKcwpTyCjr1XsI9HniL_D8pr4LxDnQHeNX9fvNO89UE6DPCqk6Mv9XFi6xDFvSDxoOeHuTEiZikaTDA7iR3bGhQqE9r81TYi7Eu91eZg%3D%3D&xkcb=SoC667M3-uviRJapFB0HbzkdCdPP&fccid=9e215d88a6b33622&vjs=3
"Senior Writer and Editor, AI at Work",Microsoft,United States,"$103,800 - $219,200 a year",Full-time,"On the AI at Work Marketing team, we aim to deliver world-class content to help business leaders understand how AI is reshaping work—and how Microsoft Copilot…",https://www.indeed.com/rc/clk?jk=a753f4b4e94242de&bb=lVwHwCQF9wnigkrKcwpTyLoursrxpPWOjemXNy3ohZyXzzADM_Tx-pDpokezdetoecUAuMOAvmMMp7B-fIX7Nv5weHiIexdyD_ymwC0Xj79wgJgVbo-VMQ%3D%3D&xkcb=SoAO67M3-uviRJapFB0GbzkdCdPP&fccid=734cb5a01ee60f80&vjs=3
Competitive Intelligence Lead,"Grammarly, Inc.",Hybrid work in United States,Not Provided,Not Provided,"Has experience working at a senior level in competitive intelligence within the tech industry.
Develop and maintain detailed assets to provide our sales team…",https://www.indeed.com/rc/clk?jk=416f3bf573d88116&bb=lVwHwCQF9wnigkrKcwpTyJYt7J1WAK6_a3xBuyFwgK2uizwwFt2Oi1cKy-WfRUyp0Z1WVaWAOWfw9XkBuh-SxctCe-XT6w2bgFDL7UuPY73E4-45r-TZrtal7ofIoJZ6&xkcb=SoCT67M3-uviRJapFB0FbzkdCdPP&fccid=0555014e7bce64c3&vjs=3
