Job Title,Company,Location,Salary($),Job-Type,Job-Description,Raw_Link
"ENGINEER - RESEARCH ENGINEER - AI Computer Engineering - Warner Robins, Georgia",Southwest Research Institute,"Warner Robins, GA 31088",Not Provided,Not Provided,"View all Southwest Research Institute jobs in Warner Robins, GA - Warner Robins jobs - Computer Engineer jobs in Warner Robins, GASalary Search: ENGINEER - RESEARCH ENGINEER - AI Computer Engineering - Warner Robins, Georgia salariesSee popular questions & answers about Southwest Research Institute",https://www.indeed.com/rc/clk?jk=35ee2b04b04136a7&bb=E0R6WUWfY43PpHo5SYA59n692yK0R6PU2D0XkTIUjzS7RU1MHue0ZOIUtUZpy5bTsY0FgEwdXkGs4AEV-qPdoSWGvxTnrAn1S7Jcoy6VOOpiEfIMfRIH9w%3D%3D&xkcb=SoCp67M3-um6XeapGp0LbzkdCdPP&fccid=0d9a7400c0a8fdec&vjs=3
"Senior Director, Design",Cohere Health,"Remote in Boston, MA","$180,000 - $215,000 a year",Not Provided,"View all Cohere Health jobs in Boston, MA - Boston jobs - Senior Designer jobs in Boston, MASalary Search: Senior Director, Design salaries in Boston, MASee popular questions & answers about Cohere Health",https://www.indeed.com/rc/clk?jk=3621e3a3ee4eefc8&bb=E0R6WUWfY43PpHo5SYA59iVJAusEnU-T1BileiaTeoKzqYhfvGmFaqVUrlsE9m9iiko-ZAmaXoJzodT4w7QhzHgp_JEQLadpzdYz_2do2Pi0k63r36doAITfPJ4s0KMS&xkcb=SoAd67M3-um6XeapGp0KbzkdCdPP&fccid=2ce3a21e0a968aec&vjs=3
Software Sales,"Vantagepoint ai, LLC","Westchase, FL 33626","$100,000 a year",Full-time,"View all Vantagepoint ai, LLC jobs in Westchase, FL - Westchase jobs - Sales jobs in Westchase, FLSalary Search: Software Sales salaries in Westchase, FLSee popular questions & answers about Vantagepoint ai, LLC",https://www.indeed.com/rc/clk?jk=28e4fc6a657bbe52&bb=E0R6WUWfY43PpHo5SYA59p8DkkMnZ-lJL6DEYyytHYXxNvosErSZJYWdAy-tqmceTaarYb2_RP7SpdL5SMqr3MWEGSAWPEl74-lmGqMmFS5sezDExluKfdBC83Ipdir9&xkcb=SoCA67M3-um6XeapGp0JbzkdCdPP&fccid=3c14a778776ef983&vjs=3
Post Doctoral Fellow - Artificial Intelligence and Machine Learning,Emory University,"Atlanta, GA 30322",Not Provided,Full-time,"View all Emory University jobs in Atlanta, GA - Atlanta jobs - Post-doctoral Fellow jobs in Atlanta, GASalary Search: Post Doctoral Fellow - Artificial Intelligence and Machine Learning salaries in Atlanta, GASee popular questions & answers about Emory University",https://www.indeed.com/rc/clk?jk=5f92a2433e9004a3&bb=E0R6WUWfY43PpHo5SYA59vGVVHCSIrMolCbv9bGIMf4aYIB0uvJohzlMA3yFvPbYtS5d6tEbIkUPFOejc4lX2rP31w5mvzH-PdekdU_ZnFdd06uDYBnwaA%3D%3D&xkcb=SoA067M3-um6XeapGp0IbzkdCdPP&fccid=efe5e2d22a1d29e5&vjs=3
Associate II,"John Snow, Inc","Hybrid work in Boston, MA 02210","$72,246 - $105,837 a year",Full-time,"View all John Snow, Inc jobs in Boston, MA - Boston jobs - Retail Sales Associate II jobs in Boston, MASalary Search: Associate II salaries in Boston, MA",https://www.indeed.com/rc/clk?jk=45144626687579be&bb=E0R6WUWfY43PpHo5SYA59oPPyFtiGOJKD38B3WRtllfFWYuWKME5D2yGUUj1_kC-vXrwRyt-iUPZdQK9GwetBkhHv8La3XqeyRiNDkV-LhD3Saj2COFnwDtM0TdW4q57&xkcb=SoC667M3-um6XeapGp0PbzkdCdPP&fccid=52f9a4dde3bc5fe5&cmp=JSI-%2526-World-Education&ti=Retail+Sales+Associate+II&vjs=3
Senior AI Engineer - Remote,The Cigna Group,Remote,Not Provided,Not Provided,View all The Cigna Group jobs in Remote - Remote jobs - Senior Engineer jobs in RemoteSalary Search: Senior AI Engineer - Remote salaries in RemoteSee popular questions & answers about The Cigna Group,https://www.indeed.com/rc/clk?jk=87eed957fcd15be9&bb=E0R6WUWfY43PpHo5SYA59lWmCMqI3COyFOb0sBT4rBs9EBKu0KWK3aszzE_TvaZa-INP1K8yIlrsOG5ITGWcrYJHcpKP1_pF3ot4slsEkAo9f-R-ZQFSXg%3D%3D&xkcb=SoAO67M3-um6XeapGp0ObzkdCdPP&fccid=afbf8c270610a38a&vjs=3
Senior Content Designer/UX Writer - Artificial Intelligence,Wells Fargo,"New York, NY","$100,800 - $179,200 a year",Full-time,"View all Wells Fargo jobs in New York, NY - New York jobs - Senior Content Writer jobs in New York, NYSalary Search: Senior Content Designer/UX Writer - Artificial Intelligence salaries in New York, NYSee popular questions & answers about Wells Fargo",https://www.indeed.com/rc/clk?jk=d97968dcbea6bd79&bb=E0R6WUWfY43PpHo5SYA59i4inwB4L0ofXUkQVGejISlRv2pZ32eVF9wwwhfEy27I2bgYmh6sWeLfC7E3yrNiw9nmvuRPxQy4r2Y5D-3rmg1cbxBxPbcsGw%3D%3D&xkcb=SoCT67M3-um6XeapGp0NbzkdCdPP&fccid=78bbcd26e39621f5&vjs=3
Trades Technician - Grounds,Germanna Community College,"Spotsylvania, VA","$36,139 - $44,886 a year",Full-time,"View all Germanna Community College jobs in Spotsylvania, VA - Spotsylvania jobs - Technician jobs in Spotsylvania, VASalary Search: Trades Technician - Grounds salaries in Spotsylvania, VASee popular questions & answers about Germanna Community College",https://www.indeed.com/rc/clk?jk=32754ae253ce59d3&bb=E0R6WUWfY43PpHo5SYA59kn0EwahRIq_tY7QBLx7HVtE0cYDcX5ro8-AoSw-Vur8TqkPUQUzeKZZE4IncHEt8E7ua9t6MquyG9p07RCxGKVTme7ZblRG8ouJMcauya5y&xkcb=SoAn67M3-um6XeapGp0MbzkdCdPP&fccid=1b01e4b7b6764d7e&vjs=3
AI Engineer,Cornerstone Defense,"Bethesda, MD",Not Provided,Not Provided,"View all Cornerstone Defense jobs in Bethesda, MD - Bethesda jobs - Engineer jobs in Bethesda, MDSalary Search: AI Engineer salaries in Bethesda, MDSee popular questions & answers about Cornerstone Defense",https://www.indeed.com/rc/clk?jk=61b528624c24ea78&bb=E0R6WUWfY43PpHo5SYA59rLEFfOSJn41OLinSWxT0b7teMGC4hWTX6vvHGnbvBbLiGdAWCvyLIHMLkBouKkh4sYvQWmSSpeJ-qYpqBUuXyaCvxJZsFuNAU1gjqrd8DgR&xkcb=SoDO67M3-um6XeapGp0DbzkdCdPP&fccid=c4dad3c95358e466&vjs=3
Chatbot Developer,ADP,"Roseland, NJ 07068",Not Provided,Full-time,"View all ADP jobs in Roseland, NJ - Roseland jobs - Developer jobs in Roseland, NJSalary Search: Chatbot Developer salaries in Roseland, NJSee popular questions & answers about ADP",https://www.indeed.com/rc/clk?jk=d67bcf4a4edb0da6&bb=E0R6WUWfY43PpHo5SYA59phOXmgU9knS3uVJdRMwYurx_CNZ385X9EylQsAWY2e_4oSwe6mTwW5c-UMwuq0WL04_qbZ1DrmM0My5WVZQgzn95n2mGeG0UA%3D%3D&xkcb=SoB667M3-um6XeapGp0CbzkdCdPP&fccid=e996c2d6855fe778&vjs=3
Competitive Intelligence Lead,"Grammarly, Inc.",Hybrid work in United States,Not Provided,Not Provided,"View all Grammarly, Inc. jobs in United States - United States jobsSalary Search: Competitive Intelligence Lead salariesSee popular questions & answers about Grammarly, Inc.",https://www.indeed.com/rc/clk?jk=416f3bf573d88116&bb=E0R6WUWfY43PpHo5SYA59sf__UpPINfwwgFWXdyj9vnelsyNNdiBhvD0tpG2nxsztkABatjSZpPdQsyKpq-MJC4QLkJF8xt5Z2_IDu0CNfXJ209qztfwNM-OsZpp9ee2&xkcb=SoDn67M3-um6XeapGp0BbzkdCdPP&fccid=0555014e7bce64c3&vjs=3
"Senior Writer and Editor, AI at Work",Microsoft,United States,"$103,800 - $219,200 a year",Full-time,"View all Microsoft jobs in United States - United States jobs - Senior Writer/Editor jobs in United StatesSalary Search: Senior Writer and Editor, AI at Work salaries in United StatesSee popular questions & answers about Microsoft",https://www.indeed.com/rc/clk?jk=a753f4b4e94242de&bb=E0R6WUWfY43PpHo5SYA59kv4oFKZ__it3eDpMfLUZDFdDJxNDkirPHK0hs6w8OuOT35pRG8YfUI6Zf45ezr2J2ojzB34ncYX0ThXufQ_eKGjVNYd8ysj5Q%3D%3D&xkcb=SoBT67M3-um6XeapGp0AbzkdCdPP&fccid=734cb5a01ee60f80&vjs=3
AI Data Annotator,Vistatec,United States,Not Provided,Not Provided,View all Vistatec jobs in United States - United States jobsSalary Search: AI Data Annotator salariesSee popular questions & answers about Vistatec,https://www.indeed.com/rc/clk?jk=644269f566114edb&bb=E0R6WUWfY43PpHo5SYA59nfurmYlWsZ7K-BL_-rqsxEmPeVT4edlGiKcHe4-sQpuK_sgCCU5TRFi8FUNy98625atD6muK47d5Z1r0Yzcw1daMh72j5IqOQ%3D%3D&xkcb=SoDd67M3-um6XeapGp0HbzkdCdPP&fccid=33fede40a40fcf6f&vjs=3
Sustainability Go-to-Market Activation Lead,Microsoft,United States,"$129,200 - $268,900 a year",Full-time,View all Microsoft jobs in United States - United States jobsSalary Search: Sustainability Go-to-Market Activation Lead salariesSee popular questions & answers about Microsoft,https://www.indeed.com/rc/clk?jk=da0e0b51bf349b2b&bb=E0R6WUWfY43PpHo5SYA59kCQOle8ugy1Z8pWfZPR-UnE7nhJiYQKqpY03Z53ufDh5DL_A4xxfqs7etwWqSlHdrfdttDKgiucsixKWvKjgxQeRH8mSM_2wA%3D%3D&xkcb=SoBp67M3-um6XeapGp0GbzkdCdPP&fccid=734cb5a01ee60f80&vjs=3
Partner Technology Strategy AI Services,Microsoft,United States,"$103,800 - $219,200 a year",Full-time,View all Microsoft jobs in United States - United States jobs - Partner jobs in United StatesSalary Search: Partner Technology Strategy AI Services salaries in United StatesSee popular questions & answers about Microsoft,https://www.indeed.com/rc/clk?jk=2f0cd40c3bb39431&bb=E0R6WUWfY43PpHo5SYA59vr0ZA6lzEmaaoTCX6DDiBQwLhkYPfNlcs_bsNgmRfsKP3yPOPaViHU5b5LzVJKh9piTXZ3nTYNbDjW4FcTeSHjHNXlwMvs-WQ%3D%3D&xkcb=SoD067M3-um6XeapGp0FbzkdCdPP&fccid=734cb5a01ee60f80&vjs=3
