Job Title,Company,Location,Salary($),Job-Type,Job-Description,Raw_Link
Associate II,JSI,"Boston, MA 02210 (South Boston area)","$72,246 - $105,837 a year",Not Provided,"View all JSI jobs in Boston, MA - Boston jobs - Retail Sales Associate II jobs in Boston, MASalary Search: Associate II salaries in Boston, MASee popular questions & answers about JSI",https://www.indeed.com/rc/clk?jk=155657918145705f&bb=ugpkVBrqgEI_zfIu0Lu5FzcDRWkfKY44GJ2Qwd1slkjdomeHSuuxQ02sszGhN-60O0XRgQWEei_m0tIF25_QCm89XMwlbqVYOPur4jUIdfNJgyqWLrllcfCSxAVC5Qcw&xkcb=SoC367M3-umVSGUTU50LbzkdCdPP&fccid=fe36c8f8c4a817e4&vjs=3
Streamer/Part Time,Johnson Solar Corp.,"Adelanto, CA 92301",$20 - $25 an hour,Part-time,"View all Johnson Solar Corp. jobs in Adelanto, CA - Adelanto jobsSalary Search: Streamer/Part Time salaries",https://www.indeed.com/rc/clk?jk=2a97694c2830b058&bb=ugpkVBrqgEI_zfIu0Lu5FzcDRWkfKY444CGzH9roSXIuyuhf6nszl6beiJYIuxXaimTDmL0Drb2g-R5EJZ7VUkPD9ADBUYtXwv1451wBWH_r6Sv3jKrhXttwbaMBFWlo&xkcb=SoAD67M3-umVSGUTU50KbzkdCdPP&fccid=f62886079d9cd780&cmp=Johnson-Solar-Corp.&ti=Streamer%2Fpart+Time&vjs=3
Senior AI Weather Scientist,Spire,"Boulder, CO","$150,000 - $200,000 a year",Not Provided,"View all Spire jobs in Boulder, CO - Boulder jobs - Senior Scientist jobs in Boulder, COSalary Search: Senior AI Weather Scientist salaries in Boulder, CO",https://www.indeed.com/rc/clk?jk=d34f7d686beb3602&bb=ugpkVBrqgEI_zfIu0Lu5FwUlLw5favuey1PZL5XgssimGTE_Zy0kKphrwQwCj2fgBPmOuWLNakCoZ1L4JiDjYNre3wK9paa2ApI9khRrgpJpeC2MoDPZ_DVLuCtKLr1y&xkcb=SoCe67M3-umVSGUTU50JbzkdCdPP&fccid=d095eb8d761d57e9&vjs=3
Senior Associate Textile Designer,REVOLVE,"Los Angeles, CA 90021","$70,000 - $80,000 a year",Full-time,"View all REVOLVE jobs in Los Angeles, CA - Los Angeles jobs - Associate Designer jobs in Los Angeles, CASalary Search: Senior Associate Textile Designer salaries in Los Angeles, CA",https://www.indeed.com/rc/clk?jk=14be841f5d8b6ad6&bb=ugpkVBrqgEI_zfIu0Lu5F1zpDXwxIrIGcLhgGeeldlG9wnj1vU-f4E6ykWBndvkncTetAwI3Xi7cSbqpC_LWYyBxJcQjrF_h4IR2ZBuC3qtlkhOi52LsP6NbQGFmJjQN&xkcb=SoAq67M3-umVSGUTU50IbzkdCdPP&fccid=7ff17b3690e6290e&vjs=3
Program Manager,Oracle,"Seattle, WA",Not Provided,Full-time,"View all Oracle jobs in Seattle, WA - Seattle jobsSalary Search: Program Manager salaries in Seattle, WASee popular questions & answers about Oracle",https://www.indeed.com/rc/clk?jk=a3d9471ec529344d&bb=ugpkVBrqgEI_zfIu0Lu5F_o-rwuwrqwfqho0d_XhDluCenqV5Ed9QtH6w18deRhh6DwMfMOaKudTGKMICB8UQPnDkJHd5tvn9vif2cj-dhCoDOL8eHMY5w%3D%3D&xkcb=SoCk67M3-umVSGUTU50PbzkdCdPP&fccid=cd22d01053af7669&vjs=3
Open Source Strategist,Samsung Research America,"Mountain View, CA 94043","$200,000 - $300,050 a year",Not Provided,"View all Samsung Research America jobs in Mountain View, CA - Mountain View jobsSalary Search: Open Source Strategist salariesSee popular questions & answers about Samsung Research America",https://www.indeed.com/rc/clk?jk=a71ba26a239382d6&bb=ugpkVBrqgEI_zfIu0Lu5F_DvTOGXHZnAbUL_ysIwJRXTcD8KMzLsULoV7vuPj-Tr3UanjVD1HjMz9XhnaCFInKSaPERwLf5vEKRNLxozmpaDDAxQOwXNkN59YYO1uzaR&xkcb=SoAQ67M3-umVSGUTU50ObzkdCdPP&fccid=f98eb70205204fcf&vjs=3
Software Developer,Oracle,"Seattle, WA",Not Provided,Not Provided,"View all Oracle jobs in Seattle, WA - Seattle jobs - Software Engineer jobs in Seattle, WASalary Search: Software Developer salaries in Seattle, WASee popular questions & answers about Oracle",https://www.indeed.com/rc/clk?jk=325ade8b54d5a47f&bb=ugpkVBrqgEI_zfIu0Lu5F-2iC6z7riL6hMelmRKn9Iv0kS-TEMzDeMp__Fd1i2A1_p7R4HNpQo7HuGRv1vg02lg3qW3P7ALq77D5_RzGKWJ_BgX2y1EHCQ%3D%3D&xkcb=SoCN67M3-umVSGUTU50NbzkdCdPP&fccid=cd22d01053af7669&vjs=3
Evaluation & Response Senior Specialist,Apple,"Austin, TX",Not Provided,Not Provided,"View all Apple jobs in Austin, TX - Austin jobs - Crisis Response Specialist jobs in Austin, TXSalary Search: Evaluation & Response Senior Specialist salaries in Austin, TXSee popular questions & answers about Apple",https://www.indeed.com/rc/clk?jk=c72383b59c1ab64a&bb=ugpkVBrqgEI_zfIu0Lu5F4AlEP6iupvuBwV-1tnvnk5ZScrZBeGGz6pWkiFRm6BBCKSq4D4VTnlTiCJUzs2Rl0KK5iAeEjZV_ILSKUG3dZkAkWtJul_oIg%3D%3D&xkcb=SoA567M3-umVSGUTU50MbzkdCdPP&fccid=c1099851e9794854&vjs=3
AI Engineer,Cornerstone Defense,"Bethesda, MD",Not Provided,Not Provided,"View all Cornerstone Defense jobs in Bethesda, MD - Bethesda jobs - Engineer jobs in Bethesda, MDSalary Search: AI Engineer salaries in Bethesda, MDSee popular questions & answers about Cornerstone Defense",https://www.indeed.com/rc/clk?jk=61b528624c24ea78&bb=ugpkVBrqgEI_zfIu0Lu5F0i3NSFb-CwhXtEhRIRlud6PhkspUKSvnNihnl_R_CavAn0x2VOeaeZJ-4t_fgOBVL8p9x8RAtboHu2w3MMvF9FpFwwDkKjuRGRYMEOkByHk&xkcb=SoDQ67M3-umVSGUTU50DbzkdCdPP&fccid=c4dad3c95358e466&vjs=3
Chatbot Developer,ADP,"Roseland, NJ 07068",Not Provided,Full-time,"View all ADP jobs in Roseland, NJ - Roseland jobs - Developer jobs in Roseland, NJSalary Search: Chatbot Developer salaries in Roseland, NJSee popular questions & answers about ADP",https://www.indeed.com/rc/clk?jk=d67bcf4a4edb0da6&bb=ugpkVBrqgEI_zfIu0Lu5F7v8Ts5xpNuWWSI5pODS3-oqUab3G1MAa1ZyoscwZ_9S7I8bTnm9dputMXHAhGdB4c3PTcSsMZU9fEvpfXIBRd1pbHySL4RgxA%3D%3D&xkcb=SoBk67M3-umVSGUTU50CbzkdCdPP&fccid=e996c2d6855fe778&vjs=3
Competitive Intelligence Lead,"Grammarly, Inc.",Hybrid work in United States,Not Provided,Not Provided,"View all Grammarly, Inc. jobs in United States - United States jobsSalary Search: Competitive Intelligence Lead salariesSee popular questions & answers about Grammarly, Inc.",https://www.indeed.com/rc/clk?jk=416f3bf573d88116&bb=ugpkVBrqgEI_zfIu0Lu5F7xCxC3g0aS1VdADN1l0sIJvVSZXlMArUl99FGU3Je6aDqQfTZ6f5HkycR0sbC2AMGaZ_VD3UCc_fYTjH9x1ml0G3O-LPt3MVf53HBNdG-zt&xkcb=SoD567M3-umVSGUTU50BbzkdCdPP&fccid=0555014e7bce64c3&vjs=3
"Senior Writer and Editor, AI at Work",Microsoft,United States,"$103,800 - $219,200 a year",Full-time,"View all Microsoft jobs in United States - United States jobs - Senior Writer/Editor jobs in United StatesSalary Search: Senior Writer and Editor, AI at Work salaries in United StatesSee popular questions & answers about Microsoft",https://www.indeed.com/rc/clk?jk=a753f4b4e94242de&bb=ugpkVBrqgEI_zfIu0Lu5F5E7RpheSKbWVebgTNGuThH0wzD-XcP00-zsjiGdxJOwUv4AqaiLMAfG7vdxq7ed7VqfXvrf-q47UWYNXPrnEk_NWjw5p9-o7A%3D%3D&xkcb=SoBN67M3-umVSGUTU50AbzkdCdPP&fccid=734cb5a01ee60f80&vjs=3
AI Data Annotator,Vistatec,United States,Not Provided,Not Provided,View all Vistatec jobs in United States - United States jobsSalary Search: AI Data Annotator salariesSee popular questions & answers about Vistatec,https://www.indeed.com/rc/clk?jk=644269f566114edb&bb=ugpkVBrqgEI_zfIu0Lu5FybO24GHCLp4FtOk5w9XnrLO5xYm8CA45tzZALCfEnczWnDETH_bTau10bABuUyBru7j8AGg67plTbtz4qyNrFiiuw_4Vdv7-Q%3D%3D&xkcb=SoDD67M3-umVSGUTU50HbzkdCdPP&fccid=33fede40a40fcf6f&vjs=3
Intelligence Watchlist Analyst,Deloitte,United States,Not Provided,Extended hours,View all Deloitte jobs in United States - United States jobs - Intelligence Analyst jobs in United StatesSalary Search: Intelligence Watchlist Analyst salaries in United StatesSee popular questions & answers about Deloitte,https://www.indeed.com/rc/clk?jk=0189c2b31a0791e6&bb=ugpkVBrqgEI_zfIu0Lu5F65XNtkcIkNVbUELBnhu8AukyIDTXhWG2tmreUfPIDF4dT9bGxTSYfBnt-wmf77ySgDfW8SRa30vAOZAVDA_rGcVOUkxv7wErg%3D%3D&xkcb=SoB367M3-umVSGUTU50GbzkdCdPP&fccid=9e215d88a6b33622&vjs=3
Sustainability Go-to-Market Activation Lead,Microsoft,United States,"$129,200 - $268,900 a year",Full-time,View all Microsoft jobs in United States - United States jobsSalary Search: Sustainability Go-to-Market Activation Lead salariesSee popular questions & answers about Microsoft,https://www.indeed.com/rc/clk?jk=da0e0b51bf349b2b&bb=ugpkVBrqgEI_zfIu0Lu5F7IOr6-r7ZLMXgEodp8wASGfGTc5GNBBIZLJ5Tz7dW4WdRIapjxoK60Ga4qEujXJsDJCrYZZgnILnv_KQ0d4OA7r9kDCOHmdHw%3D%3D&xkcb=SoDq67M3-umVSGUTU50FbzkdCdPP&fccid=734cb5a01ee60f80&vjs=3
