Job Title,Company,Location,Salary($),Job-Type,Job-Description,Raw_Link
Professional Services Consulting Principal,Genesys,Remote,"$144,650 - $283,850 a year",Full-time,"As a key member of our Professional Services team, you will be leading presales efforts providing broad and deep expertise in technology to allow our customers…",https://www.indeed.com/rc/clk?jk=791edd5f342836d7&bb=UVBGuWuV85NWtmHUsRbL0P5NW7hp622ubRlHaDdKmx4ACxGCbp8z3JwJTJfEZepL0ud2I2iH3FjsbBXi9Mt95L7QPSc-ZFXxzGsgO2b0p-k7D-7Y25mQlouWNp42UkPa&xkcb=SoBQ67M3-ug4aH2adB0LbzkdCdPP&fccid=78ba8c9950e5297a&vjs=3
International Health Industry Market Intelligence Expert,The United Nations Industrial Development...,Remote,Not Provided,Not Provided,"Write and edit a comprehensive guidebook on market intelligence, innovative financing, and investment promotion in the health industry, integrating findings…",https://www.indeed.com/rc/clk?jk=2749c74b28554b31&bb=UVBGuWuV85NWtmHUsRbL0Azm2PtTH5dXbLuqvyjf9evH6JnAT0h2eKgxGOdW6IYWTaZAobd2vM8EhFl3fE6TPe_ptj3NHdl-pvqWeHsdOby1zOLy4LjT-SjfqwdNWbCm&xkcb=SoDk67M3-ug4aH2adB0KbzkdCdPP&fccid=8851b95cb936af3c&vjs=3
"Senior Technical Writer, Cash Commerce",Cash App,"San Francisco, CA","$126,400 - $223,100 a year",Full-time,"Initially built to take the pain out of peer-to-peer payments, Cash App has gone from a simple product with a single purpose to a dynamic ecosystem, developing…",https://www.indeed.com/rc/clk?jk=ac0adc315bb7aa4d&bb=UVBGuWuV85NWtmHUsRbL0Dib2lsUzjNO-JMed2RYfS4hm5fvsNROzB9KIUNt5kOhfW050it7tC6qHu4dwIT6d5tNqNX2cz7Ve3RQiPlsEnzfCJHqLj-Jcb2AqRpGB5yE&xkcb=SoB567M3-ug4aH2adB0JbzkdCdPP&fccid=6f1129ccfbf5c9e9&vjs=3
Brand and Communications Manager,Koch Fertilizer,"Enid, OK 73701",Not Provided,Not Provided,This role will provide develop and execute internal and external communications and public relations initiatives to shape Koch Fertilizers reputation as a…,https://www.indeed.com/rc/clk?jk=743af98520c09015&bb=UVBGuWuV85NWtmHUsRbL0JzrwPwPFLOmMReYPifCT0qXHScJEWPvO5LWnpIksF-FHq9OUw7K-TcxH-4iJX2D1SesypMY0xLkf4-KL7B9al0pdCg9A5Pjmw%3D%3D&xkcb=SoDN67M3-ug4aH2adB0IbzkdCdPP&fccid=735667c8ff2f1a48&vjs=3
Customer Success,Instrinsic,"San Francisco, CA",Not Provided,Full-time,"Youll be the key point of contact for executive-level stakeholders, aligning our solutions with their strategic goals to unlock value.",https://www.indeed.com/rc/clk?jk=7b29eb033baf3d83&bb=UVBGuWuV85NWtmHUsRbL0LBchZuebCttcp-7PUYjq8HOYtmzAXZBMgJveer5ulFmQpbTrpRmibWpEmIfMdiZD0AuCmV8IDE4hd5LxY5G6V8_JGfJc1yZibLnlMhDElTu&xkcb=SoBD67M3-ug4aH2adB0PbzkdCdPP&fccid=dd616958bd9ddc12&vjs=3
"Senior Software Engineer, AI/Machine Learning, Google Photos",Google,"Mountain View, CA",Not Provided,Full-time,"5 years of experience with machine learning algorithms and tools (e.g. TensorFlow), artificial intelligence, deep learning, or natural language processing.",https://www.indeed.com/rc/clk?jk=32bba7398446e535&bb=UVBGuWuV85NWtmHUsRbL0MjZVVfQxMA3gO697rRdVXtKL9XymbqUKsn2knDMUyK7sN4pHgBYraKz_YcA3gWm99B08q0GP4b94iQ-dMCtC5QzM-8R_2ACvw%3D%3D&xkcb=SoD367M3-ug4aH2adB0ObzkdCdPP&fccid=a5b4499d9e91a5c6&vjs=3
"Distinguished Engineer, Generative AI Systems (Remote Eligible)",Capital One,"Remote in McLean, VA 22101",Not Provided,Full-time,"For years, Capital One has been leading the industry in using machine learning to create real-time, intelligent, automated customer experiences.",https://www.indeed.com/pagead/clk?mo=r&ad=-6NYlbfkN0C3j_zLGvpMLCdiZ0WC46XqVTA1VMZzOzKXPhAXwYlrNUFMD4PZ3AunMB5DXFa7boTngTCkmp9Jd9d8CazpYoXjOdag1ee4fBz6KtTgZZ4bpeVSznyP2Hh6876Trh6G15vHJAsLsYSXyEN3-UiQb9SK54ijhM1ulqTNjHDzn3Q1ac2DtAbMHIvodAlR_0ZhOKAhLZAZakXY_cb2l8GudmcX1SiNIHPhDX4RBJjKnd6DTOhVENoS-36PAVf2scPOZ_HvdpPb6Ql0rBDwKazqsQrbWeSC7OaZpGOcQWPbbAcrUavndHjkLypaajWZ9Zaiwr0vvY2d1Vu6eZs8E7u0UPZH3X2sJ-ixowCmmKD41YoWIDDrsK7R3jkKZjCenhTbSYErw4C6y0sx-tceoatoD5m5WUfonHaZmnGj3q1CuZuDxlAZ1iLMI0bJO2Tr_W_tEdeeqobFnGn2SuJ_-im0sMjInPm5m7882iDTGxGG3UXH9vCPgk_chi-WGZ4V2R2Af7yavDkfrUwZmt_VjtVEWp5kvOa0MoMxQsMy8u3cuZ9xH_NmD947mnBOnUTO6c88e7UJ6DGhs31620wO_zrr5O0GOQBBrIlOV5fa6Z-FYr_ak8V4pJl_r99X-qt32yaUwtNtbXmPbkauTsiTQsVCMJYGHcETtZGfjhUGZMtbPmo7ZOp0wWIL7OcXBD4BIb1qf4uflD89BS9zLaDmIQCiMDJmSliOGQnLFE-wZQtHPkEL3OoWfGuMhZl_bw2QBJXAAmyvKSpwriw5W5msJV2pG-q6OSSq6gObVFYCSU2hpKGifs06AQU4mN0mGKUtKYeQyDxTP3sPZXpZK3K09jYxSF9B&xkcb=SoCe6_M3-ug4aH2adB0NbzkdCdPP&camk=4HOcmqOLYrCZZasoYOZ0iQ==&p=6&fvj=0&vjs=3
AI Engineer,Cornerstone Defense,"Bethesda, MD",Not Provided,Not Provided,"View all Cornerstone Defense jobs in Bethesda, MD - Bethesda jobs - Engineer jobs in Bethesda, MDSalary Search: AI Engineer salaries in Bethesda, MDSee popular questions & answers about Cornerstone Defense",https://www.indeed.com/rc/clk?jk=61b528624c24ea78&bb=UVBGuWuV85NWtmHUsRbL0FkXTAyy4i8nMgvrwopStUe9-kxI8I18IK3theFUTjWzaxuyQ9tOZGQ-zSCjLkCrBumaAzx6LYfKw6Z_YxbdMi6c8B--eIe5PhvjU3lXQNRu&xkcb=SoDe67M3-ug4aH2adB0MbzkdCdPP&fccid=c4dad3c95358e466&vjs=3
"Lead/Principal IT Architect, Public Sector Industry Leader (Defense & Security, Civil Sector) - Platinion",Boston Consulting Group,"Washington, DC",Not Provided,Full-time,"Organizations need to anticipate tomorrow’s digital landscape to maintain competitive advantage.
As a Lead or Principal Architect, you will collaborate on…",https://www.indeed.com/pagead/clk?mo=r&ad=-6NYlbfkN0Ad1FFWZOsBBwBZDGouyCcICeLSd3pQct3wJ1q5dPO7JA73NfCuXMquj2Tg4sX590vnpoFHZaF4sgeKxRS5hHR5SuQnNcN1vB-nPx2VsbWnsvSlDw7CHZXQn2OW_7HWZwOnXfuBHaId2LM1G9vJryYTNArXsmOt0KihNvhwmGO8KenEc-4CWJy9yKjU0ppYT1qCaHuO0UL4k1CG3nuiNwp07oIgj_qVJ7mQ9IwsFlpBR7eCkxb1Z_bvUC-1V6OF7TokqEkZf55m7wj2RaweQVo9ROdqtZG83h2JDAoewzmidA9eVAETc7pgx9ldgMnwWykHzf23iZLP92udDS9C-nGgfviZynFPkKFqhhOioTdfFBJP1WXY4mcmngZLftyDQqwDgUtu6ASCQLOnoOVErj0xC6Y9QDuUOw5X7euTXACbv7DRKw93bmyQhcoqbtb4afLEeQo8aT1_zJabKBA6dbBn3CBlqaj6fNoeNEnUNXPqJlapq2MeZJdDt0G5U37NGvFFQWe4obuHoJwjc8cnk8yklCmkxkj2_RoAT_LoiyEwH-X1EdBESeuNxEoJxRMgyAB00Y_QagvVTta6CY9SjN1D3_YX82DD5E8Vqf6J73IRTMojsqCwzo3E_-ZflBG6VBAU7E2_3X3XN3AtaGss5v8XEJzFK41VN-E_rQu1K3Qrf6CGcWE3Veyx_qGwlOsa9KSL4gRTXs3ToVhPH-lm0uW0eg85DtkisrEsbxrc_r6nPtSTvU8ZTAYnHoj7r1qPEwcJRtP-mVvwyyJdncnIfGOYcTCZwdocCkexj0xmPrxgSkNz7gn_bk5SerbHKSqMb-AF41lE7dAXeb_GRKtlp5YfIpixkpvdwJ_CBspcaNHHEYyjjHce4rle4qSg7oOet5WFjIif5qt3gXPioDBqWznXwIbLrUp9Lk0ZJi1fIeceXA3OLm5v94Bu25kyMvzjlQsrplCmVKGPknsIMM30ZQwfrrapPURAs74cOIrAix9nCuasYZfwLcutcypGhae1XHb5hw0XGSKVtsITRCimpYxteF6lQJ6G0QjGVRylLFjdPEgwKjDmEsMhA4FpRF6JXQMa_ilcU5jJcIvuakJPJb7eZPSGVjSQYygcwDs8852uYxx872NawELKW-U0RrQhFb1EbM2TQauJ7LT8qWiWCtVlMlQzuke2N_Nalu0SSTwuqq1oIe16VBYb7ttnvlYv-f2OYhi0lZMDuMOowarDRiijBRFh3B9ErpYRGio1OkgdBzByycDZJNJf1TViMH_UZ3fpmqXFz-s4IiixcdormW5uarapm0b6yU8b7ahd3CKXJjGnZReVUcsD4lFmLIjeBCZWo6RKAMi7a7bE96HD1vi8JZQKNsEN676XQiNsL-6VQKu3bAgV2guvL3uQBcCiFD1xDpRGP8dAMxq2Otfu3OpFPr-81wkWESXSI_OiFYsMYgv7Vpje5ga5&xkcb=SoDD6_M3-ug4aH2adB0DbzkdCdPP&camk=nUmJqO2E8rgYY6ZEg7fMWw==&p=8&fvj=0&vjs=3
Chatbot Developer,ADP,"Roseland, NJ 07068",Not Provided,Full-time,You will help us reinvent how associates connect with HR using technology and how we provide support by merging automation with user experience.,https://www.indeed.com/rc/clk?jk=d67bcf4a4edb0da6&bb=UVBGuWuV85NWtmHUsRbL0JdOfTNP_fvZIG3u6A1OJFOqVpWz4jtPyS8Qbxrfod1aeH64W2HcxKtal_DXMPrs0JRejDBjc9bjxQ1V6W8zu5QDt-GKnBtGDg%3D%3D&xkcb=SoCD67M3-ug4aH2adB0CbzkdCdPP&fccid=e996c2d6855fe778&vjs=3
AI Data Annotator,Vistatec,United States,Not Provided,Not Provided,"Data Annotators carry out their work in an engineering development environment.
Annotate English data accurately and consistently, and in accordance with…",https://www.indeed.com/rc/clk?jk=644269f566114edb&bb=UVBGuWuV85NWtmHUsRbL0PwCtXvhW3dEdMIpKLkC99K_cJs24OcRFZIQbuiAz6OAnh3ktfB-PqXfThdRSR95IcSkAgAvfD8aHLgj3KJN_8Vv9akazt0WJQ%3D%3D&xkcb=SoAe67M3-ug4aH2adB0BbzkdCdPP&fccid=33fede40a40fcf6f&vjs=3
Intelligence Watchlist Analyst,Deloitte,United States,Not Provided,Extended hours,"2+ year(s) of open-source / all-source intelligence experience.
Providing intelligence analysis and operational support, you will be responsible for receiving,…",https://www.indeed.com/rc/clk?jk=0189c2b31a0791e6&bb=UVBGuWuV85NWtmHUsRbL0NRvlrB6UDA3Ylk55fB3f932AvjdVOC_pbpz4jLWQKsElnAQEq2ZAnouZM27pkPlFzH6uumUcQT3zpz5zu4lYOJrSwGcdogKTg%3D%3D&xkcb=SoCq67M3-ug4aH2adB0AbzkdCdPP&fccid=9e215d88a6b33622&vjs=3
"Senior Writer and Editor, AI at Work",Microsoft,United States,"$103,800 - $219,200 a year",Full-time,"The writer and editor will also contribute regularly to WorkLab digital publication, newsletter, and podcast; Microsoft’s thought leadership publication on the…",https://www.indeed.com/rc/clk?jk=a753f4b4e94242de&bb=UVBGuWuV85NWtmHUsRbL0NQmfA1LugNXPJePFjSeo_rX7rpZsulqxGyFULlORcSHSmfJioumruWx9Yez8Hdw4_io5uEfZydiHgXAqZnAhnWZqIpsohQb6A%3D%3D&xkcb=SoAk67M3-ug4aH2adB0HbzkdCdPP&fccid=734cb5a01ee60f80&vjs=3
Competitive Intelligence Lead,"Grammarly, Inc.",Hybrid work in United States,Not Provided,Not Provided,"Has experience working at a senior level in competitive intelligence within the tech industry.
Develop and maintain detailed assets to provide our sales team…",https://www.indeed.com/rc/clk?jk=416f3bf573d88116&bb=UVBGuWuV85NWtmHUsRbL0CY9lO7v9v9OjbV7fsw9OAWQYkqaeRpNLD45kK_hGzb77JacNB2uFkNMvzzKAuvKIks2nrdUUt9tnObGuF2rCy6x6B7O2I2Q_hzU6gI_SOSx&xkcb=SoCQ67M3-ug4aH2adB0GbzkdCdPP&fccid=0555014e7bce64c3&vjs=3
All-Source Intelligence Analyst,Zel Technologies,Remote in United States,Not Provided,Full-time,Interface with combatant command and intelligence community counterparts to ensure collaboration and situational awareness of operational and tactical level…,https://www.indeed.com/rc/clk?jk=989406ef66f9f9a8&bb=UVBGuWuV85NWtmHUsRbL0NZbtVb3z22tJwncU6pBaeyEf3pzx51i-pGvPgS_qP3u6xgPkUM-ojPQ3bFpsqXaTE_-UigrqCXi6g25Tn5CvkD2XIy10LcqaQ%3D%3D&xkcb=SoAN67M3-ug4aH2adB0FbzkdCdPP&fccid=28563e08ef3dabcd&vjs=3
