Job Title,Company,Location,Salary($),Job-Type,Job-Description,Raw_Link
Customer Experience Specialist (Sales Associate) - Palm Beach,The RealReal,"Palm Beach, FL 33480",$19.80 - $22.06 an hour,Full-time,"The Customer Experience Specialist serves as a key driver within the retail store to provide exceptional customer service, support supply (consigned product)…",https://www.indeed.com/rc/clk?jk=07a326c36ad0902c&bb=nXCZdPaQ1V9XytwKb5-bC_cxGLG24cDEuioxZQpDKZVBtq_Dst60qyxd7EqieQUh10wjpHWIrCeCwsXciERSsD_wmFtlK-2p_GMPtKe9CCyBH9iVvJ-ovlJN23Kee0HF&xkcb=SoDL67M3-uj6bxapFB0LbzkdCdPP&fccid=1b0692814cc13474&vjs=3
Digital Marketing Specialist - Pay Per Click,Relias LLC,"Hybrid work in Morrisville, NC 27560",Not Provided,Not Provided,"We help organizations across the continuum of care get better at maintaining compliance, developing staff and promoting consistent, high-quality care.",https://www.indeed.com/rc/clk?jk=12ae5aa6f75272bf&bb=nXCZdPaQ1V9XytwKb5-bC0M91CjcCU2iSJJmEYIax8pOMp6E_2rPNnr1vg66ZQT0trdia7xCgBiKS1fppmgXncs0NxQKIAzDEsWaKoVJixfvoaRI61QHr8YZQmto7o-9&xkcb=SoB_67M3-uj6bxapFB0KbzkdCdPP&fccid=2bd600504ff45e48&vjs=3
Machine Learning Engineer (Only W2),OTSI,"San Jose, IL 62682",$75 - $80 an hour,Contract,"As an AI/ML Systems Engineer, you will contribute to the development of new architectures and products using Client’s next generation Memory/Storage solutions…",https://www.indeed.com/rc/clk?jk=18e4798745d85730&bb=nXCZdPaQ1V9XytwKb5-bC5hx8sH4j1miuouarjFc_U1DCmL69tn_J6PhaAr0rFiPOzEEjz8DPkqJ7aKcLP_hTmlDMnyi61zOcYW2kgb0ilOPWPC0gx1LnOS6QztGtVw2&xkcb=SoDi67M3-uj6bxapFB0JbzkdCdPP&fccid=dba1ce7f7793fed0&cmp=OTSI&ti=Machine+Learning+Engineer&vjs=3
"Senior Technical Writer, Cash Commerce",Cash App,"San Francisco, CA","$126,400 - $223,100 a year",Full-time,"Initially built to take the pain out of peer-to-peer payments, Cash App has gone from a simple product with a single purpose to a dynamic ecosystem, developing…",https://www.indeed.com/rc/clk?jk=ac0adc315bb7aa4d&bb=nXCZdPaQ1V9XytwKb5-bC366B8F8E9ZMNYWULBQEc4epXRrR11GskvGdJvnhwWJd7Kqboh7tvdX4DYf5gJ5v5vGAsmqSShYsfPq_rmSmOtLJ_Ewg_HPqjk68nJdH32Bz&xkcb=SoBW67M3-uj6bxapFB0IbzkdCdPP&fccid=6f1129ccfbf5c9e9&vjs=3
Product Marketing Manager,Sahara,Remote in California,Not Provided,Full-time,"Sahara AI is a decentralized blockchain platform that prioritizes sovereignty and provenance of AI, ensuring security, equity, and accessibility for all users.",https://www.indeed.com/rc/clk?jk=9519e92907796942&bb=nXCZdPaQ1V9XytwKb5-bC3r2bwJyE_8Wh7XX2oCFJ9fWQCakjf4nYjjjM33eoy13nf1-ErZrHUwKjRnC9NyTI7BTzGrJgk5OeShuIbpskQx7Re8oBezaxzCl_QvJck8z&xkcb=SoDY67M3-uj6bxapFB0PbzkdCdPP&fccid=e5864e437395bf59&vjs=3
Data Scientist,U.S. Department of Justice,"Washington, DC 20002 (NoMa area)",Not Provided,Not Provided,"This position serves as a Data Scientist, located in the Department of Justice (DOJ), Office of the Chief Information Officer (OCIO), Justice Management…",https://www.indeed.com/rc/clk?jk=6375878601257fbe&bb=nXCZdPaQ1V9XytwKb5-bC7ofFhLlH_coysqsAkztbB_0AqpI2t5cK60XBG9sMWfwGlmQP-HxCS-ksUGUWlLUcC4mDVn12Zw3BZEOTwl7rBkeoVI8y3IUh7zEiDJZhNwn&xkcb=SoBs67M3-uj6bxapFB0ObzkdCdPP&fccid=a82ba43bbfe2b26b&vjs=3
Principal Network Proj/Prog Mgmt,AT&T,"Plano, TX","$158,200 - $237,400 a year",Full-time,"Assist the teams in delivering value, identify cross-team dependencies and economic decision making by rolling up team estimation to the program level for…",https://www.indeed.com/rc/clk?jk=6c701ef6eb9298ca&bb=nXCZdPaQ1V9XytwKb5-bC2ZeGRKNpOFpaKOldUfGfIJkBb212f66Q3ct2CYH1GtoWlxKzmNFWu63O6qv_6oWD0viKd14Z3b1WkL43x2krrKYEJUmdlsDyg%3D%3D&xkcb=SoDx67M3-uj6bxapFB0NbzkdCdPP&fccid=25b5166547bbf543&vjs=3
Senior Learning Partner – Enterprise Learning,"Vizient, Inc.","Irving, TX",Not Provided,Not Provided,"Knowledge of how to use learning platforms and artificial intelligence solutions to create efficient, sustainable, practical learning experiences that lead to…",https://www.indeed.com/rc/clk?jk=0d98610896432710&bb=nXCZdPaQ1V9XytwKb5-bC_Fkc1eVrKsPtNKwt2SfcPMfJH-momKBUJ0K20Ja0PuD_WvKz2pIZZ5nJ_LbDlFJZqBXdnFtAocAOzmkTFMkOSAVsqfJObmnAawwLE4-3T6v&xkcb=SoBF67M3-uj6bxapFB0MbzkdCdPP&fccid=ab22e7c357e67bd4&vjs=3
AI Engineer,Cornerstone Defense,"Bethesda, MD",Not Provided,Not Provided,"View all Cornerstone Defense jobs in Bethesda, MD - Bethesda jobs - Engineer jobs in Bethesda, MDSalary Search: AI Engineer salaries in Bethesda, MDSee popular questions & answers about Cornerstone Defense",https://www.indeed.com/rc/clk?jk=61b528624c24ea78&bb=nXCZdPaQ1V9XytwKb5-bC701Pr0c8lbLhGrRdqPLj4Ko0EjjMv5jbEsMpdoqYmqMphUP_FniTifMWJoSXCsmL3YpIMjXQAzez46cMG-Kd7_NdK4p8bUtpTgtZBrEP0Bv&xkcb=SoCs67M3-uj6bxapFB0DbzkdCdPP&fccid=c4dad3c95358e466&vjs=3
Chatbot Developer,ADP,"Roseland, NJ 07068",Not Provided,Full-time,You will help us reinvent how associates connect with HR using technology and how we provide support by merging automation with user experience.,https://www.indeed.com/rc/clk?jk=d67bcf4a4edb0da6&bb=nXCZdPaQ1V9XytwKb5-bC3bW_hMcAE68qZRvxCekfm1e5q_ZO0ntClODRy9IAdmXVA4i0GBxNoo2Y1U54r_9XAWAxM60XXOvnQJkuNVNKBTTuygCBFoU2Q%3D%3D&xkcb=SoAY67M3-uj6bxapFB0CbzkdCdPP&fccid=e996c2d6855fe778&vjs=3
AI Data Annotator,Vistatec,United States,Not Provided,Not Provided,"Data Annotators carry out their work in an engineering development environment.
Annotate English data accurately and consistently, and in accordance with…",https://www.indeed.com/rc/clk?jk=644269f566114edb&bb=nXCZdPaQ1V9XytwKb5-bC6r3Orb2byp10IkzSn0ITQ4Ifc8Ptqgz2gxig9GIhhCD1Ft5fupWx12crWG0x9DJnAWMjONIg9l1t87JJphMG832grttEg6xAg%3D%3D&xkcb=SoCF67M3-uj6bxapFB0BbzkdCdPP&fccid=33fede40a40fcf6f&vjs=3
"Senior Writer and Editor, AI at Work",Microsoft,United States,"$103,800 - $219,200 a year",Full-time,"The writer and editor will also contribute regularly to WorkLab digital publication, newsletter, and podcast; Microsoft’s thought leadership publication on the…",https://www.indeed.com/rc/clk?jk=a753f4b4e94242de&bb=nXCZdPaQ1V9XytwKb5-bC2AHqamGXWhjUOYOu8GmLCpuh-8k8CqGIVWh2D_eCJY-NSlNR0FB7Jul0LMkmFxj_IxkzY_m-NHj3dBY608gZgq-jaQCYa4jTQ%3D%3D&xkcb=SoAx67M3-uj6bxapFB0AbzkdCdPP&fccid=734cb5a01ee60f80&vjs=3
Competitive Intelligence Lead,"Grammarly, Inc.",Hybrid work in United States,Not Provided,Not Provided,"Has experience working at a senior level in competitive intelligence within the tech industry.
Develop and maintain detailed assets to provide our sales team…",https://www.indeed.com/rc/clk?jk=416f3bf573d88116&bb=nXCZdPaQ1V9XytwKb5-bCwzYpLW1IgQLPv9aks9bMff5Nq7rgsd2PSU4lweaCYDv8sTji3xIBl6nzazx3VrVFpJCvDMSmw7GYUyIFzEEud9JYFDDZ05aLNpfLBLFrb-F&xkcb=SoC_67M3-uj6bxapFB0HbzkdCdPP&fccid=0555014e7bce64c3&vjs=3
Intelligence Watchlist Analyst,Deloitte,United States,Not Provided,Extended hours,"2+ year(s) of open-source / all-source intelligence experience.
Providing intelligence analysis and operational support, you will be responsible for receiving,…",https://www.indeed.com/rc/clk?jk=0189c2b31a0791e6&bb=nXCZdPaQ1V9XytwKb5-bC2OdcKwBzIr1PTGCdC2EJpfrO_V6wcpDOQrT_jtSvcDQzHijHIEkGGdscJj56Rri_PxRes7-s1hhv1oiUo_oETWJqfSjmPDngw%3D%3D&xkcb=SoAL67M3-uj6bxapFB0GbzkdCdPP&fccid=9e215d88a6b33622&vjs=3
Finance Insights Consultant,Deloitte,United States,"$88,800 - $148,000 a year",Not Provided,"We work as trusted advisors to CFO’s, COO’s, CIO’s and other key executives to advise, implement, and deliver as-a service solutions, improving finance, shared…",https://www.indeed.com/rc/clk?jk=0b54a7c8a5788ee8&bb=nXCZdPaQ1V9XytwKb5-bCzij0oYoBLyTTPra6dTnbQHY7z4RXnMQ_P2VbswoaNd6fCNv_zK7teJ9fLwfNMPP0XunGmwp_Wt71Lrbn2MKiBrgDrnZSkgpHg%3D%3D&xkcb=SoCW67M3-uj6bxapFB0FbzkdCdPP&fccid=9e215d88a6b33622&vjs=3
