Job Title,Company,Location,Salary($),Job-Type,Job-Description,Raw_Link
Senior AI Engineer - Remote,The Cigna Group,Remote,Not Provided,Not Provided,This is an exciting opportunity to join our company’s AI CoE team which is transforming healthcare and improving the lives and vitality of the millions of…,https://www.indeed.com/rc/clk?jk=87eed957fcd15be9&bb=oGCVKO4PvdR2jjonLgEfT8wFI-dCuC5K_n1HgYeCsBVck1T6eB2ymMswSg9C3qxC7mnP24xthQZL6Z6cBYWZETGZ63qM9lpPirvpHtHIAP5upNlWYteHxQ%3D%3D&xkcb=SoBo67M3-uj2tbx5l50LbzkdCdPP&fccid=afbf8c270610a38a&vjs=3
Tech Writer - Contract,Kognitos,"San Jose, CA",Not Provided,Contract,Kognitos is a cutting-edge automation platform that combines the power of Generative AI and Natural Language Processing (NLP) to provide a conversational and…,https://www.indeed.com/rc/clk?jk=1ce863c0f17acfe5&bb=oGCVKO4PvdR2jjonLgEfT8wFI-dCuC5Kcq_kJMb8zrQYotVuQHyJEiFGO8KBGKBbBLzNplEMjUG6s2ZfSeC3ZxpSjGHYg7N1RhyngUVSObNdYtDiK55GHo6ZH_NyK2Gc&xkcb=SoDc67M3-uj2tbx5l50KbzkdCdPP&fccid=f8c39f07feebe587&vjs=3
"Senior Product Manager, Artificial Intelligence/Machine Learning (AI/ML)",Workiva,Remote,Not Provided,Not Provided,"As the Senior Product Manager for Artificial Intelligence/Machine Learning (AI/ML), you will be responsible for identifying the most impactful problems and…",https://www.indeed.com/rc/clk?jk=016ded9924be6dfa&bb=oGCVKO4PvdR2jjonLgEfT0A_zR0Ud45v9-PLOESswGCjVYYpRLLIhzxEy7TPkhySFyf8UuN8Dp3m7SFBHmnDz0Wjq3oTiCUVlj-7v3Q1iKwT9SHYEUGtqZZFFjCYrTf6&xkcb=SoBB67M3-uj2tbx5l50JbzkdCdPP&fccid=c74820549fd8456b&vjs=3
Machine Learning Engineer,Ford Motor Company,"Hybrid work in Dearborn, MI 48124",Not Provided,Not Provided,"At Ford Motor Company, we believe freedom of movement drives human progress.
We also believe in providing you with the freedom to define and realize your dreams…",https://www.indeed.com/rc/clk?jk=47ec961128e13836&bb=oGCVKO4PvdR2jjonLgEfTxMWVbLsZH_TonF-8_c0fvIGvy63hgV6R55TsWDoOAmp8FzI4XYewetdu5AEP28-6Pj2Zy_mSvf9DoCHRG6mDtmUe0QCLleZ_Q%3D%3D&xkcb=SoD167M3-uj2tbx5l50IbzkdCdPP&fccid=761c44c17d636bfe&vjs=3
"VP of Partnerships, Cloud & Generative AI",Invisible Technologies,Remote,Not Provided,Not Provided,"Invisible is the operations innovation company transforming how companies are built and run.
We are a tech-enabled service providing solutions to the worlds…",https://www.indeed.com/rc/clk?jk=08283049c167de9d&bb=oGCVKO4PvdR2jjonLgEfT-Iq4exde6WFjY0N6B6MG4DelzCE1uGskYXFMjCSlU4f8s7A8y4j67OuEL0Khi_amnXvE7sU80mHdq0a5-kAlf9Qp18kI8-syOwPB85gtcNX&xkcb=SoB767M3-uj2tbx5l50PbzkdCdPP&fccid=c34504270a486ed1&vjs=3
"Senior Technical Writer, Cash Commerce",Afterpay,"San Francisco, CA","$126,400 - $223,100 a year",Full-time,"It all started with an idea at Block in 2013.
Initially built to take the pain out of peer-to-peer payments, Cash App has gone from a simple product with a…",https://www.indeed.com/rc/clk?jk=095aafc39ee4c15f&bb=oGCVKO4PvdR2jjonLgEfT3h4Uy2HgGBozJlM5tzdJldXtcAtAR2dntkb-mMZ9aOGXhR11GmTliuJaXHyYLyBTpvAVxBBBm1X_Xr8MVwVP89aGBmf50nlUOSCXOSUpsbj&xkcb=SoDP67M3-uj2tbx5l50ObzkdCdPP&fccid=49023dc4dc722a14&vjs=3
Customer Experience Specialist (Sales Associate) - Palm Beach,The RealReal,"Palm Beach, FL 33480",$19.80 - $22.06 an hour,Full-time,"The Customer Experience Specialist serves as a key driver within the retail store to provide exceptional customer service, support supply (consigned product)…",https://www.indeed.com/rc/clk?jk=07a326c36ad0902c&bb=oGCVKO4PvdR2jjonLgEfT_9iNgCvZlhheQTGKiXyOIoMdhbGZzT6RSrSXt5QUuNQpiQmESn4xmR8JFtDDzfnQXRiJn8HgLXtEkBKl2i3WPf1M_IdgUzYJXp6fH-u3HQ0&xkcb=SoBS67M3-uj2tbx5l50NbzkdCdPP&fccid=1b0692814cc13474&vjs=3
Data Scientist,Reed Smith LLP,"Pittsburgh, PA 15222 (Central Business District area)",Not Provided,Not Provided,"Reed Smith is a global relationship law firm with more than 1,700 lawyers in 30 offices throughout the United States, Europe, Asia and the Middle East.",https://www.indeed.com/rc/clk?jk=e60792b34aaff9d5&bb=oGCVKO4PvdR2jjonLgEfT2gXgezDmvcgiAke1skUS08ZPoAuhQMG_TxxdN1aF-j4JH8bz9u5dMglu1Q2O4txgFlf10zPZ5FbLPp_nytgZDizfsf9HkNyp92REZLpMQVo&xkcb=SoDm67M3-uj2tbx5l50MbzkdCdPP&fccid=3311bd64d1adad82&vjs=3
AI Engineer,Cornerstone Defense,"Bethesda, MD",Not Provided,Not Provided,"View all Cornerstone Defense jobs in Bethesda, MD - Bethesda jobs - Engineer jobs in Bethesda, MDSalary Search: AI Engineer salaries in Bethesda, MDSee popular questions & answers about Cornerstone Defense",https://www.indeed.com/rc/clk?jk=61b528624c24ea78&bb=oGCVKO4PvdR2jjonLgEfT2EDNGlMRp1W24Xz9TqyaS9RPyUDQOFJYdzaYGVG4hN8Lb5k0ddPOkw2UWVJnMkntABA-t2vzX0kyAINshuR0UnT5t8sD9oDmk5U6CpE_Oo8&xkcb=SoAP67M3-uj2tbx5l50DbzkdCdPP&fccid=c4dad3c95358e466&vjs=3
Chatbot Developer,ADP,"Roseland, NJ 07068",Not Provided,Full-time,"The HR Technology team is responsible for transforming Human Resources with science, technology and human intelligence.",https://www.indeed.com/rc/clk?jk=d67bcf4a4edb0da6&bb=oGCVKO4PvdR2jjonLgEfT1EWbsRrCxQ7LBpmtmRSGU_2W8EBiKJEjO66NbbyzPPK6ItvE9JB-cRkymzXC-SYDuQoBiqlu6WedYUwA_ROMFuXHKcPA20L4A%3D%3D&xkcb=SoC767M3-uj2tbx5l50CbzkdCdPP&fccid=e996c2d6855fe778&vjs=3
AI Data Annotator,Vistatec,United States,Not Provided,Not Provided,"We are seeking Data Annotators to perform annotation tasks on a multitude of English datasets.
These datasets are primarily text-based, but can also include…",https://www.indeed.com/rc/clk?jk=644269f566114edb&bb=oGCVKO4PvdR2jjonLgEfT6YxoNyKTgR6vtHKkR-J4izjEP9lHDnuun-RmN6hl5-T1UHNrvop5zNNThTtP7ZrY3fP1QtTczowdezEX1Ar4LsPQ2fmLwmOJg%3D%3D&xkcb=SoAm67M3-uj2tbx5l50BbzkdCdPP&fccid=33fede40a40fcf6f&vjs=3
"Senior Writer and Editor, AI at Work",Microsoft,United States,"$103,800 - $219,200 a year",Full-time,"On the AI at Work Marketing team, we aim to deliver world-class content to help business leaders understand how AI is reshaping work—and how Microsoft Copilot…",https://www.indeed.com/rc/clk?jk=a753f4b4e94242de&bb=oGCVKO4PvdR2jjonLgEfTxMWVbLsZH_TTGzOJw-kYZlEDuAQdpIo23rOi-_SIjxooDLE7u0sKKePyrDkwG-mMtxIZzJiI8CnxN-FY4FTPYmKEsZkH4a2Pg%3D%3D&xkcb=SoCS67M3-uj2tbx5l50AbzkdCdPP&fccid=734cb5a01ee60f80&vjs=3
Competitive Intelligence Lead,"Grammarly, Inc.",Hybrid work in United States,Not Provided,Not Provided,"Has experience working at a senior level in competitive intelligence within the tech industry.
Develop and maintain detailed assets to provide our sales team…",https://www.indeed.com/rc/clk?jk=416f3bf573d88116&bb=oGCVKO4PvdR2jjonLgEfT-Iq4exde6WFA_2INnIdclAaD9_lUvk0jHG5bEe-hPGtRZSDxMvujtoPcsgf8IBMmSW1z00bAcg_HM8332m7mzS6ZEsec3rlBdCQK_aZJYw7&xkcb=SoAc67M3-uj2tbx5l50HbzkdCdPP&fccid=0555014e7bce64c3&vjs=3
Intelligence Watchlist Analyst,Deloitte,United States,Not Provided,Extended hours,"Additional experience demonstrating an understanding of intelligence challenges, preferably terrorist threats.
Strong Writing and briefing skills.",https://www.indeed.com/rc/clk?jk=0189c2b31a0791e6&bb=oGCVKO4PvdR2jjonLgEfT-JSlSXSs5I6u5Hgx_99EvBA5k1VuRhUZ6V7UmyLaGQN0Qzt2lJV7bFagRDWZAMm5MlaysEt0xOi_EfX1j3ubnG3L5e9GDnRlA%3D%3D&xkcb=SoCo67M3-uj2tbx5l50GbzkdCdPP&fccid=9e215d88a6b33622&vjs=3
Finance Insights Consultant,Deloitte,United States,"$88,800 - $148,000 a year",Not Provided,"Finance & Performance – Unlocking financial performance and enterprise value.
We work as trusted advisors to CFO’s, COO’s, CIO’s and other key executives to…",https://www.indeed.com/rc/clk?jk=0b54a7c8a5788ee8&bb=oGCVKO4PvdR2jjonLgEfT07dv4bPdZ0wyP6JwlP_4UqjXcckzzgOME0xAcTRnbFpNZ0-NrfYYVGJy6yqTYYD2LxzMUJc-PFCnM8tc7XUlVP-Lf0Lnug0sQ%3D%3D&xkcb=SoA167M3-uj2tbx5l50FbzkdCdPP&fccid=9e215d88a6b33622&vjs=3
