Job Title,Company,Location,Salary($),Job-Type,Job-Description,Raw_Link
"Executive Education Advisor, US EDU & SLG","Amazon Web Services, Inc.","Seattle, WA","$133,200 - $220,200 a year",Full-time,"View all Amazon Web Services, Inc. jobs in Seattle, WA - Seattle jobs - Executive jobs in Seattle, WASalary Search: Executive Education Advisor, US EDU & SLG salaries in Seattle, WASee popular questions & answers about Amazon Web Services, Inc.",https://www.indeed.com/rc/clk?jk=03b25e6deb497796&bb=PgaRCcQmEEviwzsDtKtZuR73J19bmujUqH203QDd0KQTXcnN23jrjSIvN63IvjrsppFTOO7gLr-z_xFfAp7l98chbn9Gb_YlsByZajGTkjFqeKXZwtUxKw%3D%3D&xkcb=SoBj67M3-uveWd3Rih0LbzkdCdPP&fccid=5cc0cdc6dbb121cc&vjs=3
"Associate Director, People Data and AI",Kraft Heinz Company,"Chicago, IL 60601 (Loop area)",Not Provided,Full-time,"View all Kraft Heinz Company jobs in Chicago, IL - Chicago jobs - Director of People jobs in Chicago, ILSalary Search: Associate Director, People Data and AI salaries in Chicago, ILSee popular questions & answers about Kraft Heinz Company",https://www.indeed.com/rc/clk?jk=062dcaced79c16e0&bb=PgaRCcQmEEviwzsDtKtZuRtHd4mUXeilwu5Kp8cjkeCe2eGZCzMVEDVSOhXg8-e5enDp88iKqEXA42IWIG-cG99Quno3Qh7Aprc41HtIp-2woQ5_NW3QTaxREI5mJo1I&xkcb=SoDX67M3-uveWd3Rih0KbzkdCdPP&fccid=ef4be98af276034b&vjs=3
Assessment and Development Scientist,KORNFERRY,Remote,Not Provided,Not Provided,View all KORNFERRY jobs in Remote - Remote jobs - Scientist jobs in RemoteSalary Search: Assessment and Development Scientist salaries in RemoteSee popular questions & answers about KORNFERRY,https://www.indeed.com/rc/clk?jk=4ad338ab20042d63&bb=PgaRCcQmEEviwzsDtKtZuUzXkfyRjxYfHycvLwiwUgMGXZUfzWo-hIHPKtTHgFcSvoKV0uqt3_0IT0D2zXiXwmA51dD-2_P1PqH_sQC3xPTc3XIn5Q2dRpni4CTjtn-G&xkcb=SoBK67M3-uveWd3Rih0JbzkdCdPP&fccid=b11df369e153d042&vjs=3
"Generative AI Partner Strategist, Generative AI Innovation Center","Amazon Web Services, Inc.","Jersey City, NJ",Not Provided,Not Provided,"View all Amazon Web Services, Inc. jobs in Jersey City, NJ - Jersey City jobs - Partner jobs in Jersey City, NJSalary Search: Generative AI Partner Strategist, Generative AI Innovation Center salaries in Jersey City, NJSee popular questions & answers about Amazon Web Services, Inc.",https://www.indeed.com/rc/clk?jk=5cd0d07f6f2b9a67&bb=PgaRCcQmEEviwzsDtKtZuegFEGUs6c5LO_LRlTgqG4dncVe6kcqPuO0VFGuEVp-ny0dTuG5HzJziCsRcI9e7ZxWbmliSmNJ3DVxOLhuElfFIaxYDXxFPsw%3D%3D&xkcb=SoD-67M3-uveWd3Rih0IbzkdCdPP&fccid=5cc0cdc6dbb121cc&vjs=3
Billing Operations Associate,Accenture,"Hybrid work in San Antonio, TX",Not Provided,Full-time,"View all Accenture jobs in San Antonio, TX - San Antonio jobs - Billing Analyst jobs in San Antonio, TXSalary Search: Billing Operations Associate salaries in San Antonio, TXSee popular questions & answers about Accenture",https://www.indeed.com/rc/clk?jk=0f0cd73b3c7478ed&bb=PgaRCcQmEEviwzsDtKtZuT_5wySetakZjYkMlh3ClcC5xBfkzC5b-Q_euDey9d4ghrOmhH_4vLPAJXwa27PFzBvZ2vJKVB-u1cxjVsOGSh9RIEos2ojWvg%3D%3D&xkcb=SoBw67M3-uveWd3Rih0PbzkdCdPP&fccid=a4e4e2eaf26690c9&vjs=3
Free People Associate Print Designer,Free People,"Philadelphia, PA 19112 (Navy Yard area)",Not Provided,Full-time,"View all Free People jobs in Philadelphia, PA - Philadelphia jobs - Associate Designer jobs in Philadelphia, PASalary Search: Free People Associate Print Designer salaries in Philadelphia, PASee popular questions & answers about Free People",https://www.indeed.com/rc/clk?jk=6e74bc65dffcb306&bb=PgaRCcQmEEviwzsDtKtZuZWK6Nv3d3ddi7WN_srpuE1wA30xZ7IOeotXPORavhWt3_YfwCUSua8sXHBLRVHtdq-Rxn5vcUIHqt1GLqkTntLi34yl9VPiDgndwzOWUkbt&xkcb=SoDE67M3-uveWd3Rih0ObzkdCdPP&fccid=e567c23af178e33e&vjs=3
Product Analyst- Guest,Inspire Brands,"Atlanta, GA 30328",Not Provided,Full-time,"View all Inspire Brands jobs in Atlanta, GA - Atlanta jobs - Product Analyst jobs in Atlanta, GASalary Search: Product Analyst- Guest salaries in Atlanta, GASee popular questions & answers about Inspire Brands",https://www.indeed.com/rc/clk?jk=3f256932e625b101&bb=PgaRCcQmEEviwzsDtKtZufwbny86_g_NwmuRApNOSbyrZpeo8GttscI40l2liOTVTlv4BareCFz53cA0Cbw3EIFkhQ3FM7nA-Srnia2inaFi5ZdO6R5FgNiCkCqBbIaJ&xkcb=SoBZ67M3-uveWd3Rih0NbzkdCdPP&fccid=1b082641b237d96b&vjs=3
Marketing and Communications Strategist,Vanderbilt University,"Nashville, TN 37232 (Vanderbilt Area area)",Not Provided,Not Provided,"View all Vanderbilt University jobs in Nashville, TN - Nashville jobs - Marketing Specialist jobs in Nashville, TNSalary Search: Marketing and Communications Strategist salaries in Nashville, TNSee popular questions & answers about Vanderbilt University",https://www.indeed.com/rc/clk?jk=f06a00bff179cb86&bb=PgaRCcQmEEviwzsDtKtZubyVlErRyRSecrFvjSrso8TCqe3smzgOEwMfBAJRRriTrMFvS2IUgLU2iLEXwTroRc6bmkbiaqPzG0Tlmd57HA2HT12RFBUhYQ%3D%3D&xkcb=SoDt67M3-uveWd3Rih0MbzkdCdPP&fccid=0a72ffc32b2af70e&vjs=3
Creative Director,(add)ventures,"East Providence, RI",Not Provided,Full-time,"View all (add)ventures jobs in East Providence, RI - East Providence jobsSalary Search: Creative Director salariesSee popular questions & answers about (add)ventures",https://www.indeed.com/rc/clk?jk=7f853b39eebbd79d&bb=PgaRCcQmEEviwzsDtKtZubOsQ5ww_mH0hiopnvw0WWwb1Dpva_b5YNKuv3GRN5Qh-U3rZqlwpZEONxdHV-Mstotf0I7u1VHckzmgIe3jjl54gkEujlVD4O475UDglhMW&xkcb=SoAE67M3-uveWd3Rih0DbzkdCdPP&fccid=4bbea649283a2089&vjs=3
Computer Vision and Machine Learning Engineer,Apple,"Sunnyvale, CA","$143,100 - $264,200 a year",Not Provided,"View all Apple jobs in Sunnyvale, CA - Sunnyvale jobs - Computer Vision Engineer jobs in Sunnyvale, CASalary Search: Computer Vision and Machine Learning Engineer salaries in Sunnyvale, CASee popular questions & answers about Apple",https://www.indeed.com/rc/clk?jk=81e45822dfc9ce62&bb=PgaRCcQmEEviwzsDtKtZuZ9gRIp9mm8XieWOiiZddvoP3lvNom0l2VYTzE_TjsubA-zk0QAICW0afyFR2qVNb84OFTCxSmCiTe1CM_lHvs7vlgsaryIe-A%3D%3D&xkcb=SoCw67M3-uveWd3Rih0CbzkdCdPP&fccid=c1099851e9794854&vjs=3
TOURISM COORDINATOR (NON-CLASSIFIED/FT/BENEFITS),"Harford County, MD","Bel Air, MD 21014","$70,000 - $90,000 a year",Full-time,"View all Harford County, MD jobs in Bel Air, MD - Bel Air jobs - Benefits Coordinator jobs in Bel Air, MDSalary Search: TOURISM COORDINATOR (NON-CLASSIFIED/FT/BENEFITS) salaries in Bel Air, MDSee popular questions & answers about Harford County, MD",https://www.indeed.com/rc/clk?jk=3aa4772ac716cd7a&bb=PgaRCcQmEEviwzsDtKtZuVzheDesZuiaa4bTBEqwfpTMR5wHnDqFI8_GhL1-xcKSyHF-v6AgiI-njBMYYS6673REB8sRQAgL-Dof8BvdeHULXJEvAWZ8JAmkseyQKpPT&xkcb=SoAt67M3-uveWd3Rih0BbzkdCdPP&fccid=838050d15280ca9b&vjs=3
"Technical Program Manager, Data Defense - Global Security",TikTok,"Hybrid work in New York, NY","$147,200 - $269,800 a year",Not Provided,"View all TikTok jobs in New York, NY - New York jobs - Technical Program Manager jobs in New York, NYSalary Search: Technical Program Manager, Data Defense - Global Security salaries in New York, NYSee popular questions & answers about TikTok",https://www.indeed.com/rc/clk?jk=407b65ad5cc029f2&bb=PgaRCcQmEEviwzsDtKtZuccUFZ5nYpPW4Gmy28xrrpqydHKdAtnXPTzz6JA_Donsv7BaZeUwkgIsb0g3SnAK97BwQbSFKCFxzKrX6m5FQ9Dr-PfTASKiwbDYtp6Yzlvh&xkcb=SoCZ67M3-uveWd3Rih0AbzkdCdPP&fccid=caed318a9335aac0&vjs=3
Analyst,"World Wide Technology Holding, LLC","St. Louis, MO 63146",Not Provided,Not Provided,"View all World Wide Technology Holding, LLC jobs in St. Louis, MO - St. Louis jobsSalary Search: Analyst salaries in St. Louis, MOSee popular questions & answers about World Wide Technology Holding, LLC",https://www.indeed.com/rc/clk?jk=cddac5aad0761ffc&bb=PgaRCcQmEEviwzsDtKtZuegFEGUs6c5Ls9h9E1tzywyXt2yXc3NXLaAg2LXmbWK4KxqMGyR9b6nT2U5Lo-4imDWG4O5Y_P5gUyE9wnZ1jTaELbD6mgjTeCsUNtAZCow4&xkcb=SoAX67M3-uveWd3Rih0HbzkdCdPP&fccid=a3824b5f2c11b45a&vjs=3
"Research Scientist - Wearables, Input & Interaction (Technical Leadership)",Meta,"Burlingame, CA 94010","$213,000 - $293,000 a year",Not Provided,"View all Meta jobs in Burlingame, CA - Burlingame jobs - Research Scientist jobs in Burlingame, CASalary Search: Research Scientist - Wearables, Input & Interaction (Technical Leadership) salaries in Burlingame, CASee popular questions & answers about Meta",https://www.indeed.com/rc/clk?jk=eb332789bfb45fd5&bb=PgaRCcQmEEviwzsDtKtZuflVmaQfkiPNnCyO2B_leVNNiNdoAsuoBNG0J2Gah1Dx7Cki5YN7omDuR0hYGlH3WGnWC5UGXWqGpSL10snRF30AljAdFr44aw%3D%3D&xkcb=SoCj67M3-uveWd3Rih0GbzkdCdPP&fccid=ba07516c418dda52&vjs=3
Patient Advocate,Ritual Dental,"New York, NY 10013 (Tribeca area)",$20 - $25 an hour,Full-time +1,"View all Ritual Dental jobs in New York, NY - New York jobsSalary Search: Patient Advocate salaries in New York, NY",https://www.indeed.com/rc/clk?jk=1cb0b2d4101e6097&bb=PgaRCcQmEEviwzsDtKtZuS7mbHJP5v-GBsj0RPAQs81pmPz-fuoAcm-VWX_PZn1ES-V1OIAGcODZvTmoqIqjy-sZzBxzXVN9nVfD_ejtCAUBxNXRMK9c_D91WtyuRzk5&xkcb=SoA-67M3-uveWd3Rih0FbzkdCdPP&fccid=dd616958bd9ddc12&vjs=3
