Job Title,Company,Location,Salary($),Job-Type,Job-Description,Raw_Link
Creative Director,Rebuy,Remote in Utah,Not Provided,Not Provided,"Rebuy is SaaS application that is redefining data-powered shopping experiences with a new breed of personalization and merchandising solutions, which turn…",https://www.indeed.com/rc/clk?jk=f50082ead4cd7b9c&bb=BO1GlnvTTnC_KKJ9YPD6HeyPOEk80vDyFcf-nZTwBqgrUXGLM9K4npG_4PzxyP25Y_jA1ZUNtWa60kqzSZEaOCWVUssNKK3A2ZK_Wg8RU4-EahdA4Khb1n2b27F2w_Hk&xkcb=SoAt67M3-ui70-XRih0LbzkdCdPP&fccid=feae85bcecdfd7b5&vjs=3
SEO and AI Content Optimization Specialist (12-Month Assignment),Radio Free Asia,"Washington, DC 20036 (Dupont Circle area)",$45 - $60 an hour,Full-time,"Radio Free Asia (RFA) is a private, Washington, DC-based, nonprofit corporation that provides accurate and timely news and information to Asian countries whose…",https://www.indeed.com/rc/clk?jk=1a331f2c3916e75a&bb=BO1GlnvTTnC_KKJ9YPD6HY-P1xdBww5rjPvLFrw5fhUrWCou1AdTpv4AHdYFpTtxYypIwHU0GtP7q7NjfzLKUn6SGkh7R_mLgqBZEzbL-ZI3jcOWWxy-wZUWY6S9QC0S&xkcb=SoCZ67M3-ui70-XRih0KbzkdCdPP&fccid=ebe4691f30a0c9b3&vjs=3
"Business Operations Manager, AWS Advertising & Social","Amazon Web Services, Inc.","Seattle, WA","$66,800 - $142,800 a year",Full-time,"5+ years of program or project management experience.
5+ years of defining and implementing process improvement initiatives using data and metrics experience.",https://www.indeed.com/rc/clk?jk=50ec24a820de4faa&bb=BO1GlnvTTnC_KKJ9YPD6HSPEBaXsRVZmBqRjGmVfIbkG78oWkPH4l_1x7PfuniPK81YG_YroYdwompSlYVPftMtRSeOvW639idu45Og9w_NZuO-BAbYp3Q%3D%3D&xkcb=SoAE67M3-ui70-XRih0JbzkdCdPP&fccid=5cc0cdc6dbb121cc&vjs=3
AI Engineer,BELVA,Remote,Not Provided,Full-time,"We are seeking a talented and experienced AI Engineer to join our team.
Were a dynamic and innovative AI start-up passionate about bringing cutting-edge…",https://www.indeed.com/rc/clk?jk=3dcdf6ae394fd5e8&bb=BO1GlnvTTnC_KKJ9YPD6HUPl7akgrXEtDthAsfQ6cSvjwNid-X9pRpD3vLoTJL92WYgJsrmMD7EZhMEELQYKM6avUZsS835Qu8Bb0cpEG8NUZqMntlvQzp-EJDsWuJlh&xkcb=SoCw67M3-ui70-XRih0IbzkdCdPP&fccid=70dbb8682c90aea7&cmp=BELVA&ti=Engineer&vjs=3
"Product Marketing Manager, AR Platform",Snapchat,"Hybrid work in Los Angeles, CA 90291","$143,000 - $252,000 a year",Full-time,"Snap Inc is a technology company.
We believe the camera presents the greatest opportunity to improve the way people live and communicate.
Zone A (CA, WA, NYC):",https://www.indeed.com/rc/clk?jk=121715a1ee19e590&bb=BO1GlnvTTnC_KKJ9YPD6He0bQ-A8sGApazxw2VtvyzsDvh2VodxymRNZYqnbcC9pz6LEosrB32n0AWuv_DzuR1WV2Lwto26vgrOygmzOWwfAfZT8ngjDSY4e0B3rhEQy&xkcb=SoA-67M3-ui70-XRih0PbzkdCdPP&fccid=f368300325e8e8bc&vjs=3
Creative Director,Vault Communications,"Hybrid work in Plymouth Meeting, PA 19462",Not Provided,Not Provided,"We are seeking an experienced, visionary - and most importantly, hands-on - Creative Director.
From pitch to launch, you know how to bring campaigns to life,…",https://www.indeed.com/rc/clk?jk=1feec3b9a1858c22&bb=BO1GlnvTTnC_KKJ9YPD6HWoAOcHlYcxFbCboiKvpFaNUZVD9oTmfi9XQq61g0UhY_1zvioiqwY3xXua1gUOCq0pAix_5fk5mVc93zWt16fFwp-K6SmNy4na21w-AFpA8&xkcb=SoCK67M3-ui70-XRih0ObzkdCdPP&fccid=98b114f54401d611&vjs=3
"Software Engineer, Integration, AI Platforms",Tesla,"Palo Alto, CA","$104,000 - $360,000 a year",Full-time,"Tesla participates in the E-Verify Program.
Tesla is a leader in innovative technology, pioneering advancements in autonomous vehicles and humanoid robotics.",https://www.indeed.com/rc/clk?jk=54902f1ef38014a6&bb=BO1GlnvTTnC_KKJ9YPD6HaFRnBn0pjYoxDHAQka4e_7pe05Ef5etHKXnxCU0sG53SzP4idzvlFq3HlaNzMf7x_CLhx7v069FrgbNKOPgxeBRYf84ARpzd6PCKQTG0sJl&xkcb=SoAX67M3-ui70-XRih0NbzkdCdPP&fccid=86e9be6ce380173e&vjs=3
Senior AI Engineer - Remote,The Cigna Group,Remote,Not Provided,Not Provided,This is an exciting opportunity to join our company’s AI CoE team which is transforming healthcare and improving the lives and vitality of the millions of…,https://www.indeed.com/rc/clk?jk=87eed957fcd15be9&bb=BO1GlnvTTnC_KKJ9YPD6HY-P1xdBww5rWKkrjeZh2jT4DkgJ0WO14qeHmuFX_hJd2pBf9fCRHRAJILn2hDViS5gyRfA8HaTO9HEgczVQYRrT5E1V5iHtMw%3D%3D&xkcb=SoCj67M3-ui70-XRih0MbzkdCdPP&fccid=afbf8c270610a38a&vjs=3
AI Engineer,Cornerstone Defense,"Bethesda, MD",Not Provided,Not Provided,"View all Cornerstone Defense jobs in Bethesda, MD - Bethesda jobs - Engineer jobs in Bethesda, MDSalary Search: AI Engineer salaries in Bethesda, MDSee popular questions & answers about Cornerstone Defense",https://www.indeed.com/rc/clk?jk=61b528624c24ea78&bb=BO1GlnvTTnC_KKJ9YPD6HWavVmvEddHaAKMvmAvcTcUSy4ZpthtiEc6Po4N7HSEUscDvqFKI55Pf5sM_r4Ywbm9VmdjlIgaOXomcklPmYoP1mGlGoEICtPrRGrZgnH-H&xkcb=SoBK67M3-ui70-XRih0DbzkdCdPP&fccid=c4dad3c95358e466&vjs=3
Chatbot Developer,ADP,"Roseland, NJ 07068",Not Provided,Full-time,"The HR Technology team is responsible for transforming Human Resources with science, technology and human intelligence.",https://www.indeed.com/rc/clk?jk=d67bcf4a4edb0da6&bb=BO1GlnvTTnC_KKJ9YPD6HXLXArihv56vVw8jyFD8LjFnhj4HpgaVvmlRDM-LPIdO0bNVxG7QHlMdJgvuT_fBM28MzSniAVGvLfnRA_vOfAcdaDt5Aqnbbw%3D%3D&xkcb=SoD-67M3-ui70-XRih0CbzkdCdPP&fccid=e996c2d6855fe778&vjs=3
AI Data Annotator,Vistatec,United States,Not Provided,Not Provided,"We are seeking Data Annotators to perform annotation tasks on a multitude of English datasets.
These datasets are primarily text-based, but can also include…",https://www.indeed.com/rc/clk?jk=644269f566114edb&bb=BO1GlnvTTnC_KKJ9YPD6HZq7lzGCisxqe_Q6r19VQfpZczBSJpIui4ZVTv9hKJzzcmYs-kkGKXIHoFPOoEZ801Rk3j-WxLnRPKe0QL7qDnqY_gkP1ckV9A%3D%3D&xkcb=SoBj67M3-ui70-XRih0BbzkdCdPP&fccid=33fede40a40fcf6f&vjs=3
"Senior Writer and Editor, AI at Work",Microsoft,United States,"$103,800 - $219,200 a year",Full-time,"On the AI at Work Marketing team, we aim to deliver world-class content to help business leaders understand how AI is reshaping work—and how Microsoft Copilot…",https://www.indeed.com/rc/clk?jk=a753f4b4e94242de&bb=BO1GlnvTTnC_KKJ9YPD6HeJf9qNlCN1BYhqzDBQF4ejNi5PqOtDGh_oaZBPxhOaUtA1qyMUtImayG0DcmIosVqczqOloLv0QSJPVQIR3O0GdYwXiqGdmAA%3D%3D&xkcb=SoDX67M3-ui70-XRih0AbzkdCdPP&fccid=734cb5a01ee60f80&vjs=3
Competitive Intelligence Lead,"Grammarly, Inc.",Hybrid work in United States,Not Provided,Not Provided,"Has experience working at a senior level in competitive intelligence within the tech industry.
Develop and maintain detailed assets to provide our sales team…",https://www.indeed.com/rc/clk?jk=416f3bf573d88116&bb=BO1GlnvTTnC_KKJ9YPD6HbiSs8L-booUj2OtxcEQd8Ws280eP0aCShkD0VCWRP8wzeq8TeSG7Ti7LOh3qwzW551VzfV55xT-rLg6HaB-sYARPfIzwSP-000OogpfELPT&xkcb=SoBZ67M3-ui70-XRih0HbzkdCdPP&fccid=0555014e7bce64c3&vjs=3
Intelligence Watchlist Analyst,Deloitte,United States,Not Provided,Extended hours,"Additional experience demonstrating an understanding of intelligence challenges, preferably terrorist threats.
Strong Writing and briefing skills.",https://www.indeed.com/rc/clk?jk=0189c2b31a0791e6&bb=BO1GlnvTTnC_KKJ9YPD6HeHJZ6O9U0WMhGiNvIRjMuLZv7AIeWQXctlNajgBDLoBj8YLTR4MqeNVp-PUO38myGZLKZC2J-zo7p6E764lSb_xGhPhhQycBw%3D%3D&xkcb=SoDt67M3-ui70-XRih0GbzkdCdPP&fccid=9e215d88a6b33622&vjs=3
Partner Technology Strategy AI Services,Microsoft,United States,"$103,800 - $219,200 a year",Full-time,"By joining our team, you will be at the heart accelerating AI transformation with one of our top strategic device partners.
Embody our Culture and Values.",https://www.indeed.com/rc/clk?jk=2f0cd40c3bb39431&bb=BO1GlnvTTnC_KKJ9YPD6HR7Jn6-Hyz72hWdG6RchMx-wtm77_FMy2uSegk3nyJlLDyWW0kldE5GFCM6OIc8263HBRr1SddWC9W001yY2jlxRwPCdO_-4EA%3D%3D&xkcb=SoBw67M3-ui70-XRih0FbzkdCdPP&fccid=734cb5a01ee60f80&vjs=3
