Job Title,Company,Location,Salary($),Job-Type,Job-Description,Raw_Link
"Senior Director, Design",Cohere Health,"Remote in Boston, MA","$180,000 - $215,000 a year",Not Provided,"View all Cohere Health jobs in Boston, MA - Boston jobs - Senior Designer jobs in Boston, MASalary Search: Senior Director, Design salaries in Boston, MASee popular questions & answers about Cohere Health",https://www.indeed.com/rc/clk?jk=3621e3a3ee4eefc8&bb=qJPeVsC0bz4c7qow8B9KcWMmZuE4BbBkEw1mAdlh7urUw56kfGMonig2HV2pAfrvUQ9HbjS9nwQiDa7ZVq2GC-AE6tqqHZwXpaugXy_4F38TOPx_PmxjMwXGaufvV2JB&xkcb=SoCb67M3-umve9gXcz0LbzkdCdPP&fccid=2ce3a21e0a968aec&vjs=3
Software Sales,"Vantagepoint ai, LLC","Westchase, FL 33626","$100,000 a year",Full-time,"View all Vantagepoint ai, LLC jobs in Westchase, FL - Westchase jobs - Sales jobs in Westchase, FLSalary Search: Software Sales salaries in Westchase, FLSee popular questions & answers about Vantagepoint ai, LLC",https://www.indeed.com/rc/clk?jk=28e4fc6a657bbe52&bb=qJPeVsC0bz4c7qow8B9KcVYmaLjtlZmieLk-UWnTH4fIf8Nh8VrYKF9dXe_8HD_2eQRYCpVzDTlbsSAM6Y6wldtL7vzF6joRVFjMSOQUDeIkjGjesSaNtXJiM76HJZeD&xkcb=SoAv67M3-umve9gXcz0KbzkdCdPP&fccid=3c14a778776ef983&vjs=3
Post Doctoral Fellow - Artificial Intelligence and Machine Learning,Emory University,"Atlanta, GA 30322",Not Provided,Full-time,"View all Emory University jobs in Atlanta, GA - Atlanta jobs - Post-doctoral Fellow jobs in Atlanta, GASalary Search: Post Doctoral Fellow - Artificial Intelligence and Machine Learning salaries in Atlanta, GASee popular questions & answers about Emory University",https://www.indeed.com/rc/clk?jk=5f92a2433e9004a3&bb=qJPeVsC0bz4c7qow8B9KcaCN5E9-Dn2vbJ-eZ-UmKoL-9kCR48juxpVt9PPIU3Mt6Xzv7vba2Q-nPcmSyDSVH3HDwlkjwVYfsnRPlsdJ46yj_m-H8-ZEuA%3D%3D&xkcb=SoCy67M3-umve9gXcz0JbzkdCdPP&fccid=efe5e2d22a1d29e5&vjs=3
Associate II,"John Snow, Inc","Hybrid work in Boston, MA 02210","$72,246 - $105,837 a year",Full-time,"View all John Snow, Inc jobs in Boston, MA - Boston jobs - Retail Sales Associate II jobs in Boston, MASalary Search: Associate II salaries in Boston, MA",https://www.indeed.com/rc/clk?jk=45144626687579be&bb=qJPeVsC0bz4c7qow8B9KcfOQp6Sphk3JMoncmpccNGQD7tFoB6PhJJqVo_p9sWh44eIYib7b_X_qIp29xuvoEVTGo5cMeuf-N3Q6rkKyespV6Qq83G1YMSEZhZ3lZq-l&xkcb=SoAG67M3-umve9gXcz0IbzkdCdPP&fccid=52f9a4dde3bc5fe5&cmp=JSI-%2526-World-Education&ti=Retail+Sales+Associate+II&vjs=3
Senior AI Engineer - Remote,The Cigna Group,Remote,Not Provided,Not Provided,View all The Cigna Group jobs in Remote - Remote jobs - Senior Engineer jobs in RemoteSalary Search: Senior AI Engineer - Remote salaries in RemoteSee popular questions & answers about The Cigna Group,https://www.indeed.com/rc/clk?jk=87eed957fcd15be9&bb=qJPeVsC0bz4c7qow8B9KcZsTAxMY3LQ6zJoKh2op8iuYul9eBIoTOgW_AymIE2hMDwntcBQsIUcFBKwktFV1BtwqP5BZKMXvNccgjiuuh-HJBjaixio_qw%3D%3D&xkcb=SoCI67M3-umve9gXcz0PbzkdCdPP&fccid=afbf8c270610a38a&vjs=3
Senior Content Designer/UX Writer - Artificial Intelligence,Wells Fargo,"New York, NY","$100,800 - $179,200 a year",Full-time,"View all Wells Fargo jobs in New York, NY - New York jobs - Senior Content Writer jobs in New York, NYSalary Search: Senior Content Designer/UX Writer - Artificial Intelligence salaries in New York, NYSee popular questions & answers about Wells Fargo",https://www.indeed.com/rc/clk?jk=d97968dcbea6bd79&bb=qJPeVsC0bz4c7qow8B9Kcf53nFfZ-3_V71ZhKWtJN3ToJyxqgJRlL53zpto7XYn0yTpcGAvLgTMKTEGjHFvXfqzlP5zV_kfnmAVx0Up4_twhoj75pxTcsA%3D%3D&xkcb=SoA867M3-umve9gXcz0ObzkdCdPP&fccid=78bbcd26e39621f5&vjs=3
Trades Technician - Grounds,Germanna Community College,"Spotsylvania, VA","$36,139 - $44,886 a year",Full-time,"View all Germanna Community College jobs in Spotsylvania, VA - Spotsylvania jobs - Technician jobs in Spotsylvania, VASalary Search: Trades Technician - Grounds salaries in Spotsylvania, VASee popular questions & answers about Germanna Community College",https://www.indeed.com/rc/clk?jk=32754ae253ce59d3&bb=qJPeVsC0bz4c7qow8B9Kceobn_Raplav5f6qYvTiwi-nnzBn7_LDxe-y3elso1f022rYvIEn8K1TqDlRggT-japnLHpKe8aebRaxJRJqw13ymFAhPE6VVt1Y6fDlXoXm&xkcb=SoCh67M3-umve9gXcz0NbzkdCdPP&fccid=1b01e4b7b6764d7e&vjs=3
Area Vice President-AI Sales,Innovaccer,Remote,Not Provided,Not Provided,View all Innovaccer jobs in Remote - Remote jobs - Vice President of Sales jobs in RemoteSalary Search: Area Vice President-AI Sales salaries in RemoteSee popular questions & answers about Innovaccer,https://www.indeed.com/rc/clk?jk=0e50cd9ac9dbfcc3&bb=qJPeVsC0bz4c7qow8B9KcVxaGFFtFjb3LAP16gC1fOdcNGOWjwMHFIbupGUO-ujlO6Owz69uqIttXf85Zx3ETW2KSmGOrtS-9Ul688h9-E2yGF4WVRFCyx--OVs0L9dK&xkcb=SoAV67M3-umve9gXcz0MbzkdCdPP&fccid=f6e1ee07ee227498&vjs=3
AI Engineer,Cornerstone Defense,"Bethesda, MD",Not Provided,Not Provided,"View all Cornerstone Defense jobs in Bethesda, MD - Bethesda jobs - Engineer jobs in Bethesda, MDSalary Search: AI Engineer salaries in Bethesda, MDSee popular questions & answers about Cornerstone Defense",https://www.indeed.com/rc/clk?jk=61b528624c24ea78&bb=qJPeVsC0bz4c7qow8B9KcbbCwJbEP62exq1gEUGdyCKa4X56Wq-iJvFmELbMVF8AUOmkLBQiu_56S7inmTC_OaPoyjsw8dbWAjXM21QkAFfRQKyWqd3eLRQGeiZoQ38M&xkcb=SoD867M3-umve9gXcz0DbzkdCdPP&fccid=c4dad3c95358e466&vjs=3
Chatbot Developer,ADP,"Roseland, NJ 07068",Not Provided,Full-time,"View all ADP jobs in Roseland, NJ - Roseland jobs - Developer jobs in Roseland, NJSalary Search: Chatbot Developer salaries in Roseland, NJSee popular questions & answers about ADP",https://www.indeed.com/rc/clk?jk=d67bcf4a4edb0da6&bb=qJPeVsC0bz4c7qow8B9KcTosRHO2DRh9KXkwU88GgYLnI1KPyitfJg0Ecx5DTwxJdDleq4QPf7rwV859IAwjqw6sYSRH7xCjg3PxZLz_16qgfhs1wDLWCQ%3D%3D&xkcb=SoBI67M3-umve9gXcz0CbzkdCdPP&fccid=e996c2d6855fe778&vjs=3
Competitive Intelligence Lead,"Grammarly, Inc.",Hybrid work in United States,Not Provided,Not Provided,"View all Grammarly, Inc. jobs in United States - United States jobsSalary Search: Competitive Intelligence Lead salariesSee popular questions & answers about Grammarly, Inc.",https://www.indeed.com/rc/clk?jk=416f3bf573d88116&bb=qJPeVsC0bz4c7qow8B9KcZE_PrRmE3B1V9lyGIR0OAOwl0bqfri6YuMDFNBJrBUfgqvhEBgedHB2XHeAdbuauDvEJrJ5mAM7lJFzcOayp2QrVqL8eEq3xobLRNyjtHrC&xkcb=SoDV67M3-umve9gXcz0BbzkdCdPP&fccid=0555014e7bce64c3&vjs=3
"Senior Writer and Editor, AI at Work",Microsoft,United States,"$103,800 - $219,200 a year",Full-time,"View all Microsoft jobs in United States - United States jobs - Senior Writer/Editor jobs in United StatesSalary Search: Senior Writer and Editor, AI at Work salaries in United StatesSee popular questions & answers about Microsoft",https://www.indeed.com/rc/clk?jk=a753f4b4e94242de&bb=qJPeVsC0bz4c7qow8B9KcVID6Kvmi6YDDrOf8TW-gHpTOPgwrin0V4LwQOViDadaWDPpy7X2bNvnU_pUQHpXhcBy1KDzwJhKwjbUHuQlk9ipO1cOm4SHHg%3D%3D&xkcb=SoBh67M3-umve9gXcz0AbzkdCdPP&fccid=734cb5a01ee60f80&vjs=3
AI Data Annotator,Vistatec,United States,Not Provided,Not Provided,View all Vistatec jobs in United States - United States jobsSalary Search: AI Data Annotator salariesSee popular questions & answers about Vistatec,https://www.indeed.com/rc/clk?jk=644269f566114edb&bb=qJPeVsC0bz4c7qow8B9Kcdi3Mcr-LEqPk48mYzls-3yg69idbNSdEveh9V5kM57mKjjzjD0HfQA4KbcmzlCgXwslsBzwOlUcCJOwXrQpMpvKloHUuIVB7A%3D%3D&xkcb=SoDv67M3-umve9gXcz0HbzkdCdPP&fccid=33fede40a40fcf6f&vjs=3
Sustainability Go-to-Market Activation Lead,Microsoft,United States,"$129,200 - $268,900 a year",Full-time,View all Microsoft jobs in United States - United States jobsSalary Search: Sustainability Go-to-Market Activation Lead salariesSee popular questions & answers about Microsoft,https://www.indeed.com/rc/clk?jk=da0e0b51bf349b2b&bb=qJPeVsC0bz4c7qow8B9KcW6QRM_Y9SRyd7r_Ev_lOiaTvG-1Beym18rwwKchnrpZIAVbIaO4G_K7sNpZ87QApeqK8HiKtHkYC6Jbk8zEXLIHSmGOHzLVkA%3D%3D&xkcb=SoBb67M3-umve9gXcz0GbzkdCdPP&fccid=734cb5a01ee60f80&vjs=3
Partner Technology Strategy AI Services,Microsoft,United States,"$103,800 - $219,200 a year",Full-time,View all Microsoft jobs in United States - United States jobs - Partner jobs in United StatesSalary Search: Partner Technology Strategy AI Services salaries in United StatesSee popular questions & answers about Microsoft,https://www.indeed.com/rc/clk?jk=2f0cd40c3bb39431&bb=qJPeVsC0bz4c7qow8B9KcXvjMK32AdLJGTj6eZk7W0Yt4KtlzhxYWt4zWs7xVoxEtLcnNgb3JPyPGDj6ejn1P3csm49CV7D-ZIor5xS4m2d7tByop3iyZA%3D%3D&xkcb=SoDG67M3-umve9gXcz0FbzkdCdPP&fccid=734cb5a01ee60f80&vjs=3
