Job Title,Company,Location,Salary($),Job-Type,Job-Description,Raw_Link
Artificial Intelligence Engineer,Davidayo,Remote,Not Provided,Not Provided,"We also need assistance with getting clients/customers to patronize our business. check out the links below*.
This role requires 30-40 hours a week.",https://www.indeed.com/rc/clk?jk=9a0ec5ab3123ff25&bb=sxAOe0eDvwabLcsVr2XgDyBjp0mvVmHpxDcSD_IOV2wR_BcBzafJ9AP-_JF79gnBMhlMDwcOBWDsQ5yAh50VMuiBNlheK0BA467SWgb6R2FR6Epi8OjLAMIGUHpwy6QR&xkcb=SoAr67M3-uu_t1yU9Z0LbzkdCdPP&fccid=96fc08d3767f5f67&cmp=Davidayo&ti=Business+Intelligence+Developer&vjs=3
JUNIOR VIDEOGRAPHER - TEMP,PUMA,"Somerville, MA 02145 (Assembly Square area)",Not Provided,Not Provided,Bachelor’s Degree in film or video production or equivalent; experience in the footwear; athletic and/or apparel industry is a plus.,https://www.indeed.com/rc/clk?jk=2d85b373e9e69068&bb=sxAOe0eDvwabLcsVr2XgDx5SUXkzbWFNJ4r_LzQl2-RpPq0EDOClkRAzv7VGxg5lHP5EE5HCWJGARcB7iiof5sY1YLs5k-VLNcsyaU0egjaPM_JA4ZHmeg%3D%3D&xkcb=SoCf67M3-uu_t1yU9Z0KbzkdCdPP&fccid=2f6f2e23480ffded&vjs=3
"""HighLevel CRM"" Automation & Reporting Specialist",The Luke Infinger Organization,Remote,"$60,000 - $65,000 a year",Full-time,"Troubleshoot and Resolve HighLevel (CRM) Issues:*.
Identify and address any issues related to automation processes, ensuring seamless functionality.",https://www.indeed.com/pagead/clk?mo=r&ad=-6NYlbfkN0CvPBpZ41-JVQIfqFX6cKRNoV4b-UYN1AVGxFaQcoOz91R_0yD9Tu_8khv4A3iQSuASofzuYVHPoxyiLd9i1f9x9cxC8yoTam2Jo1Oj7kWfzTBYtpTpsd29IOropr1xGQs2zQhFOcYPJAGTuY-1dQ-31e-0eYX12Zo5G847P67gL2zi939KyauKjZt1Gelv8rAMEOKzXzleG2x3ZtHt-4iKIPoy1RZEIKy4CfkzA80G4U32hh7S5jPvQeWhNuY7-uPFRQMXuwecqA2HLXGzTOIHI9rSE2fq31SXruWllQJGQZTHNDsLUSuEk2qyEhZcao9K3yoaTJZxclB-nrEMIPMRUm7rWCmTEK-N-TDo4DoV6b8eB2KstZgEHS_SOyynkhA-o1O1Bqz4mpIf6ij8u3pdFflR-SFAcjlTBK2i2jsNHn3ciUFcccNwNURO-XnsEOaZsGVNnTRGm7eal2mLq_CFGx7OHnc63Mchocn_XYMnIIz2N2-EzdtrD-bIS1gGy0V8tLpHOtN9hzv7LX900bTBinLW-sCcBCfH_m1dL-_Ze4ZP0B2T_CMRZUDSyyunEZRoNzrEZE4HKOEKIqX_YQvI4SVSeJoqmZ6IwNlfARyZ7kf8MujU0XUMsWadi46jzbdtJT7SkoDk3rstiAv1xXtzPrs6t_8IKA0juGLHqj1BQZYWdLj9nJRpiJbxLOLVbdU=&xkcb=SoD26_M3-uu_t1yU9Z0JbzkdCdPP&camk=nUmJqO2E8rjnpqVQ7MIMzQ==&p=2&fvj=1&vjs=3
Data Scientist,Microsoft,"Redmond, WA 98052 (Overlake area)",Not Provided,Not Provided,"CHAT Data Science, a branch of CHAT, provides data science support, machine learning and artificial intelligence solutions, and advanced visualizations to cloud…",https://www.indeed.com/rc/clk?jk=4da6aec1310a5521&bb=sxAOe0eDvwabLcsVr2XgD2nSb5psKshNtfycCPHhs0U3UCzI1Tzma9Q641cQ5tEVpErUBSh-cTecu5BDe12xeFPMrxaUbIc8QncAtPMw7cW7oKruIBO6sA%3D%3D&xkcb=SoC267M3-uu_t1yU9Z0IbzkdCdPP&fccid=734cb5a01ee60f80&vjs=3
Artificial Intelligence Specialist,SNAPtivities,Remote,$15 - $25 an hour,Part-time +2,"In this role, you will play a key role in developing and implementing AI solutions to enhance our operations, improve decision-making, and automate tasks.",https://www.indeed.com/rc/clk?jk=2ae39d625ed4e6bf&bb=sxAOe0eDvwabLcsVr2XgD_qVYAFb134BecVoODv7rQM1ro9RfQhcWWH6T2EVtvmXeJhwviDw07puk2SXsemd0SY9TVBo-vt-KxNc2K3HCqEmSL-CSbbN8A7o3M-72r0C&xkcb=SoA467M3-uu_t1yU9Z0PbzkdCdPP&fccid=c57f616a4a2a81c0&cmp=Snaptivities&ti=Intelligence+Specialist&vjs=3
Artificial Intelligence Engineer,J & S Consulting,"Hybrid work in Detroit, MI 48201",Not Provided,Not Provided,"AI expertise, Python, NLP, Computer Vision, Audio Processing, GCP, LangChain, Kubernetes.
3D file formats (e.g., OBJ, FBX), AR/MR/VR development experience.",https://www.indeed.com/rc/clk?jk=02c3e5edc00eb271&bb=sxAOe0eDvwabLcsVr2XgD-Fo6GfWIcKAc1yjxPXZD5LhEZZIC7ntnbqLs8H4bOznnc_HHwYJ7GiorT0uDj2FRWJan5dNVmsigpX1QA3CpJ1WNmg6zZh53AvSO0-2CvYS&xkcb=SoCM67M3-uu_t1yU9Z0ObzkdCdPP&fccid=cee8b1feb66c033e&cmp=AVA-Consulting&ti=Business+Intelligence+Developer&vjs=3
Server Break/Fix L1,"Milestone Technologies, Inc.","Phoenix, AZ",Not Provided,Not Provided,"As a Data Center Technician, you will be working alongside Data Center Leads in supporting installs, troubleshooting, and maintaining servers, networking…",https://www.indeed.com/rc/clk?jk=72571b06bd4dcfbf&bb=sxAOe0eDvwabLcsVr2XgD6zeZOLqJcEbh1ea-Gk3jDboEm_OPA84oGeIAjPXeGMqv_EhfPIIIvPIq3FkGeDZatPs4oJFZlgDfBF2x_EO1eN839Yhu3Am0gkPY1jofgZG&xkcb=SoAR67M3-uu_t1yU9Z0NbzkdCdPP&fccid=2a4e80613bf74af0&vjs=3
Application Support Specialist,Sirona Medical,"Remote in San Francisco Bay Area, CA",Not Provided,Not Provided,"But they desperately need better, user-friendly software that cuts clicks and optimizes diagnostic time.
Your primary focus will be on promptly addressing and…",https://www.indeed.com/rc/clk?jk=dfb2ab98109a675d&bb=sxAOe0eDvwabLcsVr2XgD4-GZ-oYYVHyysbcR3muirgjg6qMKsG5Tey8u5ufOuNgjK5j4OuEmYPxgmllenKoPwb5wU5CcC9JsAahd7nv3xwF7GQeSs4I4LQDJGZrKOuI&xkcb=SoCl67M3-uu_t1yU9Z0MbzkdCdPP&fccid=3ba0932fc2a51883&vjs=3
Document Automation Sales / Consulting,"Reynolds Business Systems, Inc.","Remote in Emmaus, PA 18049","$50,000 - $125,000 a year",Full-time,"As an Automation Consultant, you will be responsible for analyzing and optimizing business processes through the implementation of document automation…",https://www.indeed.com/pagead/clk?mo=r&ad=-6NYlbfkN0BtEtuaOVXPVpcGpt5KE87MYbkH9MFHsiwSG_cVTLZ8tgr25CVjHCh6s1vsB82UmV1hba04sBchazyCQHVaifbtI8ofEM82-_g0K1_EeCm_qaAQL1Nv4Gz58MkKOLoOfZrprHEbcKXSzybhlDsfO1aJE5X4WadsWGgFZiuaWwKfGs8a70LRhLrBAsVFVQVq1mB3RB7Ep6EdY-EjknKao6OmPEwbNkFUtfUzsJN0hbZGlcZMrFxEGablTo_bugD_cxhbHoNpDeTprgdZ11U6syID87WjqZhpoj6JWYhGuaU0k-Ij_72KwPsZUAWmEQ2YmR3s48De1MsHcXeQ014-ugwqJ5dB4vLzOVkrGXOKaQAsstpc1laUeAEmZKJD-3D3DOiVppJ2iJmyo9668gVB-RER0GipETM7SwWSRYuSKv1V1o_XBa2zPFtRX9UHHk-559WT-ml5nFEksm-H7NMt5KHSUzqopUP_vGt8UtyMIAnn57dFZSW89Qoj9S6OIzldkVLDRSFOAPcM2DeHFhZLsf1ozryZasnS17V6-K53Q5ff07GUdTXNTfX6WD_rlpMR3bD_xCyRw7ZY7j4Dmid7dsykG_9olcTDF1qDKedlESbwQiQXKC5I1ViztPgkVoZ-v8EDPNd38lUyV-0viFxdH7kcsk7cJXdie0FuXr_iAcC9izp2nD--_Wiw&xkcb=SoC46_M3-uu_t1yU9Z0DbzkdCdPP&camk=nUmJqO2E8rhNQdPBLpP6nw==&p=8&fvj=1&vjs=3
Language Services Consultant,Appen,Remote,Not Provided,Not Provided,"Native/near native in Korean (South Korea).
Highly fluent in spoken/written English (near-native is a plus).
12-14 hours per month with occasional need for more…",https://www.indeed.com/rc/clk?jk=ed8f27892629cfe1&bb=sxAOe0eDvwabLcsVr2XgD1sDjt-mBDoKKC7greMur6KwGxQLTa0e6siFJx72kq5vFvVhVf2KPUkbkVRd-R7ErNfRpvavV0wgOBMfHtagT-TtLKGY1kW_61fZS_pc-4e6&xkcb=SoD467M3-uu_t1yU9Z0CbzkdCdPP&fccid=28225b816bbd804f&vjs=3
FREELANCE AUDIO TRANSLATOR,Little Dot Studios Americas,"Hybrid work in Los Angeles, CA 90045",Not Provided,Not Provided,"The content requires verification and refinement in three languages: French, Spanish, and Portuguese.
The role involves ensuring that the translations are…",https://www.indeed.com/rc/clk?jk=3c507991a7c9fea0&bb=sxAOe0eDvwabLcsVr2XgDzkl0jKjz9fgkTTHiwTSY0K7g2R53HosIV7qvbh5lDDu8NJ6L2hEXPHLUcjMuL_AMg_6xgFyvJ8cnYoMLuY4t0uT3VzpG8hioMHHkPvyY6Pr&xkcb=SoBl67M3-uu_t1yU9Z0BbzkdCdPP&fccid=dd616958bd9ddc12&vjs=3
Newsletter Producer,Newsweek,Remote,Not Provided,Not Provided,The ideal candidate will have a keen eye for identifying reader trends quickly and reacting promptly to create new offerings that drive high click-throughs and…,https://www.indeed.com/rc/clk?jk=7dc99e1118260168&bb=sxAOe0eDvwabLcsVr2XgDz6btJKMecSJaNfAVxOh5rgPzhABbRMCZTrRVNikdCJfvbXUuMbRzX_d09-7BYyZE3HxZ5mVCqgOsaFClYabeUhcKUnlMiFaGssQFpMGxmIW&xkcb=SoDR67M3-uu_t1yU9Z0AbzkdCdPP&fccid=5ca7fdb9fc145648&vjs=3
Document Specialist (Remote),Apixio,"Tampa, FL","$25,000 - $32,000 a year",Not Provided,"Main role is to help perform document management capabilities including.
Processing documents appropriately and QAing content while following internal.",https://www.indeed.com/rc/clk?jk=7442ea9371bd139b&bb=sxAOe0eDvwabLcsVr2XgD-VjfTsD2QbUOb3eP66oNjU-LUbS0fcLuhCCeygKhUNkWCq0VQpBIRiYIOjKQ2qkMRZjkroR2yRlrnvREf3Hvr6bbjZOARDGFuyRijs4K9yd&xkcb=SoBf67M3-uu_t1yU9Z0HbzkdCdPP&fccid=d709010bf50f2482&vjs=3
"Manager, Data Science - AI Systems",Capital One,"Plano, TX 75023",Not Provided,Full-time,"Partner with a cross-functional team of data scientists, software engineers, and product managers to deliver a product customers love.",https://www.indeed.com/pagead/clk?mo=r&ad=-6NYlbfkN0C3j_zLGvpMLCdiZ0WC46XqVTA1VMZzOzKXPhAXwYlrNc2ZimNTpf2_4MHwNa_erOx8tkDrSRFj-YW2d-1RzstTLQjyfgowLVCYyDMJauBslxgst6s0XBmpH36sY0DRBLdgyPB3aXnbwJAMw4Fq0LQAN-QyDRAWkj1bi_NcnBU_Iz6qrb8IFQDzv2kMdrKaxgQRAUlkEMubSRFqi2u-5j_IMbiDeMzNrbNJyRpTziroyrl8sSPm2aezARqW872kMnu3SGbNSXeQFlRpHJvzegV6wyBhM-wRuPKuTrOMISTWoF1rqVDnJ6Z_RgKplP5USclsSXzpsikarQEPUkFR8fEA9A2W9G2GPy6UukEk37drmZD38XOzkx0lkruK_ytR6m0H6dm2mUy9ePdAs6BOcjxKL8ZtFIfq6d1j0TGiG2RYB6VahOstAuz8PY6ThVmTJLbmlv-onrGlhQMIjUo-GaYB5zY4ssrVqDVAOSsgXHK4XqcnWaDu0RefcucnPEG8NAqdW2cYJHHCN7A4xuzxfY2dUYeZ36-Pv3Y9MI1O0QPDYM_xVCrV0hQB_QFK7nIVK_ILRa-MZf4sKm3mFR033taVPbiaUywsA5JiOWmuVc1eKKYmo56N95fP-tmtUxNo0D6z_OOaZhlLxA0omVTEd9UTooZhMHneYr30ntynHku7IoU3mvX388X2p-vBEzdVO0MoHOstdAxugADp_aTKOkLz8MeSxfK8rY-GBOiAUzPYBzuz79_rt1CRbCRbjgnMfFCYV3wzhivJn_-r1I4a6692m9NgvnFaFxyB00iYpeWmDHChXbaJRdyxiXCRC5Ts2yElV4Q28Qp9nGaqzlVCc6nUrwuECVPkW8OVJEA26fYmD4HecIS7LwZ9nJ61sh8vgQe7QcopDANIxOClX4Uua-s42tRMDbtCoTmZf-86PM1Ce6Ao1IF78dMHYQ-YLr_QUl0cvnK0MpZjKAlgc-EVy3WVkiVfvKuI1LfjX_kMgxt_S63lU4Z2to2X_0Psay2O3VUBfpIBLzhhv_JOQztnaCBBG9oGTeMRJgBtlP9T8f8i-GfN3uynYnImlEDJ7vRvXpiRPb0qYCiGlweOQkbDeWbN8XjWzCn7Sh1hnUPFu4kpuy1dehZaIVKODmBb1I7S__EBatLOaT72lDAdT4Mr1N9X5wBJdsUc2WoNpsCMF6Rd7X50DKfdbxj62TjD7ERCt0p1eXzyfI8pIeEEypNfJbDzVx-J87-qmy10k_nINMcMYCgHe8YD5wJTqm0tE2sclJ5MGDZwn1LkqslQAj-YnNLG4BGC2OcTHgvCkaK6HTiKBcuRqmHppkN0&xkcb=SoAf6_M3-uu_t1yU9Z0GbzkdCdPP&camk=4HOcmqOLYrByKel4K0fjog==&p=13&fvj=0&vjs=3
Private Tutor,Plato+,"Hybrid work in Palo Alto, CA 94301",$50 - $70 an hour,Part-time,We are seeking experienced and enthusiastic educators who are experts in their subject areas and want to create genuine connections with their students.,https://www.indeed.com/rc/clk?jk=7c42a7bbd19e8771&bb=sxAOe0eDvwabLcsVr2XgD2nSb5psKshN4b7lgN-MYvTK6MAv030EIwT7lqpZ7NxsQj9A3fsX7XYK0Z74V_xgYDW0AP-24YM-rmOE43TZUNQNiFcoqOLx9qCz-vWGdyiM&xkcb=SoB267M3-uu_t1yU9Z0FbzkdCdPP&fccid=a32b65acaed22558&cmp=Plato%252B&ti=Tutor&vjs=3
